link_id,page_no,link_text,surrounding_text,link_destination,link_domain
1090,188,"(2016)258 CLR 308,","accused of the intent necessary for murder: (R v Baden-Clay (2016)258 CLR 308, 332 [74]; [2016]HCA 35, citing R v Ciantar (2006)16 VR",https://jade.io/article/489654,jade
1091,188,332,"intent necessary for murder: (R v Baden-Clay (2016)258 CLR 308, 332 [74]; [2016]HCA 35, citing R v Ciantar (2006)16 VR 26,",https://jade.io/article/489654/section/140833,jade
1092,188,[74];,"necessary for murder: (R v Baden-Clay (2016)258 CLR 308, 332 [74]; [2016]HCA 35, citing R v Ciantar (2006)16 VR 26, [38]-[40],",https://jade.io/article/489654/section/140833,jade
1093,188,"[2016]HCA 35,","for murder: (R v Baden-Clay (2016)258 CLR 308, 332 [74]; [2016]HCA 35, citing R v Ciantar (2006)16 VR 26, [38]-[40], [65]-[67]; [2006]VSCA",https://jade.io/article/489654,jade
1094,188,"[38]-[40],","[74]; [2016]HCA 35, citing R v Ciantar (2006)16 VR 26, [38]-[40], [65]-[67]; [2006]VSCA 263; R v DAN [2007]QCA 66, [89], [99]).",https://jade.io/article/71949/section/6610,jade
1095,188,"[38]-[40],","[74]; [2016]HCA 35, citing R v Ciantar (2006)16 VR 26, [38]-[40], [65]-[67]; [2006]VSCA 263; R v DAN [2007]QCA 66, [89], [99]).",https://jade.io/article/71949/section/6610,jade
1096,188,"[38]-[40],","[74]; [2016]HCA 35, citing R v Ciantar (2006)16 VR 26, [38]-[40], [65]-[67]; [2006]VSCA 263; R v DAN [2007]QCA 66, [89], [99]).",https://jade.io/article/71949/section/6610,jade
1097,188,[65]-[67];,"[2016]HCA 35, citing R v Ciantar (2006)16 VR 26, [38]-[40], [65]-[67]; [2006]VSCA 263; R v DAN [2007]QCA 66, [89], [99]). See",https://jade.io/article/71949/section/2103,jade
1098,188,[65]-[67];,"[2016]HCA 35, citing R v Ciantar (2006)16 VR 26, [38]-[40], [65]-[67]; [2006]VSCA 263; R v DAN [2007]QCA 66, [89], [99]). See",https://jade.io/article/71949/section/2103,jade
1099,188,[65]-[67];,"[2016]HCA 35, citing R v Ciantar (2006)16 VR 26, [38]-[40], [65]-[67]; [2006]VSCA 263; R v DAN [2007]QCA 66, [89], [99]). See",https://jade.io/article/71949/section/2103,jade
1100,188,[2006]VSCA 263;,"35, citing R v Ciantar (2006)16 VR 26, [38]-[40], [65]-[67]; [2006]VSCA 263; R v DAN [2007]QCA 66, [89], [99]). See also as",https://jade.io/article/71949,jade
1101,188,"[2007]QCA 66,","(2006)16 VR 26, [38]-[40], [65]-[67]; [2006]VSCA 263; R v DAN [2007]QCA 66, [89], [99]). See also as stated in R v Andres",https://jade.io/article/57118,jade
1102,188,"[89],","26, [38]-[40], [65]-[67]; [2006]VSCA 263; R v DAN [2007]QCA 66, [89], [99]). See also as stated in R v Andres [2015]QCA",https://jade.io/article/57118/section/1023,jade
1103,188,[99]).,"[38]-[40], [65]-[67]; [2006]VSCA 263; R v DAN [2007]QCA 66, [89], [99]). See also as stated in R v Andres [2015]QCA 167",https://jade.io/article/57118/section/779,jade
1104,188,[2015]QCA 167,"[89], [99]). See also as stated in R v Andres [2015]QCA 167 at [131]. But see R v Oliver [2016]QCA 27 at",https://jade.io/article/407749,jade
1105,188,[131].,"also as stated in R v Andres [2015]QCA 167 at [131]. But see R v Oliver [2016]QCA 27 at [55], [58],",https://jade.io/article/407749/section/2212,jade
1106,188,[2016]QCA 27,"Andres [2015]QCA 167 at [131]. But see R v Oliver [2016]QCA 27 at [55], [58], [63]: ‘Whilst … matters, individually, may have",https://jade.io/article/447273,jade
1107,188,"[55],","at [131]. But see R v Oliver [2016]QCA 27 at [55], [58], [63]: ‘Whilst … matters, individually, may have been equally",https://jade.io/article/447273/section/140529,jade
1108,188,"[58],","[131]. But see R v Oliver [2016]QCA 27 at [55], [58], [63]: ‘Whilst … matters, individually, may have been equally consistent",https://jade.io/article/447273/section/140806,jade
1109,188,[63]:,"But see R v Oliver [2016]QCA 27 at [55], [58], [63]: ‘Whilst … matters, individually, may have been equally consistent with",https://jade.io/article/447273/section/715,jade
1110,188,"[1989]1 Qd R 572,","of guilt can be safely drawn. See R v Melrose [1989]1 Qd R 572, 574-575. For an example of flight during trial see R",https://jade.io/citation/415777,jade
1111,188,574-575.,"safely drawn. See R v Melrose [1989]1 Qd R 572, 574-575. For an example of flight during trial see R v",https://jade.io/citation/415777/section/3508,jade
1112,188,[2000]QCA 73.,trial see R v Festa (2000)111 A Crim R 60; [2000]QCA 73. It is not essential that the jury be told in,https://jade.io/article/166541,jade
1113,188,"[1993]2 Qd R 195,","not necessarily conclusive of guilt (see R v El Adl [1993]2 Qd R 195, 198). Formatting Tests (Test Edition) 188 Test publisher for QLD",https://jade.io/citation/437410,jade
1114,188,198).,"guilt (see R v El Adl [1993]2 Qd R 195, 198). Formatting Tests (Test Edition) 188 Test publisher for QLD bench",https://jade.io/citation/437410/section/140079,jade
1115,189,(1996)87 A Crim R 407.,"it. His Honour’s formulation was endorsed in R v Power (1996)87 A Crim R 407. However, since the fact of flight could seldom, if ever,",https://jade.io/citation/2366896,jade
1116,189,[1992]HCA 19.,"reasonable doubt’. See Edwards v The Queen (1992)173 CLR 653; [1992]HCA 19. It should be noted however, that the distinction between ‘indispensable",https://jade.io/article/67678,jade
1117,189,[1998]HCA 21,"see, for example Gipp v The Queen (1998)194 CLR 106; [1998]HCA 21 and Penney v The Queen (1998)72 ALJR 1316; [1998] HCA",https://jade.io/article/68042,jade
1118,189,[1998],[1998]HCA 21 and Penney v The Queen (1998)72 ALJR 1316; [1998] HCA 51. 4.11.3 Suggested direction [Last reviewed: March 2026] (For,https://jade.io/article/68075,jade
1119,189,HCA 51.,21 and Penney v The Queen (1998)72 ALJR 1316; [1998] HCA 51. 4.11.3 Suggested direction [Last reviewed: March 2026] (For flight—to be,https://jade.io/article/68075,jade
1120,191,"[2012]1 Qd R 573,","a co-accused. Meaning of incontrovertible verdict In R v Jobling [2012]1 Qd R 573, Jobling and his co-accused(Hinschen)were charged with the murder of Jobling’s",https://jade.io/article/210409,jade
1121,192,"[2023]QCA 210,","by Rafter AJ in the trial preceding R v Spencer [2023]QCA 210, a case in which the appellant(Spencer) was charged with murder.",https://jade.io/article/1052132,jade
1122,192,(1992) 29 NSWLR 242;,of a co-offender is not relevant: see R v Howard (1992) 29 NSWLR 242; Hui Chi-Ming v The Queen [1992] 1 AC 34. The,https://jade.io/article/806630,jade
1123,192,[1992] 1 AC 34.,Howard (1992) 29 NSWLR 242; Hui Chi-Ming v The Queen [1992] 1 AC 34. The principle of the incontrovertibility of an acquittal clearly applies,https://jade.io/citation/2757330,jade
1124,193,"[2023]QCA 210,","to above was not challenged on appeal (R v Spencer [2023]QCA 210, [153]). However, it was argued that a miscarriage of justice",https://jade.io/article/1052132,jade
1125,193,[153]).,"was not challenged on appeal (R v Spencer [2023]QCA 210, [153]). However, it was argued that a miscarriage of justice occurred",https://jade.io/article/1052132/section/2501,jade
1126,194,"[1999]QCA 270,","and is best avoided(see Thomas JA(in dissent)in R v C [1999]QCA 270, [28]). Generally, a defendant is not permitted to lead ‘alibi’",https://jade.io/article/545037,jade
1127,194,[28]).,"best avoided(see Thomas JA(in dissent)in R v C [1999]QCA 270, [28]). Generally, a defendant is not permitted to lead ‘alibi’ evidence",https://jade.io/article/545037/section/140558,jade
1128,194,"(1996)90 A Crim R 213,","Rossborough (1985)81 Cr App R 139). In R v Heuston (1996)90 A Crim R 213, Gleeson CJ noted at 217 that the actions of the",https://jade.io/citation/2672367,jade
1129,194,217,"Heuston (1996)90 A Crim R 213, Gleeson CJ noted at 217 that the actions of the prosecutor in tendering a notice",https://jade.io/citation/2672367/section/140452,jade
1130,194,[1993]HCA 63,"in conformity with Edwards v The Queen (1993)178 CLR 193; [1993]HCA 63 (see also R v J (No 2) [1998]3 VR 602,",https://jade.io/article/67796,jade
1131,194,"[1998]3 VR 602,","193; [1993]HCA 63 (see also R v J (No 2) [1998]3 VR 602, 631; Graham v The Queen (2000)116 A Crim R 108;",https://jade.io/article/538268,jade
1132,194,631;,"(see also R v J (No 2) [1998]3 VR 602, 631; Graham v The Queen (2000)116 A Crim R 108; [2000]TASSC",https://jade.io/article/538268/section/141027,jade
1133,194,[2000]TASSC 153).,631; Graham v The Queen (2000)116 A Crim R 108; [2000]TASSC 153). See Benchbook CChapter 4.11 Flight and Other Post-Offence Conduct as,https://jade.io/article/180544,jade
1134,194,"[2002]HCA 45,","and . In Dyers v The Queen (2002)210 CLR 285; [2002]HCA 45, the High Court held it would be a misdirection to",https://jade.io/article/68356,jade
1135,196,"[2023]QCA 222,","4.14.2 Commentary [Last reviewed: February 2026] In R v Smart [2023]QCA 222, Boddice JA(with whom Dalton and Flanagan JJA agreed)outlined the law",https://jade.io/article/1054307,jade
1136,196,"[2017] 2 Qd R 401,","truth’”. [86] As McMurdo JA explained in R v SCL [2017] 2 Qd R 401, 417 [61]: “It was what (if anything) the lie itself",https://jade.io/article/462687,jade
1137,196,417,"explained in R v SCL [2017] 2 Qd R 401, 417 [61]: “It was what (if anything) the lie itself revealed",https://jade.io/article/462687/section/140807,jade
1138,196,[61]:,"in R v SCL [2017] 2 Qd R 401, 417 [61]: “It was what (if anything) the lie itself revealed about",https://jade.io/article/462687/section/140807,jade
1139,197,[1993]HCA 63.,the case of Edwards v The Queen (1993)178 CLR 193; [1993]HCA 63. If the prosecution wishes to use the lie in this,https://jade.io/article/67796,jade
1140,197,[2010]QCA 342v,"Benchbook Chapter 4.15 Lies Told by Defendant)is required(see also R [2010]QCA 342v Sheppard[2011]QCA 386 ; cf R v Lacey ,[81],[83]and[153]). Where a",https://jade.io/article/207376,jade
1141,197,Sheppard[2011]QCA 386,"4.15 Lies Told by Defendant)is required(see also R [2010]QCA 342v Sheppard[2011]QCA 386 ; cf R v Lacey ,[81],[83]and[153]). Where a defendant’s lie",https://jade.io/article/259582,jade
1142,197,[2000]HCA 28).,"of the offence(see Zoneff v The Queen (2000)200 CLR 234; [2000]HCA 28). In R v SDU [2022]QCA 176, Henry J at [19]",https://jade.io/article/68195,jade
1143,197,"[2022]QCA 176,","Queen (2000)200 CLR 234; [2000]HCA 28). In R v SDU [2022]QCA 176, Henry J at [19] explained that Zoneff suggested a direction",https://jade.io/article/946420,jade
1144,197,[19],"28). In R v SDU [2022]QCA 176, Henry J at [19] explained that Zoneff suggested a direction which may be given",https://jade.io/article/946420/section/140543,jade
1145,197,245,"suggested direction in Zoneff v The Queen (2000)200 CLR 234, 245 [23]; [2000]HCA 28, [23]. The direction has been modified to",https://jade.io/article/68195/section/140122,jade
1146,197,[23];,"direction in Zoneff v The Queen (2000)200 CLR 234, 245 [23]; [2000]HCA 28, [23]. The direction has been modified to take",https://jade.io/article/68195/section/140122,jade
1147,197,"[2000]HCA 28,","in Zoneff v The Queen (2000)200 CLR 234, 245 [23]; [2000]HCA 28, [23]. The direction has been modified to take into account",https://jade.io/article/68195,jade
1148,197,[23].,"v The Queen (2000)200 CLR 234, 245 [23]; [2000]HCA 28, [23]. The direction has been modified to take into account the",https://jade.io/article/68195/section/140122,jade
1149,197,[2010]QCA 342.,observations of the Court of Appeal in R v Sheppard [2010]QCA 342. The suggested direction deliberately avoids any suggestion that it is,https://jade.io/article/207376,jade
1150,197,[2003]HCA 40).,be used impermissibly(see Dhanhoa v The Queen (2003)217 CLR 1; [2003]HCA 40). The last paragraph of the suggested direction is taken from,https://jade.io/article/68411,jade
1151,197,(2001)122 A Crim,"the suggested direction is taken from Chevathen v The Queen (2001)122 A Crim R 441,[28]-[32]; [2001]QCA 337,[28]-[32]. For an example of a direction",https://jade.io/article/167172,jade
1152,197,"R 441,[28]-[32];","is taken from Chevathen v The Queen (2001)122 A Crim R 441,[28]-[32]; [2001]QCA 337,[28]-[32]. For an example of a direction suggested by",https://jade.io/article/167172,jade
1153,197,"[2001]QCA 337,[28]-[32].","from Chevathen v The Queen (2001)122 A Crim R 441,[28]-[32]; [2001]QCA 337,[28]-[32]. For an example of a direction suggested by the Court",https://jade.io/article/167172,jade
1154,197,"[2010]QCA 150,","the time of the subject event, see R v Frank [2010]QCA 150, [43](see also R v Scott [2011]QCA 343). The suggested direction",https://jade.io/article/181805,jade
1155,197,[43](see,"of the subject event, see R v Frank [2010]QCA 150, [43](see also R v Scott [2011]QCA 343). The suggested direction is",https://jade.io/article/181805/section/1154,jade
1156,197,[2011]QCA 343).,"R v Frank [2010]QCA 150, [43](see also R v Scott [2011]QCA 343). The suggested direction is intended to avoid the risk of",https://jade.io/article/258305,jade
1157,197,[19];,"lies by a complainant(OKS v Western Australia (2019)265 CLR 268, [19]; [2019]HCA 10, [19]). Formatting Tests (Test Edition) 197 Test publisher",https://jade.io/article/638270/section/140543,jade
1158,197,"[2019]HCA 10,","by a complainant(OKS v Western Australia (2019)265 CLR 268, [19]; [2019]HCA 10, [19]). Formatting Tests (Test Edition) 197 Test publisher for QLD",https://jade.io/article/638270,jade
1159,197,[19]).,"complainant(OKS v Western Australia (2019)265 CLR 268, [19]; [2019]HCA 10, [19]). Formatting Tests (Test Edition) 197 Test publisher for QLD bench",https://jade.io/article/638270/section/140543,jade
1160,199,"[2023]QCA 222,","4.15.2 Commentary [Last reviewed: June 2025] In R v Smart [2023]QCA 222, Boddice J(with whom Dalton and Flanagan JJA agreed)outlined the law",https://jade.io/article/1054307,jade
1161,199,[2017] 2 Qd R 401,truth’”. [86] As McMurdo JA explained in R v SCL [2017] 2 Qd R 401 at 417 [61]: “It was what (if anything) the lie,https://jade.io/article/462687,jade
1162,199,417,in R v SCL [2017] 2 Qd R 401 at 417 [61]: “It was what (if anything) the lie itself revealed,https://jade.io/article/462687/section/140807,jade
1163,199,[61]:,R v SCL [2017] 2 Qd R 401 at 417 [61]: “It was what (if anything) the lie itself revealed about,https://jade.io/article/462687/section/140807,jade
1164,200,(1993)178 CLR 193)at,"implicate him in(the commission)of the offence’: see R v Edwards (1993)178 CLR 193)at [211], [363], as explained in Zoneff v The Queen (2000)200",https://jade.io/article/67796,jade
1165,200,"[211],","commission)of the offence’: see R v Edwards (1993)178 CLR 193)at [211], [363], as explained in Zoneff v The Queen (2000)200 CLR",https://jade.io/article/67796/section/1703,jade
1166,200,"[363],","the offence’: see R v Edwards (1993)178 CLR 193)at [211], [363], as explained in Zoneff v The Queen (2000)200 CLR 234",https://jade.io/article/67796/section/18982,jade
1167,200,(2000)200 CLR 234,"193)at [211], [363], as explained in Zoneff v The Queen (2000)200 CLR 234 at [17]. See also R v Hennig [2010]QCA 244 and",https://jade.io/article/68195,jade
1168,200,[17].,explained in Zoneff v The Queen (2000)200 CLR 234 at [17]. See also R v Hennig [2010]QCA 244 and R v,https://jade.io/article/68195/section/140542,jade
1169,200,[2010]QCA 244,(2000)200 CLR 234 at [17]. See also R v Hennig [2010]QCA 244 and R v Sheppard [2010]QCA 342. In R v Nash,https://jade.io/article/207326,jade
1170,200,[2010]QCA 342.,"also R v Hennig [2010]QCA 244 and R v Sheppard [2010]QCA 342. In R v Nash [2020]QCA 127, Boddice J(as his Honour",https://jade.io/article/207376,jade
1171,200,"[2020]QCA 127,","and R v Sheppard [2010]QCA 342. In R v Nash [2020]QCA 127, Boddice J(as his Honour then was)(with whom Sofronoff P and",https://jade.io/article/752495,jade
1172,200,"[2022]QCA 180,","would implicate him in the offence.’ In R v WBS [2022]QCA 180, Dalton JA said at [20], citing R v Wildy (2011)111",https://jade.io/article/946827,jade
1173,200,"[20],","In R v WBS [2022]QCA 180, Dalton JA said at [20], citing R v Wildy (2011)111 SASR 189, [195] [20]: It",https://jade.io/article/946827/section/318,jade
1174,200,"(2011)111 SASR 189,","180, Dalton JA said at [20], citing R v Wildy (2011)111 SASR 189, [195] [20]: It is not all inculpatory post-offence conduct which",https://jade.io/article/256452,jade
1175,200,[195],"said at [20], citing R v Wildy (2011)111 SASR 189, [195] [20]: It is not all inculpatory post-offence conduct which will",https://jade.io/article/256452/section/3430,jade
1176,200,[20]:,"at [20], citing R v Wildy (2011)111 SASR 189, [195] [20]: It is not all inculpatory post-offence conduct which will attract",https://jade.io/article/256452/section/318,jade
1177,200,"[1999]2 Qd R 529,","and care in the use of this direction (see Brennan [1999]2 Qd R 529, [531]; R v Walton and Harman [2001]QCA 309 at [61];",https://jade.io/citation/437472,jade
1178,200,[531];,"use of this direction (see Brennan [1999]2 Qd R 529, [531]; R v Walton and Harman [2001]QCA 309 at [61]; R",https://jade.io/citation/437472/section/58496,jade
1179,200,[2001]QCA 309,"[1999]2 Qd R 529, [531]; R v Walton and Harman [2001]QCA 309 at [61]; R v Dykstra [2011]QCA 175 [13]; R v",https://jade.io/article/167137,jade
1180,200,[61];,"529, [531]; R v Walton and Harman [2001]QCA 309 at [61]; R v Dykstra [2011]QCA 175 [13]; R v Ogunseye [2024]QCA",https://jade.io/article/167137/section/140807,jade
1181,200,[2011]QCA 175,Walton and Harman [2001]QCA 309 at [61]; R v Dykstra [2011]QCA 175 [13]; R v Ogunseye [2024]QCA 152 at [43]). See R,https://jade.io/article/246741,jade
1182,200,[13];,Harman [2001]QCA 309 at [61]; R v Dykstra [2011]QCA 175 [13]; R v Ogunseye [2024]QCA 152 at [43]). See R v,https://jade.io/article/246741/section/140536,jade
1183,200,[2024]QCA 152,[61]; R v Dykstra [2011]QCA 175 [13]; R v Ogunseye [2024]QCA 152 at [43]). See R v Chang (2003)7 VR 236 as,https://jade.io/article/1087633,jade
1184,200,[43]).,Dykstra [2011]QCA 175 [13]; R v Ogunseye [2024]QCA 152 at [43]). See R v Chang (2003)7 VR 236 as to the,https://jade.io/article/1087633/section/1154,jade
1185,200,(2003)7 VR 236,v Ogunseye [2024]QCA 152 at [43]). See R v Chang (2003)7 VR 236 as to the circumstances in which an Edwards direction should,https://jade.io/article/71024,jade
1186,200,[2010]QCA 150,"case is being put: see Zoneff at[244][17], R v Frank [2010]QCA 150 at [41]. However, an Edwards direction will only be required",https://jade.io/article/181805,jade
1187,200,[41].,"put: see Zoneff at[244][17], R v Frank [2010]QCA 150 at [41]. However, an Edwards direction will only be required in these",https://jade.io/article/181805/section/140829,jade
1188,200,Queen(2003)217,that the lie is evidence of guilt (Dhanhoa v The Queen(2003)217 CLR 1 ). Formatting Tests (Test Edition) 200 Test publisher,https://jade.io/article/68411,jade
1189,200,Queen(2003)217 CLR 1,that the lie is evidence of guilt (Dhanhoa v The Queen(2003)217 CLR 1 ). Formatting Tests (Test Edition) 200 Test publisher for QLD,https://jade.io/article/68411,jade
1190,201,(2004)146 A Crim R 131,not of some lesser offence. See the case of Meko (2004)146 A Crim R 131 in which the WA Court of Criminal Appeal discussed possible,https://jade.io/article/143347,jade
1191,201,[2001]QCA 272,of alternative charges. See also R v Box & Martin [2001]QCA 272 at [7] and [8]; and R v Wehlow (2001)122 A,https://jade.io/article/167107,jade
1192,201,[7],See also R v Box & Martin [2001]QCA 272 at [7] and [8]; and R v Wehlow (2001)122 A Crim R,https://jade.io/article/167107/section/140705,jade
1193,201,[8];,R v Box & Martin [2001]QCA 272 at [7] and [8]; and R v Wehlow (2001)122 A Crim R 63; [2001]QCA,https://jade.io/article/167107/section/140572,jade
1194,201,[2001]QCA 193,"[8]; and R v Wehlow (2001)122 A Crim R 63; [2001]QCA 193 at [5], [33]. See also R v Mitchell [2008]2 Qd",https://jade.io/article/167022,jade
1195,201,"[5],","v Wehlow (2001)122 A Crim R 63; [2001]QCA 193 at [5], [33]. See also R v Mitchell [2008]2 Qd R 142;",https://jade.io/article/167022/section/482,jade
1196,201,[33].,"Wehlow (2001)122 A Crim R 63; [2001]QCA 193 at [5], [33]. See also R v Mitchell [2008]2 Qd R 142; [2007]QCA",https://jade.io/article/167022/section/533,jade
1197,201,[2007]QCA 267,"[33]. See also R v Mitchell [2008]2 Qd R 142; [2007]QCA 267 per Keane JA at [48], [50] and the comments of",https://jade.io/article/15502,jade
1198,201,"[48],","[2008]2 Qd R 142; [2007]QCA 267 per Keane JA at [48], [50] and the comments of Williams JA at [31] as",https://jade.io/article/15502/section/140756,jade
1199,201,[50],"Qd R 142; [2007]QCA 267 per Keane JA at [48], [50] and the comments of Williams JA at [31] as follows:",https://jade.io/article/15502/section/821,jade
1200,201,[31],"at [48], [50] and the comments of Williams JA at [31] as follows: where, as here, murder is the offence charged",https://jade.io/article/15502/section/1017,jade
1201,201,[1993]4,precisely the lies upon which the prosecution relies(R v Richens [1993]4 All ER 877 at [886]); Osland v The Queen (1998)197,https://jade.io/citation/533897,jade
1202,201,All ER 877,"the lies upon which the prosecution relies(R v Richens [1993]4 All ER 877 at [886]); Osland v The Queen (1998)197 CLR 316, Zoneff",https://jade.io/citation/533897,jade
1203,201,[886]);,"the prosecution relies(R v Richens [1993]4 All ER 877 at [886]); Osland v The Queen (1998)197 CLR 316, Zoneff at [17].",https://jade.io/citation/533897/section/13325,jade
1204,201,"(1998)197 CLR 316,","[1993]4 All ER 877 at [886]); Osland v The Queen (1998)197 CLR 316, Zoneff at [17]. 4.15.3 Suggested Directions [Last reviewed: June 2025]",https://jade.io/article/68101,jade
1205,201,[17].,"[886]); Osland v The Queen (1998)197 CLR 316, Zoneff at [17]. 4.15.3 Suggested Directions [Last reviewed: June 2025] The prosecution relies",https://jade.io/article/68101/section/140542,jade
1206,204,[1999]HCA 32;,is raised. See Melbourne v The Queen (1999)198 CLR 1; [1999]HCA 32; R v Jurcik [2001]QCA 390; R v Hinschen [2008]QCA 145;,https://jade.io/article/68132,jade
1207,204,[2001]QCA 390;,The Queen (1999)198 CLR 1; [1999]HCA 32; R v Jurcik [2001]QCA 390; R v Hinschen [2008]QCA 145; R v TZ (2011)214 A,https://jade.io/article/167216,jade
1208,204,[2008]QCA 145;,[1999]HCA 32; R v Jurcik [2001]QCA 390; R v Hinschen [2008]QCA 145; R v TZ (2011)214 A Crim R 316; [2011]QCA 305.,https://jade.io/article/78675,jade
1209,204,[2011]QCA 305.,[2008]QCA 145; R v TZ (2011)214 A Crim R 316; [2011]QCA 305. It is a matter for assessment in each case whether,https://jade.io/article/255129,jade
1210,204,[2006]QCA 244.,not necessitate a good character direction. See R v Soloman [2006]QCA 244. 4.16.3 Suggested Direction [Last reviewed: March 2026] (Suggested direction where,https://jade.io/article/169361,jade
1211,206,[1997],make an explicit warning necessary(R v Sinclair (1997)191 LSJS 53; [1997] SASC 6127). Section 15(2) of the Evidence Act 1977 deals,https://jade.io/article/175071,jade
1212,206,SASC 6127).,an explicit warning necessary(R v Sinclair (1997)191 LSJS 53; [1997] SASC 6127). Section 15(2) of the Evidence Act 1977 deals with the,https://jade.io/article/175071,jade
1213,206,15(2),necessary(R v Sinclair (1997)191 LSJS 53; [1997] SASC 6127). Section 15(2) of the Evidence Act 1977 deals with the asking of,https://jade.io/article/353262/section/3664,jade
1214,206,Evidence Act 1977,(1997)191 LSJS 53; [1997] SASC 6127). Section 15(2) of the Evidence Act 1977 deals with the asking of questions tending to show that,https://jade.io/article/353262,jade
1215,207,[1972]HCA 71)).,offence charged (see Donnini v The Queen (1972)128 CLR 114; [1972]HCA 71)). That is so whether counsel requests such a direction or,https://jade.io/article/66388,jade
1216,207,[1997]HCA 47).,direction or not(see BRS v The Queen (1997)191 CLR 275; [1997]HCA 47). Evidence may emerge on the prosecution case or through cross-examination,https://jade.io/article/68015,jade
1217,207,15(2)(a),or through cross-examination of the defendant (with leave under s 15(2)(a) of the Evidence Act 1977) which indicates that he/she has,https://jade.io/article/353262/section/5265,jade
1218,207,Evidence Act,of the defendant (with leave under s 15(2)(a) of the Evidence Act 1977) which indicates that he/she has been charged with or,https://jade.io/article/353262,jade
1219,207,Act 1977),the defendant (with leave under s 15(2)(a) of the Evidence Act 1977) which indicates that he/she has been charged with or convicted,https://jade.io/article/353262,jade
1220,207,[2000]QCA 211,propensity can be drawn. See for example R v Aston-Brien [2000]QCA 211 in which the alleged provision of amphetamines immediately after a,https://jade.io/article/166634,jade
1221,207,(1997)27 MVR 265,‘an integral part of the prosecution case’; R v Ettles (1997)27 MVR 265 in which the defendant’s ingestion of cannabis was relevant to,https://jade.io/citation/3623431,jade
1222,207,[2005]QCA 40);,driving on a dangerous driving charge(contrast with R v DAJ [2005]QCA 40); R v OGD (No 2) (2000)50 NSWLR 433; [2000]NSWCCA 404,https://jade.io/article/168758,jade
1223,207,[2000]NSWCCA 404,[2005]QCA 40); R v OGD (No 2) (2000)50 NSWLR 433; [2000]NSWCCA 404 in which an admission of having done ‘these things’ to,https://jade.io/article/136187,jade
1224,207,[1999]SASC 302,on a witness; and R v Grosser (1999)73 SASR 584; [1999]SASC 302 in which a history of the defendant’s prior arrest on,https://jade.io/article/176110,jade
1225,207,15(2)(b),or from a defendant in cross-examination (as contemplated by s 15(2)(b) of the Evidence Act 1977) which is adverse to his/her,https://jade.io/article/353262/section/6016,jade
1226,207,Evidence Act,"defendant in cross-examination (as contemplated by s 15(2)(b) of the Evidence Act 1977) which is adverse to his/her character, but has a",https://jade.io/article/353262,jade
