link_id,page_no,link_text,surrounding_text,link_destination,link_domain
2916,636,Criminal Code (Non-consensual Sharing of Intimate Images) Amendment,[Last reviewed: January 2025] Section 229A was inserted by the Criminal Code (Non-consensual Sharing of Intimate Images) Amendment Act 2019(Qld) and commenced on 21 February 2019. Section 229A,https://jade.io/article/635541,jade
2917,636,Act,by the Criminal Code (Non-consensual Sharing of Intimate Images) Amendment Act 2019(Qld) and commenced on 21 February 2019. Section 229A contains,https://jade.io/article/635541,jade
2918,636,Act 2019(Qld),by the Criminal Code (Non-consensual Sharing of Intimate Images) Amendment Act 2019(Qld) and commenced on 21 February 2019. Section 229A contains two,https://jade.io/article/635541,jade
2919,636,2019(Qld),the Criminal Code (Non-consensual Sharing of Intimate Images) Amendment Act 2019(Qld) and commenced on 21 February 2019. Section 229A contains two,https://jade.io/article/635541,jade
2920,636,2019(Qld),the Criminal Code (Non-consensual Sharing of Intimate Images) Amendment Act 2019(Qld) and commenced on 21 February 2019. Section 229A contains two,https://jade.io/article/635541,jade
2921,637,Criminal Law (Coercive Control and Affirmative Consent) and Other Legislation Amendment,"purposes of s 229A. The definition was amended by the Criminal Law (Coercive Control and Affirmative Consent) and Other Legislation Amendment Act 2024 (Qld), effective 23 September 2024. It states that:",https://jade.io/article/1067156,jade
2922,637,"Act 2024 (Qld),","Law (Coercive Control and Affirmative Consent) and Other Legislation Amendment Act 2024 (Qld), effective 23 September 2024. It states that: ‘Consent’meansfreeandvoluntaryagreementbyapersonwiththecognitivecapacitytomaketheagreement. While consent",https://jade.io/article/1067156,jade
2923,637,"(Qld),","Control and Affirmative Consent) and Other Legislation Amendment Act 2024 (Qld), effective 23 September 2024. It states that: ‘Consent’meansfreeandvoluntaryagreementbyapersonwiththecognitivecapacitytomaketheagreement. While consent",https://jade.io/article/1067156,jade
2924,637,Ev-,Directions related to‘sexual offences’– Part 6B Division 3 of the Ev- idence Act 1977 (Qld) Part 6B Division 3 of the,https://jade.io/article/353262,jade
2925,637,idence Act 1977 (Qld),"related to‘sexual offences’– Part 6B Division 3 of the Ev- idence Act 1977 (Qld) Part 6B Division 3 of the Evidence Act 1977 (Qld),",https://jade.io/article/353262,jade
2926,637,3,"of the Ev- idence Act 1977 (Qld) Part 6B Division 3 of the Evidence Act 1977 (Qld), as enacted by the",https://jade.io/article/353262/section/187129,jade
2927,637,"Evidence Act 1977 (Qld),","idence Act 1977 (Qld) Part 6B Division 3 of the Evidence Act 1977 (Qld), as enacted by the Criminal Law (Coercive Control and Affirmative",https://jade.io/article/353262,jade
2928,637,"(Qld),","(Qld) Part 6B Division 3 of the Evidence Act 1977 (Qld), as enacted by the Criminal Law (Coercive Control and Affirmative",https://jade.io/article/353262,jade
2929,637,Criminal Law (Coercive Control and,"of the Evidence Act 1977 (Qld), as enacted by the Criminal Law (Coercive Control and Affirmative Consent) and Other Legislation Amendment Act 2024(Qld), applies in",https://jade.io/article/1067156,jade
2930,637,"Affirmative Consent) and Other Legislation Amendment Act 2024(Qld),","(Qld), as enacted by the Criminal Law (Coercive Control and Affirmative Consent) and Other Legislation Amendment Act 2024(Qld), applies in relation to a trial that relates wholly or",https://jade.io/article/1067156,jade
2931,637,"2024(Qld),","(Coercive Control and Affirmative Consent) and Other Legislation Amendment Act 2024(Qld), applies in relation to a trial that relates wholly or",https://jade.io/article/1067156,jade
2932,637,161,the defendant was charged or when the proceeding started(see s 161 of the Evidence Act 1977 (Qld)). ‘Sexual offence’ is defined,https://jade.io/article/353262/section/1781,jade
2933,637,Evidence Act 1977,charged or when the proceeding started(see s 161 of the Evidence Act 1977 (Qld)). ‘Sexual offence’ is defined in the Schedule 3 Dictionary,https://jade.io/article/353262,jade
2934,637,1977,when the proceeding started(see s 161 of the Evidence Act 1977 (Qld)). ‘Sexual offence’ is defined in the Schedule 3 Dictionary,https://jade.io/article/353262,jade
2935,637,(Qld)).,the proceeding started(see s 161 of the Evidence Act 1977 (Qld)). ‘Sexual offence’ is defined in the Schedule 3 Dictionary to,https://jade.io/article/353262,jade
2936,637,Evidence Act 1977,offence’ is defined in the Schedule 3 Dictionary to the Evidence Act 1977 (Qld) to include an offence against a provision of Chapter,https://jade.io/article/353262,jade
2937,637,1977 (Qld),defined in the Schedule 3 Dictionary to the Evidence Act 1977 (Qld) to include an offence against a provision of Chapter 22,https://jade.io/article/353262,jade
2938,641,Health and Other Legislation Amendment Act 2016,"s 208, most likely s 208(1)(a). In that regard, the Health and Other Legislation Amendment Act 2016 (Qld) commenced on 23 September 2016 and, in part, abolished",https://jade.io/article/496480,jade
2939,641,2016 (Qld),"In that regard, the Health and Other Legislation Amendment Act 2016 (Qld) commenced on 23 September 2016 and, in part, abolished s",https://jade.io/article/496480,jade
2940,642,Acts Interpretation,11 of the Criminal Code and s 20 of the Acts Interpretation Act 1954. The operation of these provisions can create complexities,https://jade.io/article/529695,jade
2941,642,Act 1954.,the Criminal Code and s 20 of the Acts Interpretation Act 1954. The operation of these provisions can create complexities in the,https://jade.io/article/529695,jade
2942,642,[2018]3 Qd R 50.,the conduct of the trial–see for example R v PAZ [2018]3 Qd R 50. Other authorities dealing with the operation of s 11 and,https://jade.io/article/561485,jade
2943,642,"Acts Interpretation Act 1954,","s 11 and its interaction with s 20 of the Acts Interpretation Act 1954, albeit in respect of different legislation, include R v HXY",https://jade.io/article/529695,jade
2944,642,"[2017]QSC 108,","albeit in respect of different legislation, include R v HXY [2017]QSC 108, R v HBT [2018]QCA 227 and R v JAA [2019]3",https://jade.io/article/532687,jade
2945,642,[2018]QCA 227,"legislation, include R v HXY [2017]QSC 108, R v HBT [2018]QCA 227 and R v JAA [2019]3 Qd R 242; [2018]QCA 365.",https://jade.io/article/612044,jade
2946,642,[2018]QCA,"[2018]QCA 227 and R v JAA [2019]3 Qd R 242; [2018]QCA 365. Notably, s 11 requires a comparison between the state",https://jade.io/article/634357,jade
2947,642,365.,"227 and R v JAA [2019]3 Qd R 242; [2018]QCA 365. Notably, s 11 requires a comparison between the state of",https://jade.io/article/634357,jade
2948,642,[1947]VLR 389.,the anus of the victim with his penis—R v Wardle [1947]VLR 389. The ordinary meaning of the term “sodomy”is sexual intercourse per,https://jade.io/article/554716,jade
2949,642,735.,the anal orifice - Russell on Crime 12th Ed at 735. The word “sodomy”in s 6 was replaced by the term,https://jade.io/article/554716/section/3295,jade
2950,643,[2013],"s 216(4)(b), in R v Little(2013)231 A Crim R 145; [2013] QCA 233, [26] it was observed that the phrase takes",https://jade.io/article/300700,jade
2951,643,"QCA 233,","216(4)(b), in R v Little(2013)231 A Crim R 145; [2013] QCA 233, [26] it was observed that the phrase takes its ordinary",https://jade.io/article/300700,jade
2952,643,[26],"R v Little(2013)231 A Crim R 145; [2013] QCA 233, [26] it was observed that the phrase takes its ordinary English",https://jade.io/article/300700/section/140175,jade
2953,643,"[2006]QCA 242,","“selfish utilisation”was referred to with approval. In R v Libke [2006]QCA 242, [100] a direction that sexual exploitation means taking advantage of",https://jade.io/article/169359,jade
2954,643,[100],"referred to with approval. In R v Libke [2006]QCA 242, [100] a direction that sexual exploitation means taking advantage of the",https://jade.io/article/169359/section/1179,jade
2955,643,"[2018]QCA 125,","The discussion in R v Addley [2019]2 Qd R 46; [2018]QCA 125, although dealing with a different offence provision, illustrates the point.",https://jade.io/article/592896,jade
2956,653,Health and Other Legislation Amendment Act 2016,"s 208, most likely s 208(1)(a). In that regard, the Health and Other Legislation Amendment Act 2016 (Qld) commenced on 23 September 2016 and, in part, abolished",https://jade.io/article/496480,jade
2957,653,2016 (Qld),"In that regard, the Health and Other Legislation Amendment Act 2016 (Qld) commenced on 23 September 2016 and, in part, abolished s",https://jade.io/article/496480,jade
2958,654,Acts Interpretation,11 of the Criminal Code and s 20 of the Acts Interpretation Act 1954. The operation of these provisions can create complexities,https://jade.io/article/529695,jade
2959,654,Act 1954.,the Criminal Code and s 20 of the Acts Interpretation Act 1954. The operation of these provisions can create complexities in the,https://jade.io/article/529695,jade
2960,654,[2018]3 Qd R 50.,the conduct of the trial–see for example R v PAZ [2018]3 Qd R 50. Other authorities dealing with the operation of s 11 and,https://jade.io/article/561485,jade
2961,654,"Acts Interpretation Act 1954,","s 11 and its interaction with s 20 of the Acts Interpretation Act 1954, albeit in respect of different legislation, include R v HXY",https://jade.io/article/529695,jade
2962,654,"[2017]QSC 108,","albeit in respect of different legislation, include R v HXY [2017]QSC 108, R v HBT [2018]QCA 227 and R v JAA [2019]3",https://jade.io/article/532687,jade
2963,654,[2018]QCA 227,"legislation, include R v HXY [2017]QSC 108, R v HBT [2018]QCA 227 and R v JAA [2019]3 Qd R 242; [2018]QCA 365.",https://jade.io/article/612044,jade
2964,654,[2018]QCA,"[2018]QCA 227 and R v JAA [2019]3 Qd R 242; [2018]QCA 365. Notably, s 11 requires a comparison between the state",https://jade.io/article/634357,jade
2965,654,365.,"227 and R v JAA [2019]3 Qd R 242; [2018]QCA 365. Notably, s 11 requires a comparison between the state of",https://jade.io/article/634357,jade
2966,654,[1947]VLR 389.,the anus of the victim with his penis—R v Wardle [1947]VLR 389. The ordinary meaning of the term “sodomy”is sexual intercourse per,https://jade.io/article/554716,jade
2967,654,735.,the anal orifice - Russell on Crime 12th Ed at 735. The word “sodomy”in s 6 was replaced by the term,https://jade.io/article/554716/section/3295,jade
2968,655,[2013],"s 216(4)(b), in R v Little(2013)231 A Crim R 145; [2013] QCA 233, [26] it was observed that the phrase takes",https://jade.io/article/300700,jade
2969,655,"QCA 233,","216(4)(b), in R v Little(2013)231 A Crim R 145; [2013] QCA 233, [26] it was observed that the phrase takes its ordinary",https://jade.io/article/300700,jade
2970,655,[26],"R v Little(2013)231 A Crim R 145; [2013] QCA 233, [26] it was observed that the phrase takes its ordinary English",https://jade.io/article/300700/section/140175,jade
2971,655,"[2006]QCA 242,","“selfish utilisation”was referred to with approval. In R v Libke [2006]QCA 242, [100] a direction that sexual exploitation means taking advantage of",https://jade.io/article/169359,jade
2972,655,[100],"referred to with approval. In R v Libke [2006]QCA 242, [100] a direction that sexual exploitation means taking advantage of the",https://jade.io/article/169359/section/1179,jade
2973,655,"[2018]QCA 125,","The discussion in R v Addley [2019]2 Qd R 46; [2018]QCA 125, although dealing with a different offence provision, illustrates the point.",https://jade.io/article/592896,jade
2974,665,"(1954)Tas SR 26,","may be sufficient to amount to a taking(R v Mejac (1954)Tas SR 26, 28-29). It is immaterial that the child was taken with",https://jade.io/citation/3309342,jade
2975,665,28-29).,"to amount to a taking(R v Mejac (1954)Tas SR 26, 28-29). It is immaterial that the child was taken with the",https://jade.io/citation/3309342/section/2220,jade
2976,666,[1860]Bell 276.,may be temporary(R v Baille(1859)8 Cox 238; R v Timmins [1860]Bell 276. It is no defence that the defendant believed the child,https://jade.io/citation/23022304,jade
2977,666,"[1957]St R Qd 594,","expression ‘custody or protection’rather than ‘possession’. In R v Johnson [1957]St R Qd 594, 597, it was said that‘custody’ means ‘safe-keeping; protection’ such that",https://jade.io/citation/11100290,jade
2978,666,"597,","than ‘possession’. In R v Johnson [1957]St R Qd 594, 597, it was said that‘custody’ means ‘safe-keeping; protection’ such that ‘custody",https://jade.io/citation/11100290/section/1111,jade
2979,666,"[1979]Qd R 278,","immediate proximity to and control of the child(R v Beble [1979]Qd R 278, 281-282). 12.1.3 Suggested direction [Last reviewed: October 2025] To prove",https://jade.io/citation/2697869,jade
2980,666,281-282).,"and control of the child(R v Beble [1979]Qd R 278, 281-282). 12.1.3 Suggested direction [Last reviewed: October 2025] To prove the",https://jade.io/citation/2697869/section/4613,jade
2981,669,(1981)3 A Crim R 294).,"Defendant and the departure of the child: (R v Stanton (1981)3 A Crim R 294). In R v Johnson [1957]St R Qd 594, [595]; Philp",https://jade.io/citation/2694457,jade
2982,669,"[1957]St R Qd 594,","Stanton (1981)3 A Crim R 294). In R v Johnson [1957]St R Qd 594, [595]; Philp J held that supplying taxi and railway tickets",https://jade.io/citation/11100290,jade
2983,669,[595];,"R 294). In R v Johnson [1957]St R Qd 594, [595]; Philp J held that supplying taxi and railway tickets to",https://jade.io/citation/11100290/section/31955,jade
2984,669,[595];,"R 294). In R v Johnson [1957]St R Qd 594, [595]; Philp J held that supplying taxi and railway tickets to",https://jade.io/citation/11100290/section/31955,jade
2985,669,[595];,"R 294). In R v Johnson [1957]St R Qd 594, [595]; Philp J held that supplying taxi and railway tickets to",https://jade.io/citation/11100290/section/31955,jade
2986,669,[2008]SASC 76(in,"of many older authorities, White J in Moore v Police [2008]SASC 76(in a case concerning the similar offence of child abduction under",https://jade.io/article/60831,jade
2987,669,80,case concerning the similar offence of child abduction under s 80 of the Criminal Law Consolidation Act 1935(SA))stated at[38]that: ‘the prosecution,https://jade.io/article/511278/section/1199,jade
2988,669,Criminal Law Consolidation,similar offence of child abduction under s 80 of the Criminal Law Consolidation Act 1935(SA))stated at[38]that: ‘the prosecution must prove that the accused,https://jade.io/article/511278,jade
2989,669,Consolidation Act 1935(SA))stated,of child abduction under s 80 of the Criminal Law Consolidation Act 1935(SA))stated at[38]that: ‘the prosecution must prove that the accused has taken,https://jade.io/article/511278,jade
2990,669,1935(SA))stated,abduction under s 80 of the Criminal Law Consolidation Act 1935(SA))stated at[38]that: ‘the prosecution must prove that the accused has taken,https://jade.io/article/511278,jade
2991,669,[2004]QCA 152;,"parent or guardian and the child.’ In R v Awang [2004]QCA 152; [2004]2 Qd R 672, a case concerning s 355 of",https://jade.io/article/168416,jade
2992,669,[21],"s 355 of the Criminal Code, Williams JA held at [21] that the term ‘detain’ should be given its ordinary and",https://jade.io/article/168416/section/140771,jade
2993,670,[1995]QCA 389).,the defence on the balance of probabilities: (R v Seery [1995]QCA 389). It is suggested that the authorities on the interpretation of,https://jade.io/article/444620,jade
2994,670,[2009]QDC 61(McGill,applicable to the interpretation of s 363(2): (R v Campbell [2009]QDC 61(McGill DCJ)). 12.2.3 Suggested Direction [Last reviewed: April 2025] A. Offence,https://jade.io/article/91488,jade
2995,672,"[2004]2 Qd R 672,","should be given their ordinary and natural meaning(R v Awang [2004]2 Qd R 672, [25](Williams JA); see also R v East [2008]QCA 325, [24]-[25]).",https://jade.io/article/168416,jade
2996,672,[25](Williams,"ordinary and natural meaning(R v Awang [2004]2 Qd R 672, [25](Williams JA); see also R v East [2008]QCA 325, [24]-[25]). ‘Deprive’",https://jade.io/article/168416/section/140706,jade
2997,672,"[2008]QCA 325,","Qd R 672, [25](Williams JA); see also R v East [2008]QCA 325, [24]-[25]). ‘Deprive’ includes the denial of enjoyment of something. Deprivation",https://jade.io/article/84747,jade
2998,672,[24]-[25]).,"672, [25](Williams JA); see also R v East [2008]QCA 325, [24]-[25]). ‘Deprive’ includes the denial of enjoyment of something. Deprivation includes",https://jade.io/article/84747/section/3031,jade
2999,673,[2004]2 Qd R 672(McMurdo,without knowledge or where the complainant lacks capacity(R v Awang [2004]2 Qd R 672(McMurdo P)). 12.3.3 Suggested Direction [Last reviewed: October 2024] The prosecution,https://jade.io/article/168416,jade
3000,674,[2004]2 Qd R 672,"in confinement’ and ‘hold back, delay, stop’(see R v Awang [2004]2 Qd R 672 (Williams JA)). The word ‘procure’ in this section means ‘facilitate’,",https://jade.io/article/168416,jade
3001,674,[2004]1 Qd R 162).,"or induce (see R v F, ex parte Attorney General [2004]1 Qd R 162). The offence is a prescribed offence under s 161Q of",https://jade.io/article/167946,jade
3002,674,161Q,"R 162). The offence is a prescribed offence under s 161Q of the Penalties and Sentences Act 1992 (Qld), so a",https://jade.io/article/352736/section/443071,jade
3003,674,Penalties and Sentences Act,"offence is a prescribed offence under s 161Q of the Penalties and Sentences Act 1992 (Qld), so a serious organised crime circumstance of aggravation",https://jade.io/article/352736,jade
3004,674,Act 1992,"prescribed offence under s 161Q of the Penalties and Sentences Act 1992 (Qld), so a serious organised crime circumstance of aggravation is",https://jade.io/article/352736,jade
3005,674,"1992 (Qld),","offence under s 161Q of the Penalties and Sentences Act 1992 (Qld), so a serious organised crime circumstance of aggravation is applicable.",https://jade.io/article/352736,jade
3006,674,"(Qld),","under s 161Q of the Penalties and Sentences Act 1992 (Qld), so a serious organised crime circumstance of aggravation is applicable.",https://jade.io/article/352736,jade
3007,676,[2004]2 Qd R 672,"in confinement’ and ‘hold back, delay, stop’(see R v Awang [2004]2 Qd R 672 (Williams JA)). As per the Australian Concise Oxford Dictionary(3rd ed),‘extort’",https://jade.io/article/168416,jade
3008,676,[2004]1 Qd R 162).,"compel or induce(see R v F, ex parte Attorney General [2004]1 Qd R 162). This offence is a prescribed offence under s 161Q Penalties",https://jade.io/article/167946,jade
3009,676,161Q,R 162). This offence is a prescribed offence under s 161Q Penalties and Sentences Act 1992 so a serious organised crime,https://jade.io/article/352736/section/443071,jade
3010,676,Penalties and Sentences Act 1992,162). This offence is a prescribed offence under s 161Q Penalties and Sentences Act 1992 so a serious organised crime circumstance of aggravation is applicable.,https://jade.io/article/352736,jade
3011,678,Domestic and Family Violence,definition of what can constitute stalking was amended by the Domestic and Family Violence Protection (Combating Coercive Control) And Other Legislation Amendment Act 2023(Qld),https://jade.io/article/966844,jade
3012,678,Protection (Combating Coercive Control) And Other Legislation Amendment Act 2023(Qld),constitute stalking was amended by the Domestic and Family Violence Protection (Combating Coercive Control) And Other Legislation Amendment Act 2023(Qld) which commenced on 1 August 2023 and applies to proceedings,https://jade.io/article/966844,jade
3013,678,2023(Qld),Violence Protection (Combating Coercive Control) And Other Legislation Amendment Act 2023(Qld) which commenced on 1 August 2023 and applies to proceedings,https://jade.io/article/966844,jade
3014,679,"[2016]1 Qd R 562,","act in isolation would not have that effect(R v Conde [2016]1 Qd R 562, 574-575 [43]-[46]). Section 359C lists matters that are immaterial for",https://jade.io/article/390206,jade
3015,679,574-575,"not have that effect(R v Conde [2016]1 Qd R 562, 574-575 [43]-[46]). Section 359C lists matters that are immaterial for an",https://jade.io/article/390206/section/8430,jade
3016,679,[43]-[46]).,"have that effect(R v Conde [2016]1 Qd R 562, 574-575 [43]-[46]). Section 359C lists matters that are immaterial for an allegation",https://jade.io/article/390206/section/8430,jade
3017,679,"[2016]1 Qd R 562,","continuous course of conduct as alleged. In R v Conde [2016]1 Qd R 562, 578, P Lyons J(McMurdo P and Morrison JA agreeing) held",https://jade.io/article/390206,jade
3018,679,"578,","as alleged. In R v Conde [2016]1 Qd R 562, 578, P Lyons J(McMurdo P and Morrison JA agreeing) held that",https://jade.io/article/390206/section/139927,jade
3019,679,[1999]1 Qd R 314).,"about the same two acts. (See also R v Hubbuck [1999]1 Qd R 314). In R v Glover (2022)10 QR 825, 835 [35] it",https://jade.io/article/165990,jade
3020,679,"(2022)10 QR 825,","v Hubbuck [1999]1 Qd R 314). In R v Glover (2022)10 QR 825, 835 [35] it was held to be a misdirection where",https://jade.io/article/912446,jade
3021,679,835,"Qd R 314). In R v Glover (2022)10 QR 825, 835 [35] it was held to be a misdirection where the",https://jade.io/article/912446/section/140690,jade
3022,679,[35],"R 314). In R v Glover (2022)10 QR 825, 835 [35] it was held to be a misdirection where the trial",https://jade.io/article/912446/section/140690,jade
3023,680,161Q,"aggravation. The offence is also a prescribed offence under s 161Q of the Penalties and Sentences Act 1992(Qld), so a serious",https://jade.io/article/352736/section/443071,jade
3024,680,"Penalties and Sentences Act 1992(Qld),","is also a prescribed offence under s 161Q of the Penalties and Sentences Act 1992(Qld), so a serious organised crime circumstance of aggravation may be",https://jade.io/article/352736,jade
3025,680,"1992(Qld),","offence under s 161Q of the Penalties and Sentences Act 1992(Qld), so a serious organised crime circumstance of aggravation may be",https://jade.io/article/352736,jade
3026,683,Domestic and Family Violence Protection (Combating Coercive Control) And Other Legislation Amendment,harassment or abuse 12.7.2 Commentary [Last reviewed: October 2025] The Domestic and Family Violence Protection (Combating Coercive Control) And Other Legislation Amendment Act 2023(Qld) amended Chapter 33A of the Criminal Code to,https://jade.io/article/966844,jade
3027,683,Act 2023(Qld),Family Violence Protection (Combating Coercive Control) And Other Legislation Amendment Act 2023(Qld) amended Chapter 33A of the Criminal Code to expand unlawful,https://jade.io/article/966844,jade
3028,683,2023(Qld),Violence Protection (Combating Coercive Control) And Other Legislation Amendment Act 2023(Qld) amended Chapter 33A of the Criminal Code to expand unlawful,https://jade.io/article/966844,jade
3029,684,"[2016]1 Qd R 562,","act in isolation would not have that effect(R v Conde [2016]1 Qd R 562, 574-575 [43]-[46]). Section 359C lists matters that are immaterial for",https://jade.io/article/390206,jade
3030,684,574-575,"not have that effect(R v Conde [2016]1 Qd R 562, 574-575 [43]-[46]). Section 359C lists matters that are immaterial for an",https://jade.io/article/390206/section/8430,jade
3031,684,[43]-[46]).,"have that effect(R v Conde [2016]1 Qd R 562, 574-575 [43]-[46]). Section 359C lists matters that are immaterial for an allegation",https://jade.io/article/390206/section/8430,jade
3032,684,"[2016]1 Qd R 562,","continuous course of conduct as alleged. In R v Conde [2016]1 Qd R 562, 578, P Lyons J(McMurdo P and Morrison JA agreeing) held",https://jade.io/article/390206,jade
3033,684,"578,","as alleged. In R v Conde [2016]1 Qd R 562, 578, P Lyons J(McMurdo P and Morrison JA agreeing) held that",https://jade.io/article/390206/section/139927,jade
3034,684,[1999]1 Qd R 314).,about the same two acts. (See also R v Hubbuck [1999]1 Qd R 314). Formatting Tests (Test Edition) 684 Test publisher for QLD bench,https://jade.io/article/165990,jade
3035,685,"(2022)10 QR 825,","12 Offences Against Liberty and Stalking In R v Glover (2022)10 QR 825, 835 [35] it was held to be a misdirection where",https://jade.io/article/912446,jade
3036,685,835,"Liberty and Stalking In R v Glover (2022)10 QR 825, 835 [35] it was held to be a misdirection where the",https://jade.io/article/912446/section/140690,jade
3037,685,[35],"and Stalking In R v Glover (2022)10 QR 825, 835 [35] it was held to be a misdirection where the trial",https://jade.io/article/912446/section/140690,jade
3038,685,161Q,"aggravation. The offence is also a prescribed offence under s 161Q of the Penalties and Sentences Act 1992(Qld), so a serious",https://jade.io/article/352736/section/443071,jade
3039,685,"Penalties and Sentences Act 1992(Qld),","is also a prescribed offence under s 161Q of the Penalties and Sentences Act 1992(Qld), so a serious organised crime circumstance of aggravation may be",https://jade.io/article/352736,jade
3040,685,"1992(Qld),","offence under s 161Q of the Penalties and Sentences Act 1992(Qld), so a serious organised crime circumstance of aggravation may be",https://jade.io/article/352736,jade
3041,689,[1992]2 Qd R 634.,"safe, or under the offender’s control: see R v McDonald [1992]2 Qd R 634. Conversion is not defined in the Criminal Code and is",https://jade.io/citation/437251,jade
