link_id,page_no,link_text,surrounding_text,link_destination,link_domain
2017,328,"44,","withhold consent. See R v Winchester [2014] 1 Qd R 44, for a detailed examination of the subject of consent including",https://jade.io/article/259307,jade
2018,329,[1995]2 Qd R 490).,"this context, consent may be tacit or implied(Horan v Ferguson [1995]2 Qd R 490). Force applied with the consent of the other person will",https://jade.io/article/205939,jade
2019,329,"[2016]2 Qd R 602,","consent is obtained by fraud. See also R v Gee [2016]2 Qd R 602, dealing with an assault on an infant and what conduct",https://jade.io/article/448160,jade
2020,332,103ZS,"matter you must consider in detail. (Where appropriate, address s 103ZS of the Evidence Act 1977): In this trial there is",https://jade.io/article/353262/section/1424725,jade
2021,332,Evidence,"consider in detail. (Where appropriate, address s 103ZS of the Evidence Act 1977): In this trial there is evidence that[set out",https://jade.io/article/353262,jade
2022,332,Evidence Act,"consider in detail. (Where appropriate, address s 103ZS of the Evidence Act 1977): In this trial there is evidence that[set out the",https://jade.io/article/353262,jade
2023,332,Act,"in detail. (Where appropriate, address s 103ZS of the Evidence Act 1977): In this trial there is evidence that[set out the",https://jade.io/article/353262,jade
2024,332,Act 1977):,"in detail. (Where appropriate, address s 103ZS of the Evidence Act 1977): In this trial there is evidence that[set out the relevant",https://jade.io/article/353262,jade
2025,332,103ZZA,"as between different kinds of people. (Where appropriate, address s 103ZZA of the Evidence Act 1977): In this trial there is",https://jade.io/article/353262/section/1424734,jade
2026,332,Evidence,"kinds of people. (Where appropriate, address s 103ZZA of the Evidence Act 1977): In this trial there is evidence that [set",https://jade.io/article/353262,jade
2027,332,Evidence Act,"kinds of people. (Where appropriate, address s 103ZZA of the Evidence Act 1977): In this trial there is evidence that [set out",https://jade.io/article/353262,jade
2028,332,Act,"of people. (Where appropriate, address s 103ZZA of the Evidence Act 1977): In this trial there is evidence that [set out",https://jade.io/article/353262,jade
2029,332,Act 1977):,"of people. (Where appropriate, address s 103ZZA of the Evidence Act 1977): In this trial there is evidence that [set out the",https://jade.io/article/353262,jade
2030,333,103ZT,"people respond to non-consensual sexual activity. (Where appropriate, address s 103ZT of the Evidence Act 1977): In this trial, there is",https://jade.io/article/353262/section/1424726,jade
2031,333,Evidence,"non-consensual sexual activity. (Where appropriate, address s 103ZT of the Evidence Act 1977): In this trial, there is evidence that[set out",https://jade.io/article/353262,jade
2032,333,Evidence Act,"non-consensual sexual activity. (Where appropriate, address s 103ZT of the Evidence Act 1977): In this trial, there is evidence that[set out the",https://jade.io/article/353262,jade
2033,333,Act,"sexual activity. (Where appropriate, address s 103ZT of the Evidence Act 1977): In this trial, there is evidence that[set out the",https://jade.io/article/353262,jade
2034,333,Act 1977):,"sexual activity. (Where appropriate, address s 103ZT of the Evidence Act 1977): In this trial, there is evidence that[set out the relevant",https://jade.io/article/353262,jade
2035,333,103ZU,"people respond to non-consensual sexual activity. (Where appropriate, address s 103ZU of the Evidence Act 1977): In this trial there is",https://jade.io/article/353262/section/1424727,jade
2036,333,Evidence,"non-consensual sexual activity. (Where appropriate, address s 103ZU of the Evidence Act 1977): In this trial there is evidence that[set out",https://jade.io/article/353262,jade
2037,333,Evidence Act,"non-consensual sexual activity. (Where appropriate, address s 103ZU of the Evidence Act 1977): In this trial there is evidence that[set out the",https://jade.io/article/353262,jade
2038,333,Act,"sexual activity. (Where appropriate, address s 103ZU of the Evidence Act 1977): In this trial there is evidence that[set out the",https://jade.io/article/353262,jade
2039,333,Act 1977):,"sexual activity. (Where appropriate, address s 103ZU of the Evidence Act 1977): In this trial there is evidence that[set out the relevant",https://jade.io/article/353262,jade
2040,334,103ZW,"but with that direction in mind. (Where appropriate, address s 103ZW of the Evidence Act 1977, amending the list as appropri-",https://jade.io/article/353262/section/1424729,jade
2041,334,Evidence Act,"direction in mind. (Where appropriate, address s 103ZW of the Evidence Act 1977, amending the list as appropri- ate): In this trial",https://jade.io/article/353262,jade
2042,334,"Act 1977,","in mind. (Where appropriate, address s 103ZW of the Evidence Act 1977, amending the list as appropri- ate): In this trial there",https://jade.io/article/353262,jade
2043,337,Evidence,348A Section 761 – Application of ch 32 to proceedings Evidence Act 1977 (Qld) Part 6B Division 1 – Exclusion of,https://jade.io/article/353262,jade
2044,337,Evidence Act 1977 (Qld),348A Section 761 – Application of ch 32 to proceedings Evidence Act 1977 (Qld) Part 6B Division 1 – Exclusion of public Part 6B,https://jade.io/article/353262,jade
2045,337,(Qld),– Application of ch 32 to proceedings Evidence Act 1977 (Qld) Part 6B Division 1 – Exclusion of public Part 6B,https://jade.io/article/353262,jade
2046,337,1,32 to proceedings Evidence Act 1977 (Qld) Part 6B Division 1 – Exclusion of public Part 6B Division 2 – Prohibitions,https://jade.io/article/353262/section/187127,jade
2047,337,Criminal,of the relevant part of the Criminal Code by the Criminal Law (Coercive Control and Affirmative Consent) and Other Legislation Amendment,https://jade.io/article/1067156,jade
2048,337,Criminal Law,of the relevant part of the Criminal Code by the Criminal Law (Coercive Control and Affirmative Consent) and Other Legislation Amendment Act,https://jade.io/article/1067156,jade
2049,337,Law,the relevant part of the Criminal Code by the Criminal Law (Coercive Control and Affirmative Consent) and Other Legislation Amendment Act,https://jade.io/article/1067156,jade
2050,337,Law (Coercive,the relevant part of the Criminal Code by the Criminal Law (Coercive Control and Affirmative Consent) and Other Legislation Amendment Act 2024,https://jade.io/article/1067156,jade
2051,337,(Coercive,relevant part of the Criminal Code by the Criminal Law (Coercive Control and Affirmative Consent) and Other Legislation Amendment Act 2024,https://jade.io/article/1067156,jade
2052,337,(Coercive Control,"relevant part of the Criminal Code by the Criminal Law (Coercive Control and Affirmative Consent) and Other Legislation Amendment Act 2024 (Qld),",https://jade.io/article/1067156,jade
2053,337,Control and Affirmative Consent) and,"part of the Criminal Code by the Criminal Law (Coercive Control and Affirmative Consent) and Other Legislation Amendment Act 2024 (Qld), namely on 23 September",https://jade.io/article/1067156,jade
2054,337,"Other Legislation Amendment Act 2024 (Qld),","by the Criminal Law (Coercive Control and Affirmative Consent) and Other Legislation Amendment Act 2024 (Qld), namely on 23 September 2024. The transitional provision, s 761",https://jade.io/article/1067156,jade
2055,337,"(Qld),","Control and Affirmative Consent) and Other Legislation Amendment Act 2024 (Qld), namely on 23 September 2024. The transitional provision, s 761",https://jade.io/article/1067156,jade
2056,337,Crimes,"the legislative provisions in New South Wales(ss 61HI-61HJ of the Crimes Act 1900 (NSW)), Victoria(ss 36-36AA of the Crimes Act 1958",https://jade.io/article/275283,jade
2057,337,Crimes Act,"the legislative provisions in New South Wales(ss 61HI-61HJ of the Crimes Act 1900 (NSW)), Victoria(ss 36-36AA of the Crimes Act 1958 (Vic)),",https://jade.io/article/275283,jade
2058,337,"Act 1900 (NSW)),","legislative provisions in New South Wales(ss 61HI-61HJ of the Crimes Act 1900 (NSW)), Victoria(ss 36-36AA of the Crimes Act 1958 (Vic)), Formatting Tests",https://jade.io/article/275283,jade
2059,337,"(NSW)),","in New South Wales(ss 61HI-61HJ of the Crimes Act 1900 (NSW)), Victoria(ss 36-36AA of the Crimes Act 1958 (Vic)), Formatting Tests",https://jade.io/article/275283,jade
2060,337,Crimes,"of the Crimes Act 1900 (NSW)), Victoria(ss 36-36AA of the Crimes Act 1958 (Vic)), Formatting Tests (Test Edition) 337 Test publisher",https://jade.io/article/281802,jade
2061,337,Crimes Act,"of the Crimes Act 1900 (NSW)), Victoria(ss 36-36AA of the Crimes Act 1958 (Vic)), Formatting Tests (Test Edition) 337 Test publisher for",https://jade.io/article/281802,jade
2062,337,"Act 1958 (Vic)),","the Crimes Act 1900 (NSW)), Victoria(ss 36-36AA of the Crimes Act 1958 (Vic)), Formatting Tests (Test Edition) 337 Test publisher for QLD bench",https://jade.io/article/281802,jade
2063,337,"(Vic)),","Act 1900 (NSW)), Victoria(ss 36-36AA of the Crimes Act 1958 (Vic)), Formatting Tests (Test Edition) 337 Test publisher for QLD bench",https://jade.io/article/281802,jade
2064,338,Criminal Code,"1924 (Tas)), and in the Northern Territory(pt VIA of the Criminal Code Act 1983 (NT)). Section 348AA(2) is in the same terms",https://jade.io/article/699241,jade
2065,338,Code Act,"(Tas)), and in the Northern Territory(pt VIA of the Criminal Code Act 1983 (NT)). Section 348AA(2) is in the same terms as",https://jade.io/article/699241,jade
2066,338,Act 1983 (NT)).,and in the Northern Territory(pt VIA of the Criminal Code Act 1983 (NT)). Section 348AA(2) is in the same terms as s 2A(3),https://jade.io/article/699241,jade
2067,338,(NT)).,the Northern Territory(pt VIA of the Criminal Code Act 1983 (NT)). Section 348AA(2) is in the same terms as s 2A(3),https://jade.io/article/699241,jade
2068,338,Criminal,some assistance in understanding the effect of the provisions. The Criminal Law (Coercive Control and Affirmative Consent) and Other Legislation Amendment,https://jade.io/article/1067156,jade
2069,338,Criminal Law,some assistance in understanding the effect of the provisions. The Criminal Law (Coercive Control and Affirmative Consent) and Other Legislation Amendment Act,https://jade.io/article/1067156,jade
2070,338,Law,assistance in understanding the effect of the provisions. The Criminal Law (Coercive Control and Affirmative Consent) and Other Legislation Amendment Act,https://jade.io/article/1067156,jade
2071,338,Law (Coercive,assistance in understanding the effect of the provisions. The Criminal Law (Coercive Control and Affirmative Consent) and Other Legislation Amendment Act 2024,https://jade.io/article/1067156,jade
2072,338,(Coercive,in understanding the effect of the provisions. The Criminal Law (Coercive Control and Affirmative Consent) and Other Legislation Amendment Act 2024,https://jade.io/article/1067156,jade
2073,338,(Coercive Control,in understanding the effect of the provisions. The Criminal Law (Coercive Control and Affirmative Consent) and Other Legislation Amendment Act 2024 also,https://jade.io/article/1067156,jade
2074,338,Control,understanding the effect of the provisions. The Criminal Law (Coercive Control and Affirmative Consent) and Other Legislation Amendment Act 2024 also,https://jade.io/article/1067156,jade
2075,338,Control and,understanding the effect of the provisions. The Criminal Law (Coercive Control and Affirmative Consent) and Other Legislation Amendment Act 2024 also introduced,https://jade.io/article/1067156,jade
2076,338,and,the effect of the provisions. The Criminal Law (Coercive Control and Affirmative Consent) and Other Legislation Amendment Act 2024 also introduced,https://jade.io/article/1067156,jade
2077,338,and Affirmative,the effect of the provisions. The Criminal Law (Coercive Control and Affirmative Consent) and Other Legislation Amendment Act 2024 also introduced ss,https://jade.io/article/1067156,jade
2078,338,Affirmative,effect of the provisions. The Criminal Law (Coercive Control and Affirmative Consent) and Other Legislation Amendment Act 2024 also introduced ss,https://jade.io/article/1067156,jade
2079,338,Affirmative Consent),effect of the provisions. The Criminal Law (Coercive Control and Affirmative Consent) and Other Legislation Amendment Act 2024 also introduced ss 103ZS-103ZW,https://jade.io/article/1067156,jade
2080,338,Consent),of the provisions. The Criminal Law (Coercive Control and Affirmative Consent) and Other Legislation Amendment Act 2024 also introduced ss 103ZS-103ZW,https://jade.io/article/1067156,jade
2081,338,Consent) and,of the provisions. The Criminal Law (Coercive Control and Affirmative Consent) and Other Legislation Amendment Act 2024 also introduced ss 103ZS-103ZW into,https://jade.io/article/1067156,jade
2082,338,and,the provisions. The Criminal Law (Coercive Control and Affirmative Consent) and Other Legislation Amendment Act 2024 also introduced ss 103ZS-103ZW into,https://jade.io/article/1067156,jade
2083,338,and Other,the provisions. The Criminal Law (Coercive Control and Affirmative Consent) and Other Legislation Amendment Act 2024 also introduced ss 103ZS-103ZW into the,https://jade.io/article/1067156,jade
2084,338,Other,provisions. The Criminal Law (Coercive Control and Affirmative Consent) and Other Legislation Amendment Act 2024 also introduced ss 103ZS-103ZW into the,https://jade.io/article/1067156,jade
2085,338,Other Legislation,provisions. The Criminal Law (Coercive Control and Affirmative Consent) and Other Legislation Amendment Act 2024 also introduced ss 103ZS-103ZW into the Evidence,https://jade.io/article/1067156,jade
2086,338,Legislation Amendment Act 2024,The Criminal Law (Coercive Control and Affirmative Consent) and Other Legislation Amendment Act 2024 also introduced ss 103ZS-103ZW into the Evidence Act 1977. They,https://jade.io/article/1067156,jade
2087,338,Evidence Act 1977.,Legislation Amendment Act 2024 also introduced ss 103ZS-103ZW into the Evidence Act 1977. They too took effect on proclamation on 23 September 2024.,https://jade.io/article/353262,jade
2088,338,Evidence,on 23 September 2024. The transitional provision(s 161 of the Evidence Act 1977)in effect means that they apply to all proceedings,https://jade.io/article/353262,jade
2089,338,Evidence Act,on 23 September 2024. The transitional provision(s 161 of the Evidence Act 1977)in effect means that they apply to all proceedings on,https://jade.io/article/353262,jade
2090,338,Act 1977)in,23 September 2024. The transitional provision(s 161 of the Evidence Act 1977)in effect means that they apply to all proceedings on or,https://jade.io/article/353262,jade
2091,338,292A-292E,counter-intuitive reasoning in sexual offence trials. They broadly reflect ss 292A-292E of the Criminal Procedure Act 1986 (NSW). The suggested directions,https://jade.io/article/275297/section/1346225,jade
2092,338,292A-292E,counter-intuitive reasoning in sexual offence trials. They broadly reflect ss 292A-292E of the Criminal Procedure Act 1986 (NSW). The suggested directions,https://jade.io/article/275297/section/1346225,jade
2093,338,292A-292E,counter-intuitive reasoning in sexual offence trials. They broadly reflect ss 292A-292E of the Criminal Procedure Act 1986 (NSW). The suggested directions,https://jade.io/article/275297/section/1346225,jade
2094,338,Criminal Procedure Act,sexual offence trials. They broadly reflect ss 292A-292E of the Criminal Procedure Act 1986 (NSW). The suggested directions in this chapter are a,https://jade.io/article/275297,jade
2095,338,1986 (NSW).,They broadly reflect ss 292A-292E of the Criminal Procedure Act 1986 (NSW). The suggested directions in this chapter are a combination of,https://jade.io/article/275297,jade
2096,338,(NSW).,broadly reflect ss 292A-292E of the Criminal Procedure Act 1986 (NSW). The suggested directions in this chapter are a combination of,https://jade.io/article/275297,jade
2097,338,[2019],"not apply in R v Shetty [2005] 2 Qd R [2019] 2 Qd R 46540, 543 [13]-[14]and R v Addley appear",https://jade.io/article/592896,jade
2098,338,"2 Qd R 46540,","apply in R v Shetty [2005] 2 Qd R [2019] 2 Qd R 46540, 543 [13]-[14]and R v Addley appear to be apposite. Nonetheless,",https://jade.io/article/592896,jade
2099,339,[1995]2 Qd R 490).,these offences. Consent may be tacit or implied(Horan v Ferguson [1995]2 Qd R 490). Force applied with the consent of the other person will,https://jade.io/article/205939,jade
2100,339,[2016],"consent is obtained by fraud. See also R v Gee [2016] 2 Qd R 602, dealing with an assault on an",https://jade.io/article/448160,jade
2101,339,[2016] 2,"consent is obtained by fraud. See also R v Gee [2016] 2 Qd R 602, dealing with an assault on an infant",https://jade.io/article/448160,jade
2102,339,2 Qd,"is obtained by fraud. See also R v Gee [2016] 2 Qd R 602, dealing with an assault on an infant and",https://jade.io/article/448160,jade
2103,339,Qd R,"obtained by fraud. See also R v Gee [2016] 2 Qd R 602, dealing with an assault on an infant and what",https://jade.io/article/448160,jade
2104,339,R,"by fraud. See also R v Gee [2016] 2 Qd R 602, dealing with an assault on an infant and what",https://jade.io/article/448160,jade
2105,339,"R 602,","by fraud. See also R v Gee [2016] 2 Qd R 602, dealing with an assault on an infant and what conduct",https://jade.io/article/448160,jade
2106,339,"602,","fraud. See also R v Gee [2016] 2 Qd R 602, dealing with an assault on an infant and what conduct",https://jade.io/article/448160,jade
2107,344,103ZS,"the charged act was done without consent. (Where appropriate: s 103ZS of the Evidence Act 1977): In this trial, there is",https://jade.io/article/353262/section/1424725,jade
2108,344,Evidence Act 1977):,"was done without consent. (Where appropriate: s 103ZS of the Evidence Act 1977): In this trial, there is evidence that [set out the",https://jade.io/article/353262,jade
2109,345,103ZT,occur as between different kinds of people. (Where appropriate: s 103ZT of the Evidence Act 1977): In this trial there is,https://jade.io/article/353262/section/1424726,jade
2110,345,Evidence,different kinds of people. (Where appropriate: s 103ZT of the Evidence Act 1977): In this trial there is evidence that[set out,https://jade.io/article/353262,jade
2111,345,Evidence Act,different kinds of people. (Where appropriate: s 103ZT of the Evidence Act 1977): In this trial there is evidence that[set out the,https://jade.io/article/353262,jade
2112,345,Act 1977):,kinds of people. (Where appropriate: s 103ZT of the Evidence Act 1977): In this trial there is evidence that[set out the relevant,https://jade.io/article/353262,jade
2113,345,103ZU,how people respond to non-consensual sexual activity. (Where appropriate: s 103ZU of the Evidence Act 1977): In this trial there is,https://jade.io/article/353262/section/1424727,jade
2114,345,Evidence Act 1977):,to non-consensual sexual activity. (Where appropriate: s 103ZU of the Evidence Act 1977): In this trial there is evidence that [set out the,https://jade.io/article/353262,jade
2115,345,103ZV,"evidence, but with that direction in mind. (Where appropriate: s 103ZV of the Evidence Act 1977): It is well known that",https://jade.io/article/353262/section/1424728,jade
2116,345,Evidence,that direction in mind. (Where appropriate: s 103ZV of the Evidence Act 1977): It is well known that trauma may affect,https://jade.io/article/353262,jade
2117,345,Evidence Act,that direction in mind. (Where appropriate: s 103ZV of the Evidence Act 1977): It is well known that trauma may affect people,https://jade.io/article/353262,jade
2118,345,Act,direction in mind. (Where appropriate: s 103ZV of the Evidence Act 1977): It is well known that trauma may affect people,https://jade.io/article/353262,jade
2119,345,Act 1977):,"direction in mind. (Where appropriate: s 103ZV of the Evidence Act 1977): It is well known that trauma may affect people differently,which",https://jade.io/article/353262,jade
2120,345,1977):,"in mind. (Where appropriate: s 103ZV of the Evidence Act 1977): It is well known that trauma may affect people differently,which",https://jade.io/article/353262,jade
2121,345,103ZW,"mind. (Where appropriate and amend the list as appropriate: s 103ZW of the Evidence Act 1977): In this trial, there is",https://jade.io/article/353262/section/1424729,jade
2122,345,Evidence Act 1977):,"and amend the list as appropriate: s 103ZW of the Evidence Act 1977): In this trial, there is evidence that[set out the relevant",https://jade.io/article/353262,jade
2123,348,"(1987)74 ALR 219,","it, knowing it was stolen. In Bruce v The Queen (1987)74 ALR 219, the High Court(Mason CJ, Brennan, Deane, Dawson and Gaudron JJ)said",https://jade.io/article/67375,jade
2124,352,"398,","Fatal Offences Against the Person The Queen (1991)172 CLR 378, 398, 411, 423; [1991]HCA 27; see also R v Swan (2020)269",https://jade.io/article/67628/section/140314,jade
2125,352,"411,","Offences Against the Person The Queen (1991)172 CLR 378, 398, 411, 423; [1991]HCA 27; see also R v Swan (2020)269 CLR",https://jade.io/article/67628/section/140347,jade
2126,352,423;,"Against the Person The Queen (1991)172 CLR 378, 398, 411, 423; [1991]HCA 27; see also R v Swan (2020)269 CLR 663;",https://jade.io/article/67628/section/140004,jade
2127,352,[1991]HCA 27;,"the Person The Queen (1991)172 CLR 378, 398, 411, 423; [1991]HCA 27; see also R v Swan (2020)269 CLR 663; [2020]HCA 11).",https://jade.io/article/67628,jade
2128,352,[2020]HCA 11).,[1991]HCA 27; see also R v Swan (2020)269 CLR 663; [2020]HCA 11). This principle is to be understood subject to s 296,https://jade.io/article/722112,jade
2129,352,"387,","subsequent treatment’. In Royall v The Queen (1991)172 CLR 378, 387, 411-412, 423, 441; [1991]HCA 27, the High Court endorsed the",https://jade.io/article/67628/section/140656,jade
2130,352,"411-412,","treatment’. In Royall v The Queen (1991)172 CLR 378, 387, 411-412, 423, 441; [1991]HCA 27, the High Court endorsed the statement",https://jade.io/article/67628/section/4812,jade
2131,352,"423,","In Royall v The Queen (1991)172 CLR 378, 387, 411-412, 423, 441; [1991]HCA 27, the High Court endorsed the statement of",https://jade.io/article/67628/section/140004,jade
2132,352,441;,"Royall v The Queen (1991)172 CLR 378, 387, 411-412, 423, 441; [1991]HCA 27, the High Court endorsed the statement of Burt",https://jade.io/article/67628/section/140423,jade
2133,352,"[1991]HCA 27,","v The Queen (1991)172 CLR 378, 387, 411-412, 423, 441; [1991]HCA 27, the High Court endorsed the statement of Burt CJ in",https://jade.io/article/67628,jade
2134,352,"(1980)2 A Crim R 157,","the statement of Burt CJ in Campbell v The Queen (1980)2 A Crim R 157, 161 that it is enough if juries are told that",https://jade.io/citation/2360687,jade
2135,352,161,"in Campbell v The Queen (1980)2 A Crim R 157, 161 that it is enough if juries are told that the",https://jade.io/citation/2360687/section/139991,jade
2136,352,"[2018]HCA 28,","fatal contribution. In Lane v The Queen (2018)265 CLR 196; [2018]HCA 28, the High Court allowed an appeal where the case had",https://jade.io/article/592985,jade
2137,352,[2022]QCA 216.,This approach was affirmed as correct in R v Koko [2022]QCA 216. The element of unlawfulness Section 291 provides that ‘[i]t is,https://jade.io/article/952709,jade
2138,353,[2017]HCA 17).,is available for manslaughter(Pickering v The Queen (2017)260 CLR 151; [2017]HCA 17). The trial judge is obliged to leave a defence to,https://jade.io/article/528728,jade
2139,353,"(1995)183 CLR 58,","doubt that the defence has been excluded(Masciantonio v The Queen (1995)183 CLR 58, 67-68). The element of intention See Chapter 8.1 Intention. Where,",https://jade.io/article/188378,jade
2140,353,67-68).,"defence has been excluded(Masciantonio v The Queen (1995)183 CLR 58, 67-68). The element of intention See Chapter 8.1 Intention. Where, as",https://jade.io/article/188378/section/140384,jade
2141,353,490;,"or her conduct (Zaburoni v The Queen (2016)256 CLR 482, 490; [2016]HCA 12, [14]). The plurality(Kiefel, Bell, and Keane JJ)in Zaburoni",https://jade.io/article/460468/section/140243,jade
2142,353,"[2016]HCA 12,","her conduct (Zaburoni v The Queen (2016)256 CLR 482, 490; [2016]HCA 12, [14]). The plurality(Kiefel, Bell, and Keane JJ)in Zaburoni v The",https://jade.io/article/460468,jade
2143,353,[14]).,"(Zaburoni v The Queen (2016)256 CLR 482, 490; [2016]HCA 12, [14]). The plurality(Kiefel, Bell, and Keane JJ)in Zaburoni v The Queen",https://jade.io/article/460468/section/140848,jade
2144,353,490;,"and Keane JJ)in Zaburoni v The Queen (2016)256 CLR 482, 490; [2016] HCA 12, [14] explained that: ‘Where proof of the",https://jade.io/article/460468/section/140243,jade
2145,353,[2016],"Keane JJ)in Zaburoni v The Queen (2016)256 CLR 482, 490; [2016] HCA 12, [14] explained that: ‘Where proof of the intention",https://jade.io/article/460468,jade
2146,353,"HCA 12,","JJ)in Zaburoni v The Queen (2016)256 CLR 482, 490; [2016] HCA 12, [14] explained that: ‘Where proof of the intention to produce",https://jade.io/article/460468,jade
2147,353,[14],"v The Queen (2016)256 CLR 482, 490; [2016] HCA 12, [14] explained that: ‘Where proof of the intention to produce a",https://jade.io/article/460468/section/140848,jade
2148,353,"[1985]2 Qd R 413,","requests assistance concerning the concept (R v Willmot (No 2) [1985]2 Qd R 413, 418-419). In R v Glebow [2002]QCA 442, Davies JA observed",https://jade.io/citation/419008,jade
2149,353,418-419).,"concept (R v Willmot (No 2) [1985]2 Qd R 413, 418-419). In R v Glebow [2002]QCA 442, Davies JA observed at",https://jade.io/citation/419008/section/2615,jade
