link_id,page_no,link_text,surrounding_text,link_destination,link_domain,jade_link
1087,150,[141];,"v Skaf [2004]NSWCCA 74, [159]-[168]; R v Johnston [2004]NSWCCA 58, [141]; R v Lewis [1996]QCA 405; R v The Queen (1995)63",https://jade.io/article/138132/section/3910,jade,NA: JADE
1088,150,[1996]QCA,"[159]-[168]; R v Johnston [2004]NSWCCA 58, [141]; R v Lewis [1996]QCA 405; R v The Queen (1995)63 SASR 417; and R",http://archive.sclqld.org.au/qjudgment/1996/QCA96-405.pdf,sclqld,https://jade.io/article/165673
1090,150,(1995)63 SASR 417;,"[141]; R v Lewis [1996]QCA 405; R v The Queen (1995)63 SASR 417; and R v Rezk [1994]2 Qd R 321, 330). 4.1.3",https://anzlaw.thomsonreuters.com/Document/I7727af0088f311e8aca5bab3c9b3f468/View/FullText.html?transitionType=Default&contextData=(sc.Default)&VR=3.0&RS=cblt1.0,thomsonreuters,NA: thomsonreuters
1091,150,"[1994]2 Qd R 321,","v The Queen (1995)63 SASR 417; and R v Rezk [1994]2 Qd R 321, 330). 4.1.3 Suggested Direction [Last reviewed: February 2026] Queensland Supreme",https://www.queenslandjudgments.com.au/case/id/502794,queenslandjudgments,NA: QR
1092,150,330).,"SASR 417; and R v Rezk [1994]2 Qd R 321, 330). 4.1.3 Suggested Direction [Last reviewed: February 2026] Queensland Supreme and",https://jade.io/article/205672/section/140824,jade,NA: JADE
1093,152,"[2021]QCA 262,","4.2.2 Commentary [Last reviewed: February 2026] In R v Rose [2021]QCA 262, [49] the Court discussed the ‘Liberato’ direction(Liberato v The Queen",https://www.queenslandjudgments.com.au/caselaw/qca/2021/262,queenslandjudgments,NA: QR
1094,152,[49],"[Last reviewed: February 2026] In R v Rose [2021]QCA 262, [49] the Court discussed the ‘Liberato’ direction(Liberato v The Queen (1985)159",https://jade.io/article/867485/section/1625,jade,NA: JADE
1095,152,(1985)159 CLR 507;,[49] the Court discussed the ‘Liberato’ direction(Liberato v The Queen (1985)159 CLR 507; [1985]HCA 66): ‘The Liberato direction is commonly given in cases,https://anzlaw.thomsonreuters.com/Link/Document/FullText?findType=Y&serNum=1985188218&pubNum=3586&originatingDoc=I87c584b087b111e8aca5bab3c9b3f468&refType=TG&originationContext=document&transitionType=DocumentItem&ppcid=0e4850ef12ef43f89342147c0d3d36e2&contextData=(sc.Default)&comp=wlau,thomsonreuters,NA: thomsonreuters
1096,152,[1985]HCA 66):,discussed the ‘Liberato’ direction(Liberato v The Queen (1985)159 CLR 507; [1985]HCA 66): ‘The Liberato direction is commonly given in cases described as“word,https://jade.io/article/67233,jade,NA: JADE
1097,152,"(2019)268 CLR 57,","as to that issue”’. In De Silva v The Queen (2019)268 CLR 57, 63 [11]; [2019]HCA 48, [11], the majority said that a",https://anzlaw.thomsonreuters.com/Link/Document/FullText?findType=Y&serNum=2049840340&pubNum=3586&originatingDoc=I0f08da541e6511ea8c50c7a8655a0ef5&refType=TG&originationContext=document&transitionType=DocumentItem&ppcid=bbb16dee5e2945048cf78c5117c79964&contextData=(sc.Default)&comp=wlau,thomsonreuters,NA: thomsonreuters
1098,152,63,"issue”’. In De Silva v The Queen (2019)268 CLR 57, 63 [11]; [2019]HCA 48, [11], the majority said that a Liberato",https://jade.io/article/694847/section/140185,jade,NA: JADE
1100,152,"[2019]HCA 48,","De Silva v The Queen (2019)268 CLR 57, 63 [11]; [2019]HCA 48, [11], the majority said that a Liberato direction may be",https://www.hcourt.gov.au/sites/default/files/eresources/2019/HCA/48.pdf,hcourt,https://jade.io/article/694847
1102,152,(2001)205 CLR 50;,"give evidence, an Azzopardi direction is required(Azzopardi v The Queen (2001)205 CLR 50; [2001]HCA 25; see also R v Hartfiel [2014]QCA 132). As",https://anzlaw.thomsonreuters.com/Document/Iee73ce3087b411e8aca5bab3c9b3f468/View/FullText.html?transitionType=Default&contextData=(sc.Default)&VR=3.0&RS=cblt1.0,thomsonreuters,NA: thomsonreuters
1103,152,[2001]HCA 25;,Azzopardi direction is required(Azzopardi v The Queen (2001)205 CLR 50; [2001]HCA 25; see also R v Hartfiel [2014]QCA 132). As to the,https://www.hcourt.gov.au/sites/default/files/eresources/2001/HCA/25.pdf,hcourt,https://jade.io/article/68257
1104,152,[2014]QCA 132).,(2001)205 CLR 50; [2001]HCA 25; see also R v Hartfiel [2014]QCA 132). As to the dangers of conveying to the jury the,http://archive.sclqld.org.au/qjudgment/2014/QCA14-132.pdf,sclqld,https://jade.io/article/336292
1105,152,(1983)34,"bodies of evidence on central matters, see R v Calides (1983)34 SASR 355, 358 and R v G [1994]1 Qd R",https://anzlaw.thomsonreuters.com/Document/Ifb131db088f111e8aca5bab3c9b3f468/View/FullText.html?transitionType=Default&contextData=(sc.Default)&VR=3.0&RS=cblt1.0,thomsonreuters,NA: thomsonreuters
1107,152,358,"on central matters, see R v Calides (1983)34 SASR 355, 358 and R v G [1994]1 Qd R 540, 543. Queensland",https://jade.io/citation/2411271/section/140742,jade,NA: JADE
1108,152,"[1994]1 Qd R 540,","v Calides (1983)34 SASR 355, 358 and R v G [1994]1 Qd R 540, 543. Queensland Supreme and District Courts Criminal Directions Benchbook (2026",https://www.queenslandjudgments.com.au/case/id/510776,queenslandjudgments,NA: QR
1109,152,543,"355, 358 and R v G [1994]1 Qd R 540, 543. Queensland Supreme and District Courts Criminal Directions Benchbook (2026 Edition)",https://jade.io/article/205626/section/140325,jade,NA: JADE
1110,153,[2006]QCA 158,has been referred to with approval in R v Armstrong [2006]QCA 158 and in R v McBride [2008]QCA 412. The content of,http://archive.sclqld.org.au/qjudgment/2006/QCA06-158.pdf,sclqld,https://jade.io/article/169285
1111,153,[2008]QCA 412.,R v Armstrong [2006]QCA 158 and in R v McBride [2008]QCA 412. The content of the second paragraph is drawn from the,http://archive.sclqld.org.au/qjudgment/2008/QCA08-412.pdf,sclqld,https://jade.io/article/88005
1112,153,"(1995)89 A Crim R 325,","from the judgment of Hunt CJ in R v E (1995)89 A Crim R 325, 330. 4.2.3 Suggested direction [Last reviewed: February 2026] Ihavealreadysaidthatthedefendantdoesnothavetogiveevidenceorcallother people",https://anzlaw.thomsonreuters.com/Link/Document/FullText?findType=Y&serNum=1995389337&pubNum=5341&originatingDoc=Ieeb50630881211e8aca5bab3c9b3f468&refType=TG&originationContext=document&transitionType=DocumentItem&ppcid=6224a59362f347eaab642654285f434c&contextData=(sc.Default)&comp=wlau,thomsonreuters,NA: thomsonreuters
1113,153,330,"CJ in R v E (1995)89 A Crim R 325, 330. 4.2.3 Suggested direction [Last reviewed: February 2026] Ihavealreadysaidthatthedefendantdoesnothavetogiveevidenceorcallother people to",https://jade.io/citation/2316189/section/140824,jade,NA: JADE
1114,153,4.2.3,"in R v E (1995)89 A Crim R 325, 330. 4.2.3 Suggested direction [Last reviewed: February 2026] Ihavealreadysaidthatthedefendantdoesnothavetogiveevidenceorcallother people to give",https://jade.io/citation/2316189,jade,NA: JADE
1118,155,"[34],","required(see Azzopardi v The Queen (2001)205 CLR 50; [2001]HCA 25, [34], [51] and [67]). The majority held at [51]and[67]that a direction",https://jade.io/article/68257/section/140626,jade,NA: JADE
1119,155,[51],"Azzopardi v The Queen (2001)205 CLR 50; [2001]HCA 25, [34], [51] and [67]). The majority held at [51]and[67]that a direction containing",https://jade.io/article/68257/section/140879,jade,NA: JADE
1120,155,[67]).,"The Queen (2001)205 CLR 50; [2001]HCA 25, [34], [51] and [67]). The majority held at [51]and[67]that a direction containing most of",https://jade.io/article/68257/section/1739,jade,NA: JADE
1122,155,(2004)150 A Crim R 14;,"is, however, mandated for this direction. In R v DAH (2004)150 A Crim R 14; [2004]QCA 419, White J wrote at [86], in a passage",https://anzlaw.thomsonreuters.com/Document/I17f819f088af11e8aca5bab3c9b3f468/View/FullText.html?transitionType=Default&contextData=(sc.Default)&VR=3.0&RS=cblt1.0,thomsonreuters,NA: thomsonreuters
1123,155,"[2004]QCA 419,","direction. In R v DAH (2004)150 A Crim R 14; [2004]QCA 419, White J wrote at [86], in a passage approved by",http://archive.sclqld.org.au/qjudgment/2004/QCA04-419.pdf,sclqld,https://jade.io/article/168648
1124,155,"[86],","A Crim R 14; [2004]QCA 419, White J wrote at [86], in a passage approved by Cullinane J and supported by",https://jade.io/article/168648/section/131,jade,NA: JADE
1125,155,"[2004]QCA 393,","Jersey CJ in R v Nicholson; Ex parte DPP (Cth) [2004]QCA 393, [8]-[10]. 4.3.3 Suggested Direction [Last reviewed: February 2026] The defendant",http://archive.sclqld.org.au/qjudgment/2004/QCA04-393.pdf,sclqld,https://jade.io/article/168619
1126,155,[8]-[10].,"in R v Nicholson; Ex parte DPP (Cth) [2004]QCA 393, [8]-[10]. 4.3.3 Suggested Direction [Last reviewed: February 2026] The defendant has",https://jade.io/article/168619/section/3583,jade,NA: JADE
1129,157,[68],and exceptional’ (see [68]). The majority in Azzopardi stated at [68] that a comment of this nature should only be made,https://jade.io/article/68257/section/140697,jade,NA: JADE
1130,157,[2019]3 Qd R 126;,"some aspect of the prosecution case’. In R v Doyle [2019]3 Qd R 126; [2018]QCA 303, the President explained at [20] and [21] that:",https://www.queenslandjudgments.com.au/case/id/512778,queenslandjudgments,NA: QR
1131,157,"[2018]QCA 303,","prosecution case’. In R v Doyle [2019]3 Qd R 126; [2018]QCA 303, the President explained at [20] and [21] that: ‘The problem",https://www.queenslandjudgments.com.au/caselaw/qca/2018/303,queenslandjudgments,NA: QR
1132,157,[20],"[2019]3 Qd R 126; [2018]QCA 303, the President explained at [20] and [21] that: ‘The problem is not that a jury",https://jade.io/article/619526/section/318,jade,NA: JADE
1133,157,[21],"R 126; [2018]QCA 303, the President explained at [20] and [21] that: ‘The problem is not that a jury might regard",https://jade.io/article/619526/section/140771,jade,NA: JADE
1134,157,(1993) 178 CLR 217);,the inference urged by the prosecution (Weissensteiner v The Queen (1993) 178 CLR 217); [1993] HCA 65)’. For an example of a direction about,https://anzlaw.thomsonreuters.com/Link/Document/FullText?findType=Y&serNum=1993377957&pubNum=3586&originatingDoc=I6f5b76f087ac11e8aca5bab3c9b3f468&refType=TG&originationContext=document&transitionType=DocumentItem&ppcid=604f7e8daa104492ac155692ef28db16&contextData=(sc.Default)&comp=wlau,thomsonreuters,NA: thomsonreuters
1135,157,[1993] HCA 65)’.,the prosecution (Weissensteiner v The Queen (1993) 178 CLR 217); [1993] HCA 65)’. For an example of a direction about the limited use,https://jade.io/article/67798,jade,NA: JADE
1138,157,[10],"R v Doyle [2019]3 Qd R 126; [2018]QCA 303 at [10] in which the trial judge said, after reminding the jury",https://jade.io/article/619526/section/140725,jade,NA: JADE
1142,158,"[61],","(2001)205 CLR 50; [2001]HCA 25, including those specified at [51], [61], [62], [64], and[67]of the majority judgement. Certain elements of the",https://jade.io/article/68257/section/140807,jade,NA: JADE
1143,158,"[62],","CLR 50; [2001]HCA 25, including those specified at [51], [61], [62], [64], and[67]of the majority judgement. Certain elements of the suggested",https://jade.io/article/68257/section/140340,jade,NA: JADE
1144,158,"[64],","50; [2001]HCA 25, including those specified at [51], [61], [62], [64], and[67]of the majority judgement. Certain elements of the suggested direction",https://jade.io/article/68257/section/2055,jade,NA: JADE
1147,161,Police Powers and Responsibilities Regulation 2012(Qld),"Responsibilities Act 2000(Qld) Section 397–Right to remain silent not affected Police Powers and Responsibilities Regulation 2012(Qld) Schedule 9, Section 26 – Cautioning relevant persons about the",https://jade.io/article/412756,jade,NA: JADE
1149,161,"Schedule 9, Section 26","remain silent not affected Police Powers and Responsibilities Regulation 2012(Qld) Schedule 9, Section 26 – Cautioning relevant persons about the right to silence 4.5.2",https://www.legislation.qld.gov.au/view/html/inforce/current/sl-2012-0251,qld,
1150,161,"(1991)173 CLR 95,","is a fundamental common law rule (Petty v The Queen (1991)173 CLR 95, 97; [1991]HCA 34; R v Coyne [1996]1 Qd R 512,",https://anzlaw.thomsonreuters.com/Link/Document/FullText?findType=Y&serNum=1991367352&pubNum=3586&originatingDoc=Iabfa5ff087ab11e8aca5bab3c9b3f468&refType=TG&originationContext=document&transitionType=DocumentItem&ppcid=6bee927c99b54b31a14a009774285d45&contextData=(sc.Default)&comp=wlau,thomsonreuters,NA: thomsonreuters
1151,161,97;,"common law rule (Petty v The Queen (1991)173 CLR 95, 97; [1991]HCA 34; R v Coyne [1996]1 Qd R 512, 519;",https://jade.io/article/67636/section/140321,jade,NA: JADE
1152,161,[1991]HCA 34;,"law rule (Petty v The Queen (1991)173 CLR 95, 97; [1991]HCA 34; R v Coyne [1996]1 Qd R 512, 519; R v",https://jade.io/article/67636,jade,NA: JADE
1153,161,"[1996]1 Qd R 512,","Queen (1991)173 CLR 95, 97; [1991]HCA 34; R v Coyne [1996]1 Qd R 512, 519; R v Vannatter [1999]QCA 104). In Petty v The",https://www.queenslandjudgments.com.au/case/id/508772,queenslandjudgments,NA: QR
1154,161,519;,"97; [1991]HCA 34; R v Coyne [1996]1 Qd R 512, 519; R v Vannatter [1999]QCA 104). In Petty v The Queen",https://jade.io/citation/419306/section/140093,jade,NA: JADE
1155,161,[1999]QCA 104).,"v Coyne [1996]1 Qd R 512, 519; R v Vannatter [1999]QCA 104). In Petty v The Queen (1991)173 CLR 95; [1991]HCA 34,",https://www.queenslandjudgments.com.au/caselaw/qca/1999/104,queenslandjudgments,NA: QR
1158,161,397,questioned by police has been given legislative effect by s 397 of the Police Powers and Responsibilities Act 2000. Where a,https://jade.io/article/346465/section/35114,jade,NA: JADE
1159,161,Police Powers and Responsibilities Act 2000.,has been given legislative effect by s 397 of the Police Powers and Responsibilities Act 2000. Where a person is to be questioned in relation to,https://jade.io/article/346465,jade,NA: JADE
1160,161,26,officer must caution them in terms set out in s 26 of sch 9 of the Police Powers and Responsibilities Regulation,https://jade.io/article/412756/section/291450,jade,NA: JADE
1162,161,431,"Police Powers and Responsibilities Regulation 2012, as required by s 431 of the Police Powers and Responsibilities Act 2000. Evidence that",https://jade.io/article/346465/section/10224,jade,NA: JADE
1165,161,"R(2009)196 A Crim R 472,","silence should be given when the evidence is given(Sanchez v R(2009)196 A Crim R 472, 486; [2009]NSWCCA 171, [57]). The direction may also bear repeating",https://anzlaw.thomsonreuters.com/Document/Ia2a74df0881e11e8aca5bab3c9b3f468/View/FullText.html?transitionType=Default&contextData=(sc.Default)&VR=3.0&RS=cblt1.0,thomsonreuters,NA: thomsonreuters
1166,161,486;,"the evidence is given(Sanchez v R(2009)196 A Crim R 472, 486; [2009]NSWCCA 171, [57]). The direction may also bear repeating in",https://jade.io/article/95895/section/140396,jade,NA: JADE
1167,161,[2009]NSWCCA,"evidence is given(Sanchez v R(2009)196 A Crim R 472, 486; [2009]NSWCCA 171, [57]). The direction may also bear repeating in the",http://www.austlii.edu.au/cgi-bin/viewdoc/au/cases/nsw/NSWCCA/2009/171.html,austlii,
1169,161,[57]).,"given(Sanchez v R(2009)196 A Crim R 472, 486; [2009]NSWCCA 171, [57]). The direction may also bear repeating in the summing-up. 4.5.3",https://jade.io/article/95895/section/385,jade,NA: JADE
1170,163,(2002)210 CLR 285;,by defence to call witness In Dyers v The Queen (2002)210 CLR 285; [2002]HCA 45; the High Court restricted the application of Jones,https://anzlaw.thomsonreuters.com/Document/Ie5f5511087b511e8aca5bab3c9b3f468/View/FullText.html?transitionType=Default&contextData=(sc.Default)&VR=3.0&RS=cblt1.0&comp=wlau,thomsonreuters,NA: thomsonreuters
1171,163,[2002]HCA 45;,call witness In Dyers v The Queen (2002)210 CLR 285; [2002]HCA 45; the High Court restricted the application of Jones v Dunkel,https://jade.io/article/68356,jade,NA: JADE
1172,163,(1959)101 CLR 298;,the High Court restricted the application of Jones v Dunkel (1959)101 CLR 298; [1959]HCA 8. It is no longer appropriate for a Jones,https://anzlaw.thomsonreuters.com/Link/Document/FullText?findType=Y&serNum=1959056007&pubNum=3586&originatingDoc=I9b58df1087a011e8aca5bab3c9b3f468&refType=TG&originationContext=document&transitionType=DocumentItem&ppcid=07e47e302c4b4290960271bf1a75c412&contextData=(sc.Default)&comp=wlau,thomsonreuters,NA: thomsonreuters
1173,163,[1959]HCA 8.,restricted the application of Jones v Dunkel (1959)101 CLR 298; [1959]HCA 8. It is no longer appropriate for a Jones v Dunkel,https://jade.io/article/65421,jade,NA: JADE
1175,163,74;,"referred to in Azzopardi v The Queen (2001)205 CLR 50, 74; [2001]HCA 25. Other than those rare circumstances, the first direction",https://jade.io/article/68257/section/139949,jade,NA: JADE
1177,164,(2000)199 CLR 620;,underpins the decisions in Azzopardi and RPS v The Queen (2000)199 CLR 620; [2000]HCA 3 is not confined to the defendant failing to,https://anzlaw.thomsonreuters.com/Link/Document/FullText?findType=Y&serNum=2000496633&pubNum=3586&originatingDoc=Idb17678087b311e8aca5bab3c9b3f468&refType=TG&originationContext=document&transitionType=DocumentItem&ppcid=0964cfcc4c874c5f84a338dbe87db233&contextData=(sc.Default)&comp=wlau,thomsonreuters,NA: thomsonreuters
1181,164,[6],"(2002)210 CLR 285; [2002]HCA 45, Gaudron and Hayne JJ at [6] said: ‘Further, as a general rule, a trial judge should",https://jade.io/article/68356/section/626,jade,NA: JADE
1183,164,633,"CLR 620, Gaudron ACJ, Gummow, Kirby, and Hayne JJ at 633 said: ‘… if the question concerns the failure of the",https://jade.io/article/68197/section/140906,jade,NA: JADE
1185,165,295,"Dunkel be open(see Dyers v The Queen (2002)210 CLR 285, 295 [17]; [2002]HCA 45, [17] (Gaudron and Hayne JJ, Kirby J",https://jade.io/article/68356/section/140542,jade,NA: JADE
1189,165,(2002)213 CLR 606;,"Hayne JJ, Kirby J agreeing)). In MFA v The Queen (2002)213 CLR 606; [2002]HCA 53, [20], [36], [81], the High Court approved a",https://anzlaw.thomsonreuters.com/Link/Document/FullText?findType=Y&serNum=2002716337&pubNum=3586&originatingDoc=I06311e0087b611e8aca5bab3c9b3f468&refType=TG&originationContext=document&transitionType=DocumentItem&ppcid=99829c73c83b4ced9e82d1fcc0847f92&contextData=(sc.Default)&comp=wlau,thomsonreuters,NA: thomsonreuters
1190,165,"[2002]HCA 53,","J agreeing)). In MFA v The Queen (2002)213 CLR 606; [2002]HCA 53, [20], [36], [81], the High Court approved a full Jones",https://jade.io/article/68365,jade,NA: JADE
1191,165,"[20],","In MFA v The Queen (2002)213 CLR 606; [2002]HCA 53, [20], [36], [81], the High Court approved a full Jones v",https://jade.io/article/68365/section/318,jade,NA: JADE
1192,165,"[36],","MFA v The Queen (2002)213 CLR 606; [2002]HCA 53, [20], [36], [81], the High Court approved a full Jones v Dunkel",https://jade.io/article/68365/section/1155,jade,NA: JADE
1193,165,"[81],","v The Queen (2002)213 CLR 606; [2002]HCA 53, [20], [36], [81], the High Court approved a full Jones v Dunkel direction,",https://jade.io/article/68365/section/936,jade,NA: JADE
1194,165,"(1998)103 A Crim R 299,","appropriate to give such a direction is R v Palmer (1998)103 A Crim R 299, which entailed the failure by the prosecution to call a",https://anzlaw.thomsonreuters.com/Document/Ife9a563088d111e8aca5bab3c9b3f468/View/FullText.html?transitionType=Default&contextData=(sc.Default)&VR=3.0&RS=cblt1.0,thomsonreuters,NA: thomsonreuters
1195,166,10,by a ‘person in authority’ for the purposes of s 10 of the Criminal Law Amendment Act 1894(Qld). The prosecution may,https://jade.io/article/529626/section/280,jade,NA: JADE
1196,166,Criminal Law Amendment Act,in authority’ for the purposes of s 10 of the Criminal Law Amendment Act 1894(Qld). The prosecution may wish to lead as an admission(by,https://jade.io/article/529626,jade,NA: JADE
1200,166,30,"by Livesey JA in R v BEC (2023)16 QR 1, 30 [87]: ‘Evidenceaboutastatementwhichhasbeenmadetoorinthepresenceofanaccused,whichwentunanswered by the accused, may or may not be",https://jade.io/article/1040243/section/140723,jade,NA: JADE
1209,169,[2001]2 Qd R 208).,asked of a defendant on a voir dire(R v Semyraha [2001]2 Qd R 208). A defendant or a witness is accordingly protected by privilege,https://www.queenslandjudgments.com.au/case/id/503252,queenslandjudgments,NA: QR
1210,169,"(1983)152 CLR 281,","real evidence of an incriminating character’ (see Sorby v Commonwealth (1983)152 CLR 281, 310; [1983]HCA 10). The defendant has, in addition, the protection",https://anzlaw.thomsonreuters.com/Link/Document/FullText?findType=Y&serNum=1983166824&pubNum=3586&originatingDoc=I2874832087a811e8aca5bab3c9b3f468&refType=TG&originationContext=document&transitionType=DocumentItem&ppcid=ddf62e33acf04689ba38c1d1cb8106a3&contextData=(sc.Default)&comp=wlau,thomsonreuters,NA: thomsonreuters
1211,169,310;,"an incriminating character’ (see Sorby v Commonwealth (1983)152 CLR 281, 310; [1983]HCA 10). The defendant has, in addition, the protection of",https://jade.io/article/67043/section/140819,jade,NA: JADE
1212,169,[1983]HCA 10).,"incriminating character’ (see Sorby v Commonwealth (1983)152 CLR 281, 310; [1983]HCA 10). The defendant has, in addition, the protection of s 15(2)",https://jade.io/article/67043,jade,NA: JADE
1213,169,15(2),"10). The defendant has, in addition, the protection of s 15(2) of the Evidence Act 1977 which precludes questions tending to",https://jade.io/article/353262/section/3664,jade,NA: JADE
1217,169,290;,"he is compelled to answer’(Sorby v Commonwealth (1983)152 CLR 281, 290; [1983] HCA 10). Where a claim for privilege is made",https://jade.io/article/67043/section/139962,jade,NA: JADE
1220,169,"[1997]1 Qd R 429,","inferences from a claim of privilege (see Thompson v Bella-Lewis [1997]1 Qd R 429, 434, 437; R v King [1998]QCA 108), the general thrust",https://www.queenslandjudgments.com.au/case/id/510669,queenslandjudgments,NA: QR
1221,169,"434,","of privilege (see Thompson v Bella-Lewis [1997]1 Qd R 429, 434, 437; R v King [1998]QCA 108), the general thrust of",https://jade.io/article/165489/section/140490,jade,NA: JADE
1222,169,437;,"privilege (see Thompson v Bella-Lewis [1997]1 Qd R 429, 434, 437; R v King [1998]QCA 108), the general thrust of authority",https://jade.io/article/165489/section/140097,jade,NA: JADE
1223,169,"[1998]QCA 108),","Bella-Lewis [1997]1 Qd R 429, 434, 437; R v King [1998]QCA 108), the general thrust of authority is to the effect that",https://www.queenslandjudgments.com.au/caselaw/qca/1998/108,queenslandjudgments,NA: QR
1224,171,"(1893)6 R 67,","that the witness might comment on it (Browne v Dunn (1893)6 R 67, 70, 76). See also Cross on Evidence, Aust ed. [17435]",https://jade.io/citation/5095394,jade,NA: JADE
1225,171,"70,","might comment on it (Browne v Dunn (1893)6 R 67, 70, 76). See also Cross on Evidence, Aust ed. [17435] ff.",https://jade.io/citation/5095394/section/140001,jade,NA: JADE
1226,171,76).,"comment on it (Browne v Dunn (1893)6 R 67, 70, 76). See also Cross on Evidence, Aust ed. [17435] ff. As",https://jade.io/citation/5095394/section/140596,jade,NA: JADE
1227,171,(2021)294 A Crim R 146:,ff. As McMurdo JA put it in R v JAE (2021)294 A Crim R 146: ‘The rule in Browne v Dunn is a general rule,https://anzlaw.thomsonreuters.com/Document/I2f499fc05b3211ed806e89148bcf640e/View/FullText.html?transitionType=Default&contextData=(sc.Default)&VR=3.0&RS=cblt1.0,thomsonreuters,NA: thomsonreuters
1228,171,(1990)19 NSWLR 551,"be done. In Payless Superbarn (NSW) Pty Ltd v O’Gara (1990)19 NSWLR 551 at 556, Clarke JA said that the trial judge ‘may,",https://anzlaw.thomsonreuters.com/Document/I5a466c8087e711e8aca5bab3c9b3f468/View/FullText.html?transitionType=Default&contextData=(sc.Default)&VR=3.0&RS=cblt1.0,thomsonreuters,NA: thomsonreuters
1229,171,"556,","Superbarn (NSW) Pty Ltd v O’Gara (1990)19 NSWLR 551 at 556, Clarke JA said that the trial judge ‘may, for example,",https://jade.io/article/806319/section/140822,jade,NA: JADE
1230,172,(1990)19 NSWLR 677;,4 Evidentiary Directions including counsel’s error or oversight(R v Birks (1990)19 NSWLR 677; R v Manunta (1989)54 SASR 17). The High Court has,https://anzlaw.thomsonreuters.com/Document/Ia521d6c0881111e8aca5bab3c9b3f468/View/FullText.html?transitionType=Default&contextData=(sc.Default)&VR=3.0&RS=cblt1.0,thomsonreuters,NA: thomsonreuters
1231,172,(1989)54 SASR,or oversight(R v Birks (1990)19 NSWLR 677; R v Manunta (1989)54 SASR 17). The High Court has emphasised the need for care,https://anzlaw.thomsonreuters.com/Document/Ib5822580890411e8aca5bab3c9b3f468/View/FullText.html?transitionType=Default&contextData=(sc.Default)&VR=3.0&RS=cblt1.0,thomsonreuters,NA: thomsonreuters
1233,172,(2005)80 ALJR 329;,which is not put is in issue(MWJ v The Queen (2005)80 ALJR 329; R v MAP [2006]QCA 220). Caution should also be exercised,https://anzlaw.thomsonreuters.com/Document/I1d1ff2e087ba11e8aca5bab3c9b3f468/View/FullText.html?transitionType=Default&contextData=(sc.Default)&VR=3.0&RS=cblt1.0,thomsonreuters,NA: thomsonreuters
1234,172,[2006]QCA 220).,issue(MWJ v The Queen (2005)80 ALJR 329; R v MAP [2006]QCA 220). Caution should also be exercised in deciding whether to give,http://archive.sclqld.org.au/qjudgment/2006/QCA06-220.pdf,sclqld,https://jade.io/article/169346
1235,172,[1997]1 VR,witness who was not cross-examined does not complain(see R McDowell [1997]1 VR 473). The rule applies against the prosecution. The Crown should,https://anzlaw.thomsonreuters.com/Document/Ic1f32270891711e8aca5bab3c9b3f468/View/FullText.html?transitionType=Default&contextData=(sc.Default)&VR=3.0&RS=cblt1.0,thomsonreuters,NA: thomsonreuters
1237,172,[2021]QCA 258).,any inconsistent versions to the accused during cross-examination(R v Lewington [2021]QCA 258). As Freeburn J explained in that case: [61] Whilst prosecutors,https://www.queenslandjudgments.com.au/caselaw/qca/2021/258,queenslandjudgments,NA: QR
