link_id,page_no,link_text,surrounding_text,link_destination,link_domain,jade_link
2040,276,494-495,"[11], 358-359 [25]-[27], 382-384 [103], [109]-[110], 425-426 [277]-[278], 478-480 [425]-[433], 494-495 [492]-[493], 500-502 [506], [510], [512]; [2008] HCA 16). To be",https://jade.io/article/69412/section/226373,jade,NA: JADE
2042,276,500-502,"[25]-[27], 382-384 [103], [109]-[110], 425-426 [277]-[278], 478-480 [425]-[433], 494-495 [492]-[493], 500-502 [506], [510], [512]; [2008] HCA 16). To be admissible in",https://jade.io/article/69412/section/18643,jade,NA: JADE
2044,276,"[510],","[103], [109]-[110], 425-426 [277]-[278], 478-480 [425]-[433], 494-495 [492]-[493], 500-502 [506], [510], [512]; [2008] HCA 16). To be admissible in single complainant",https://jade.io/article/69412/section/26151,jade,NA: JADE
2045,276,[512];,"[109]-[110], 425-426 [277]-[278], 478-480 [425]-[433], 494-495 [492]-[493], 500-502 [506], [510], [512]; [2008] HCA 16). To be admissible in single complainant cases(when",https://jade.io/article/69412/section/28660,jade,NA: JADE
2048,276,(2016)257 CLR 300;,"feature, of the kinds described in IMM v The Queen (2016)257 CLR 300; [2016]HCA 14 and Hughes v The Queen (2017)263 CLR 338;",https://anzlaw.thomsonreuters.com/Document/I8eeef7e0aa8811e8b9f2db006db927ca/View/FullText.html?transitionType=Default&contextData=(sc.Default)&VR=3.0&RS=cblt1.0,thomsonreuters,NA: thomsonreuters
2049,276,[2016]HCA 14,"kinds described in IMM v The Queen (2016)257 CLR 300; [2016]HCA 14 and Hughes v The Queen (2017)263 CLR 338; [2017]HCA 20,",https://www.hcourt.gov.au/sites/default/files/eresources/2016/HCA/14.pdf,hcourt,https://jade.io/article/461692
2050,276,(2017)263 CLR 338;,"(2016)257 CLR 300; [2016]HCA 14 and Hughes v The Queen (2017)263 CLR 338; [2017]HCA 20, as the Court held in R v Bauer",https://anzlaw.thomsonreuters.com/Link/Document/FullText?findType=Y&serNum=2041853447&pubNum=3586&originatingDoc=Icc48ab0087cd11e8aca5bab3c9b3f468&refType=TG&originationContext=document&transitionType=DocumentItem&ppcid=d64d5e118b704b27a21ca34f0517952e&contextData=(sc.Default)&comp=wlau,thomsonreuters,NA: thomsonreuters
2051,276,"[2017]HCA 20,","[2016]HCA 14 and Hughes v The Queen (2017)263 CLR 338; [2017]HCA 20, as the Court held in R v Bauer (2018)266 CLR",https://www.hcourt.gov.au/sites/default/files/eresources/2017/HCA/20.pdf,hcourt,https://jade.io/article/533430
2056,277,"(2008)235 CLR 334,","itself a sexual act(see for example, HML v The Queen (2008)235 CLR 334, 399-400 [172]-[174]; [2008]HCA 16 and R v Douglas [2018]QCA 69).",https://anzlaw.thomsonreuters.com/Link/Document/FullText?findType=Y&serNum=2015865511&pubNum=3586&originatingDoc=I13d91fe087bf11e8aca5bab3c9b3f468&refType=TG&originationContext=document&transitionType=DocumentItem&ppcid=4c429d8444624d468798e2af84a6e8c9&contextData=(sc.Default)&comp=wlau,thomsonreuters,NA: thomsonreuters
2057,277,399-400,"act(see for example, HML v The Queen (2008)235 CLR 334, 399-400 [172]-[174]; [2008]HCA 16 and R v Douglas [2018]QCA 69). Evidence",https://jade.io/article/69412/section/15088,jade,NA: JADE
2060,277,[2018]QCA 69).,"CLR 334, 399-400 [172]-[174]; [2008]HCA 16 and R v Douglas [2018]QCA 69). Evidence of statements by the defendant in a pretext telephone",https://www.queenslandjudgments.com.au/case-download/id/306661,queenslandjudgments,NA: QR
2065,277,[247]);,"That being the majority view in HML (see, particularly, at [247]); cf Bauer at 97-98[86], which referred to the position in",https://jade.io/article/312179/section/4635,jade,NA: JADE
2066,277,[2008]QCA,"the defendant was prepared to act (see R v UC [2008]QCA 194, [3]). In cases in this category, the appropriate directions",https://www.queenslandjudgments.com.au/case-download/id/63976,queenslandjudgments,NA: QR
2068,277,[3]).,"was prepared to act (see R v UC [2008]QCA 194, [3]). In cases in this category, the appropriate directions to the",https://jade.io/article/80555/section/140887,jade,NA: JADE
2072,277,502,"the offences charged were isolated events’ (HML (2008)235 CLR 334, 502 [513]; [2008]HCA 16). Kiefel J cautioned, at 502 Queensland Supreme",https://jade.io/article/69412/section/58134,jade,NA: JADE
2077,278,499,"admissibility(Pfennig)must necessarily be applied(HML v The Queen (2008)235 CLR 334, 499 [503]; [2008]HCA 16). See R v MEJ [2024]QCA 249, [128]-[129]",https://jade.io/article/69412/section/23371,jade,NA: JADE
2080,278,"[2024]QCA 249,","CLR 334, 499 [503]; [2008]HCA 16). See R v MEJ [2024]QCA 249, [128]-[129] for an example of where a failure to explain",https://www.queenslandjudgments.com.au/caselaw/qca/2024/249,queenslandjudgments,NA: QR
2081,278,[128]-[129],"499 [503]; [2008]HCA 16). See R v MEJ [2024]QCA 249, [128]-[129] for an example of where a failure to explain the",https://jade.io/article/1110470/section/4704,jade,NA: JADE
2082,278,6A,"justice. Evidence of Violence in a Domestic Relationship See pt 6A of the Evidence Act 1977, especially s 103CB. If there",https://jade.io/article/353262/section/7995,jade,NA: JADE
2086,278,(2003)139,"to sexual offending because of fear (R v The Queen (2003)139 A Crim R 371; [2003]QCA 285, [31], [43]-[44], [59]). In",https://anzlaw.thomsonreuters.com/Document/Id5b663e088ad11e8aca5bab3c9b3f468/View/FullText.html?transitionType=Default&contextData=(sc.Default)&VR=3.0&RS=cblt1.0,thomsonreuters,NA: thomsonreuters
2088,278,"[2003]QCA 285,","fear (R v The Queen (2003)139 A Crim R 371; [2003]QCA 285, [31], [43]-[44], [59]). In cases of that kind, the purpose",https://www.queenslandjudgments.com.au/caselaw/qca/2003/285,queenslandjudgments,NA: QR
2089,278,"[31],","v The Queen (2003)139 A Crim R 371; [2003]QCA 285, [31], [43]-[44], [59]). In cases of that kind, the purpose of",https://jade.io/article/168088/section/1017,jade,NA: JADE
2090,278,"[43]-[44],","The Queen (2003)139 A Crim R 371; [2003]QCA 285, [31], [43]-[44], [59]). In cases of that kind, the purpose of the",https://jade.io/article/168088/section/1574,jade,NA: JADE
2091,278,[59]).,"Queen (2003)139 A Crim R 371; [2003]QCA 285, [31], [43]-[44], [59]). In cases of that kind, the purpose of the evidence",https://jade.io/article/168088/section/140578,jade,NA: JADE
2096,278,13,"under the Domestic and Family Violence Protection Act 2012(Qld) s 13. In cases of this kind, the Pfennig test of admissibility",https://jade.io/article/286296/section/704,jade,NA: JADE
2097,278,"(2011)242 CLR 610,","test of admissibility does not apply (Roach v The Queen (2011)242 CLR 610, 621 [30], 623 [37]-[39], 627 [55]; [2011]HCA 12(‘Roach’). Importantly however,",https://anzlaw.thomsonreuters.com/Link/Document/FullText?findType=Y&serNum=2025217494&pubNum=3586&originatingDoc=I7487d98087c411e8aca5bab3c9b3f468&refType=TG&originationContext=document&transitionType=DocumentItem&ppcid=66f004e3c1ef46b187afc297a6eaf330&contextData=(sc.Default)&comp=wlau,thomsonreuters,NA: thomsonreuters
2098,278,621,"does not apply (Roach v The Queen (2011)242 CLR 610, 621 [30], 623 [37]-[39], 627 [55]; [2011]HCA 12(‘Roach’). Importantly however, s",https://jade.io/article/216441/section/332,jade,NA: JADE
2100,278,623,"apply (Roach v The Queen (2011)242 CLR 610, 621 [30], 623 [37]-[39], 627 [55]; [2011]HCA 12(‘Roach’). Importantly however, s 103CB refers",https://jade.io/article/216441/section/3438,jade,NA: JADE
2102,278,627,"v The Queen (2011)242 CLR 610, 621 [30], 623 [37]-[39], 627 [55]; [2011]HCA 12(‘Roach’). Importantly however, s 103CB refers to relevant",https://jade.io/article/216441/section/140529,jade,NA: JADE
2104,278,[2011]HCA 12(‘Roach’).,"Queen (2011)242 CLR 610, 621 [30], 623 [37]-[39], 627 [55]; [2011]HCA 12(‘Roach’). Importantly however, s 103CB refers to relevant evidence, and the",https://www.hcourt.gov.au/sites/default/files/eresources/2011/HCA/12.pdf,hcourt,https://jade.io/article/216441
2106,278,625,"of the charge (Roach v The Queen (2011)242 CLR 610, 625 [45]; [2011]HCA 12). Except where the evidence constituted an indispensable",https://jade.io/article/216441/section/140602,jade,NA: JADE
2111,278,626,"beyond reasonable doubt (Roach v The Queen (2011)242 CLR 610, 626 [49]; [2011]HCA 12). The necessity for the prosecution to identify",https://jade.io/article/216441/section/1625,jade,NA: JADE
2115,279,"[2023]QCA 266,","to consider whether it is true’. In R v LBD [2023]QCA 266, Mullins P(Bond JA and Crow J agreeing)said at [52]: ‘Where",https://www.queenslandjudgments.com.au/caselaw/qca/2023/266,queenslandjudgments,NA: QR
2116,279,[52]:,"[2023]QCA 266, Mullins P(Bond JA and Crow J agreeing)said at [52]: ‘Where there are multiple uncharged acts of violence relied on",https://jade.io/article/1059915/section/630,jade,NA: JADE
2144,283,103CB.,as evidence in a criminal proceeding: Evidence Act 1977 s 103CB. See also Chapter 5.5 Evidence of Other Sexual or Discreditable,https://jade.io/article/353262/section/1377261,jade,NA: JADE
2148,284,[2022]WASC 130,"Western Australia, in Kritskikh v Director of Public Prosecutions (WA) [2022]WASC 130 Hall J said of the equivalent WA provisions: ‘The evident",https://jade.io/article/913298,jade,NA: JADE
2149,284,(2022)298 A Crim R 415;,"by Mazza and Mitchell JJA in CDO v Western Australia (2022)298 A Crim R 415; [2022]WASCA 58. In particular, their Honours considered whether the reference",https://anzlaw.thomsonreuters.com/Link/Document/FullText?findType=Y&serNum=2056344301&pubNum=5341&originatingDoc=I9a10e440e55211ec9e6e8fde01a1b09b&refType=TG&originationContext=document&transitionType=DocumentItem&ppcid=b68c07b2a7a941fa898923ba778cb651&contextData=(sc.Default)&comp=wlau,thomsonreuters,NA: thomsonreuters
2150,284,[2022]WASCA 58.,"in CDO v Western Australia (2022)298 A Crim R 415; [2022]WASCA 58. In particular, their Honours considered whether the reference to ‘criminal",https://jade.io/article/932367,jade,NA: JADE
2158,286,"[1996]2 Qd R 326,","it is a crime to kill another unlawfully(R v O’Neill [1996]2 Qd R 326, 432(Dowsett J, Pincus JA agreeing at 422)). The position is",https://www.queenslandjudgments.com.au/case/id/507584?mview=%5B1996%5D%202%20qd%20r%20326%7C&u=,queenslandjudgments,NA: QR
2159,286,432(Dowsett,"to kill another unlawfully(R v O’Neill [1996]2 Qd R 326, 432(Dowsett J, Pincus JA agreeing at 422)). The position is different",https://jade.io/article/165345/section/140606,jade,NA: JADE
2160,286,422)).,"[1996]2 Qd R 326, 432(Dowsett J, Pincus JA agreeing at 422)). The position is different in respect of provisions of the",https://jade.io/article/165345/section/140120,jade,NA: JADE
2161,286,[1985]1 Qd R 343,"317 of the Criminal Code, considered in R v Leavitt [1985]1 Qd R 343 (discussed in Benchbook Chapter 9.5 Queensland Supreme and District Courts",https://www.queenslandjudgments.com.au/case/id/500750,queenslandjudgments,NA: QR
2162,287,"[1977]Qd R 80,","the circumstances of the case. In Barbeler v The Queen [1977]Qd R 80, 82-83, it was explained that s 4(1)requires proof of three",https://www.queenslandjudgments.com.au/case/id/504799,queenslandjudgments,NA: QR
2163,287,"82-83,","the case. In Barbeler v The Queen [1977]Qd R 80, 82-83, it was explained that s 4(1)requires proof of three elements,",https://jade.io/citation/2700394/section/140676,jade,NA: JADE
2164,287,"[2020]QCA 38,","that the defendant is responsible for committing them(R v Ridgeway [2020]QCA 38, [74]). There may be an issue as to whether an",https://archive.sclqld.org.au/qjudgment/2020/QCA20-038.pdf,sclqld,https://jade.io/article/718091
2165,287,[74]).,"defendant is responsible for committing them(R v Ridgeway [2020]QCA 38, [74]). There may be an issue as to whether an act",https://jade.io/article/718091/section/140833,jade,NA: JADE
2166,287,"(2016)256 CLR 482,","a specific intent under the Criminal Code(Zaburoni v The Queen (2016)256 CLR 482, 490 [14]; [2016]HCA 12). Where the defendant knows that a",https://anzlaw.thomsonreuters.com/Document/I43ab2d5087cc11e8aca5bab3c9b3f468/View/FullText.html?transitionType=UniqueDocItem&contextData=(sc.UserEnteredCitation)&userEnteredCitation=Zaburoni+v+The+Queen+(2016)+256+CLR+482&comp=wlau,thomsonreuters,NA: thomsonreuters
2167,287,490,"under the Criminal Code(Zaburoni v The Queen (2016)256 CLR 482, 490 [14]; [2016]HCA 12). Where the defendant knows that a particular",https://jade.io/article/460468/section/140848,jade,NA: JADE
2169,287,[2016]HCA 12).,"Criminal Code(Zaburoni v The Queen (2016)256 CLR 482, 490 [14]; [2016]HCA 12). Where the defendant knows that a particular result of the",https://www.hcourt.gov.au/sites/default/files/eresources/2016/HCA/12.pdf,hcourt,https://jade.io/article/460468
2171,287,490,"produce the particular result(Zaburoni v The Queen (2016)256 CLR 482, 490 [15]; [2016]HCA 12). Intention and motive are different things in",https://jade.io/article/460468/section/140827,jade,NA: JADE
2175,287,490,"things in this context(Zaburoni v The Queen (2016)256 CLR 482, 490 [16]; [2016]HCA 12). Queensland Supreme and District Courts Criminal Directions",https://jade.io/article/460468/section/140124,jade,NA: JADE
2178,288,"(2007)176 A Crim R 238,","offence from an attempt to commit it(R v De Silva (2007)176 A Crim R 238, 247; [2007]QCA 301)where Jerrard JA additionally observed it is not",https://anzlaw.thomsonreuters.com/Document/I686d1b9088b111e8aca5bab3c9b3f468/View/FullText.html?transitionType=UniqueDocItem&contextData=(sc.UserEnteredCitation)&userEnteredCitation=R+v+De+Silva+(2007)+176+A+Crim+R+238&comp=wlau,thomsonreuters,NA: thomsonreuters
2179,288,247;,"commit it(R v De Silva (2007)176 A Crim R 238, 247; [2007]QCA 301)where Jerrard JA additionally observed it is not necessary",https://jade.io/article/14879/section/139950,jade,NA: JADE
2180,288,[2007]QCA 301)where,"it(R v De Silva (2007)176 A Crim R 238, 247; [2007]QCA 301)where Jerrard JA additionally observed it is not necessary to establish",https://www.queenslandjudgments.com.au/caselaw/qca/2007/301,queenslandjudgments,NA: QR
2181,288,"[1965]Qd R 86,","v Williams; Ex parte Minister for Justice and Attorney-General (Qld) [1965]Qd R 86, 100 (Stable J, Wanstall J agreeing at 95)). It may",https://www.queenslandjudgments.com.au/case/id/512279,queenslandjudgments,NA: QR
2182,288,100,"parte Minister for Justice and Attorney-General (Qld) [1965]Qd R 86, 100 (Stable J, Wanstall J agreeing at 95)). It may sometimes",https://jade.io/citation/2707070/section/139987,jade,NA: JADE
2183,288,95)).,"[1965]Qd R 86, 100 (Stable J, Wanstall J agreeing at 95)). It may sometimes occur that the means by which the",https://jade.io/citation/2707070/section/140502,jade,NA: JADE
2184,288,"[2007]QCA 209,","which overt act they are satisfied of (R v Lake [2007]QCA 209, [67]). It is unnecessary to prove the offence being attempted",https://www.queenslandjudgments.com.au/caselaw/qca/2007/209,queenslandjudgments,NA: QR
2185,288,[67]).,"act they are satisfied of (R v Lake [2007]QCA 209, [67]). It is unnecessary to prove the offence being attempted was",https://jade.io/article/14804/section/1739,jade,NA: JADE
2186,289,"[2006]QCA 206,","of the case. However, cases such as R v David [2006]QCA 206, [42]-[43] and R v Huni [2014]QCA 324, [62]-[63], [71] contain",https://www.queenslandjudgments.com.au/caselaw/qca/2006/206,queenslandjudgments,NA: QR
2187,289,[42]-[43],"case. However, cases such as R v David [2006]QCA 206, [42]-[43] and R v Huni [2014]QCA 324, [62]-[63], [71] contain observations",https://jade.io/article/169325/section/5208,jade,NA: JADE
2188,289,"[2014]QCA 324,","R v David [2006]QCA 206, [42]-[43] and R v Huni [2014]QCA 324, [62]-[63], [71] contain observations implicitly suggesting the following approach is",https://www.queenslandjudgments.com.au/caselaw/qca/2014/324,queenslandjudgments,NA: QR
2189,289,"[62]-[63],","David [2006]QCA 206, [42]-[43] and R v Huni [2014]QCA 324, [62]-[63], [71] contain observations implicitly suggesting the following approach is apt:",https://jade.io/article/354399/section/5714,jade,NA: JADE
2190,289,[71],"[2006]QCA 206, [42]-[43] and R v Huni [2014]QCA 324, [62]-[63], [71] contain observations implicitly suggesting the following approach is apt: Where",https://jade.io/article/354399/section/140801,jade,NA: JADE
2191,295,Criminal Code,and Parties to Offence 7.2 Conspiracy Other than under the Criminal Code (Cth) 7.2.1 Legislation [Last reviewed: March 2026] Criminal Code Section,https://jade.io/article/216608,jade,NA: JADE
2196,295,(1965)50 Cr App R,only to play a part in agreed conduct(R v Thomson (1965)50 Cr App R 1). The requirement of intentional participation(as opposed to recklessness) was,https://anzlaw.thomsonreuters.com/Link/Document/FullText?findType=g&serNum=1966017006&pubNum=4705&originatingDoc=I9433F190E43611DA8FC2A0F0355337E9&refType=UD&originationContext=document&transitionType=DocumentItem&ppcid=456e35f5166a4237bcac736ebd4bd103&contextData=(sc.DocLink)&comp=wlau,thomsonreuters,NA: thomsonreuters
2198,295,"(1985)156 CLR 473,","opposed to recklessness) was affirmed in Giorgianni v The Queen (1985)156 CLR 473, 506; [1985]HCA 29. For conspiracy, the prosecution must prove that:",https://anzlaw.thomsonreuters.com/Link/Document/FullText?findType=Y&serNum=1985187596&pubNum=3586&originatingDoc=Ifaa4f41087a811e8aca5bab3c9b3f468&refType=TG&originationContext=document&transitionType=DocumentItem&ppcid=69ccc2b1398b4a77a8f34babd45419da&contextData=(sc.Default)&comp=wlau,thomsonreuters,NA: thomsonreuters
2199,295,506;,"was affirmed in Giorgianni v The Queen (1985)156 CLR 473, 506; [1985]HCA 29. For conspiracy, the prosecution must prove that: 1.",https://jade.io/article/67192/section/140466,jade,NA: JADE
2200,295,[1985]HCA 29.,"affirmed in Giorgianni v The Queen (1985)156 CLR 473, 506; [1985]HCA 29. For conspiracy, the prosecution must prove that: 1. The defendant",https://jade.io/article/67192,jade,NA: JADE
2201,295,"(1988)165 CLR 87,","essence of conspiracy is the unlawful agreement(Ahern v The Queen (1988)165 CLR 87, 93; [1988]HCA 39). A conspiracy to commit an offence is",https://anzlaw.thomsonreuters.com/Link/Document/FullText?findType=Y&serNum=1989188494&pubNum=3586&originatingDoc=I8a42f5e087b311e8aca5bab3c9b3f468&refType=TG&originationContext=document&transitionType=DocumentItem&ppcid=164a6d2a6e4d4a88944cd5c19da70add&contextData=(sc.Default)&comp=wlau,thomsonreuters,NA: thomsonreuters
2202,295,93;,"is the unlawful agreement(Ahern v The Queen (1988)165 CLR 87, 93; [1988]HCA 39). A conspiracy to commit an offence is an",https://jade.io/article/67441/section/140800,jade,NA: JADE
2204,295,"(1992)174 CLR 268,","the act of agreeing to commit the offence(R v Rogerson (1992)174 CLR 268, 279; [1992]HCA 25). Evidence of acts following the agreement may",https://anzlaw.thomsonreuters.com/Link/Document/FullText?findType=Y&serNum=1992357972&pubNum=3586&originatingDoc=I0601b52087ac11e8aca5bab3c9b3f468&refType=TG&originationContext=document&transitionType=DocumentItem&ppcid=e162ccace379477587c060d41bd7ff1d&contextData=(sc.Default)&comp=wlau,thomsonreuters,NA: thomsonreuters
2205,295,279;,"agreeing to commit the offence(R v Rogerson (1992)174 CLR 268, 279; [1992]HCA 25). Evidence of acts following the agreement may be",https://jade.io/article/67685/section/140499,jade,NA: JADE
2207,295,"(1995)133 ALR 379,","of the acts that constitutes the offence (R v Gudgeon (1995)133 ALR 379, 389; [1995]QCA 506). 7.2.3 Suggested Direction [Last reviewed: March 2026]",https://jade.io/article/165419,jade,NA: JADE
2208,295,389;,"that constitutes the offence (R v Gudgeon (1995)133 ALR 379, 389; [1995]QCA 506). 7.2.3 Suggested Direction [Last reviewed: March 2026] The",https://jade.io/article/165419/section/140637,jade,NA: JADE
2209,295,[1995]QCA 506).,"constitutes the offence (R v Gudgeon (1995)133 ALR 379, 389; [1995]QCA 506). 7.2.3 Suggested Direction [Last reviewed: March 2026] The prosecution must",https://www.queenslandjudgments.com.au/caselaw/qca/1995/506,queenslandjudgments,NA: QR
2214,298,[2021]QCA 15.,JA explained the operation of s 7(1)in R v Taylor [2021]QCA 15. His Honour said– [68] Section 7(1) provides: “When an offence,https://jvl.sclqld.org.au/caselaw/QCA/2021/15,sclqld,https://jade.io/article/785498
2215,299,[2020]HCA 20,"others, under ss 7(1)(b), (c)or(d): see Pickett v Western Australia [2020]HCA 20 and O’Dea v Western Australia [2022]HCA 24 at [77]. The",https://anzlaw.thomsonreuters.com/Document/I8669f472a2e611eab1cbf180a7ce9b34/View/FullText.html?transitionType=Default&contextData=(sc.Default)&VR=3.0&RS=cblt1.0,thomsonreuters,https://jade.io/article/736792
2216,299,[2022]HCA 24,v Western Australia [2020]HCA 20 and O’Dea v Western Australia [2022]HCA 24 at [77]. The extent of application of s 7(1)(a) A,https://anzlaw.thomsonreuters.com/Document/I78192fc0184511ed81c5f735b8cf580f/View/FullText.html?transitionType=Default&contextData=(sc.Default)&VR=3.0&RS=cblt1.0,thomsonreuters,https://jade.io/article/940630
2217,299,[77].,[2020]HCA 20 and O’Dea v Western Australia [2022]HCA 24 at [77]. The extent of application of s 7(1)(a) A majority of,https://jade.io/article/940630/section/141,jade,NA: JADE
2219,299,"[30],","High Court in O’Dea v Western Australia [2022]HCA 24 at [30], [67]-[69] and [80] held, in effect, that in order for",https://jade.io/article/940630/section/332,jade,NA: JADE
2220,299,[67]-[69],"Court in O’Dea v Western Australia [2022]HCA 24 at [30], [67]-[69] and [80] held, in effect, that in order for liability",https://jade.io/article/940630/section/8763,jade,NA: JADE
2221,299,[80],"O’Dea v Western Australia [2022]HCA 24 at [30], [67]-[69] and [80] held, in effect, that in order for liability to be",https://jade.io/article/940630/section/181,jade,NA: JADE
2222,299,[1977]Qd R 169,of Lucas J in R v Wyles; Ex parte Attorney-General [1977]Qd R 169 at [174] which provided for a wider application of s,https://anzlaw.thomsonreuters.com/Document/Ife0b6c6088c011e8aca5bab3c9b3f468/View/FullText.html?transitionType=Default&contextData=(sc.Default)&VR=3.0&RS=cblt1.0,thomsonreuters,NA: thomsonreuters
2223,299,[174],R v Wyles; Ex parte Attorney-General [1977]Qd R 169 at [174] which provided for a wider application of s 7(1)(a)and should,https://jade.io/citation/2412618/section/4572,jade,NA: JADE
2224,299,"[70],","a wider application of s 7(1)(a)and should be understood, at [70], to also be critical of similar observations of Macrossan CJ",https://jade.io/citation/2412618/section/140338,jade,NA: JADE
2225,299,[1990]2 Qd R 275,of Macrossan CJ in R v Webb; Ex parte Attorney-General [1990]2 Qd R 275 at [283]. To the extent that those decisions stand as,https://jade.io/citation/437038,jade,NA: JADE
2226,299,[283].,v Webb; Ex parte Attorney-General [1990]2 Qd R 275 at [283]. To the extent that those decisions stand as authority for,https://jade.io/citation/437038/section/8533,jade,NA: JADE
2227,299,[2001],"is unclear. See for example, R v Sherrington & Kuchler [2001] QCA 105, [11]-[17], R v Lowrie and Ross [2000]2 Qd",https://anzlaw.thomsonreuters.com/Document/If32f523088ab11e8aca5bab3c9b3f468/View/FullText.html?transitionType=Default&contextData=(sc.Default)&VR=3.0&RS=cblt1.0,thomsonreuters,https://jade.io/article/166959
2229,299,"[11]-[17],","for example, R v Sherrington & Kuchler [2001] QCA 105, [11]-[17], R v Lowrie and Ross [2000]2 Qd R 529, [35]",https://jade.io/article/166959/section/5176,jade,NA: JADE
2230,299,"[2000]2 Qd R 529,","Kuchler [2001] QCA 105, [11]-[17], R v Lowrie and Ross [2000]2 Qd R 529, [35] adopted on a subsequent appeal after re-trial in R",https://anzlaw.thomsonreuters.com/Document/I7e1a49b088aa11e8aca5bab3c9b3f468/View/FullText.html?transitionType=Default&contextData=(sc.Default)&VR=3.0&RS=cblt1.0,thomsonreuters,NA: thomsonreuters
2231,299,[35],"[11]-[17], R v Lowrie and Ross [2000]2 Qd R 529, [35] adopted on a subsequent appeal after re-trial in R v",https://jade.io/article/166358/section/140690,jade,NA: JADE
2232,299,"[2000]QCA 405,","subsequent appeal after re-trial in R v Lowrie & Ross [2000]QCA 405, [29] and R v Jeffrey [2003]2 Qd.R. 306, [311]-[312]. Queensland",https://jade.io/article/206991,jade,NA: JADE
2233,299,[29],"after re-trial in R v Lowrie & Ross [2000]QCA 405, [29] and R v Jeffrey [2003]2 Qd.R. 306, [311]-[312]. Queensland Supreme",https://jade.io/article/206991/section/140712,jade,NA: JADE
2234,299,"[2003]2 Qd.R. 306,","Lowrie & Ross [2000]QCA 405, [29] and R v Jeffrey [2003]2 Qd.R. 306, [311]-[312]. Queensland Supreme and District Courts Criminal Directions Benchbook (2026",https://jade.io/article/206679,jade,NA: JADE
2235,299,[311]-[312].,"[2000]QCA 405, [29] and R v Jeffrey [2003]2 Qd.R. 306, [311]-[312]. Queensland Supreme and District Courts Criminal Directions Benchbook (2026 Edition)",https://jade.io/article/206679/section/22542,jade,NA: JADE
2236,300,[1997]QCA 460;,person he is aiding or assisting’. See R v Jeffrey [1997]QCA 460; [2003]2 Qd R 306; Giorgianni vThe Queen (1985)156 CLR 473,http://archive.sclqld.org.au/qjudgment/1997/QCA97-460.pdf,sclqld,https://jade.io/article/206679
2237,300,[2003]2,is aiding or assisting’. See R v Jeffrey [1997]QCA 460; [2003]2 Qd R 306; Giorgianni vThe Queen (1985)156 CLR 473 at,https://anzlaw.thomsonreuters.com/Document/Icfabb4a088a811e8aca5bab3c9b3f468/View/FullText.html?transitionType=Default&contextData=(sc.Default)&VR=3.0&RS=cblt1.0,thomsonreuters,NA: thomsonreuters
2239,300,(1985)156 CLR 473,Jeffrey [1997]QCA 460; [2003]2 Qd R 306; Giorgianni vThe Queen (1985)156 CLR 473 at [482]; R v Brown (2007)171 A Crim R 345;,https://anzlaw.thomsonreuters.com/Document/Ifaa7da4087a811e8aca5bab3c9b3f468/View/FullText.html?transitionType=Default&contextData=(sc.Default)&VR=3.0&RS=cblt1.0,thomsonreuters,NA: thomsonreuters
2240,300,[482];,Qd R 306; Giorgianni vThe Queen (1985)156 CLR 473 at [482]; R v Brown (2007)171 A Crim R 345; [2007]QCA 161,https://jade.io/article/67192/section/61322,jade,NA: JADE
