link_id,page_no,link_text,surrounding_text,link_destination,link_domain,jade_link
3245,514,[60]-[63],"the context of this offence, and at [51], [54] and [60]-[63] for the importance of precisely identifying what it is that",https://jade.io/article/94036/section/5402,jade,NA: JADE
3246,514,"[2009]QCA 128,","material is an element of the offence–see R v Campbell [2009]QCA 128, [55]-[57], endorsing observations in R v Shew [1998]QCA 333, [18]",https://jade.io/article/94036,jade,NA: JADE
3247,514,"[55]-[57],","an element of the offence–see R v Campbell [2009]QCA 128, [55]-[57], endorsing observations in R v Shew [1998]QCA 333, [18] made",https://jade.io/article/94036/section/2517,jade,NA: JADE
3248,514,"[1998]QCA 333,","Campbell [2009]QCA 128, [55]-[57], endorsing observations in R v Shew [1998]QCA 333, [18] made in respect of earlier legislation. Proof may be",https://archive.sclqld.org.au/qjudgment/1998/QCA98-333.pdf,sclqld,https://jade.io/article/166166
3249,514,[18],"128, [55]-[57], endorsing observations in R v Shew [1998]QCA 333, [18] made in respect of earlier legislation. Proof may be achieved",https://jade.io/article/166166/section/1035,jade,NA: JADE
3250,514,"[2019]QCA 135,[55].","itself to the exclusion of contextual features–see R v SDI [2019]QCA 135,[55]. A piece of literature that describes a fictional person is",https://archive.sclqld.org.au/qjudgment/2019/QCA19-135.pdf,sclqld,https://jade.io/article/650421
3252,514,[46].,"capable of being child exploitation material–R v Campbell [2009]QCA 128, [46]. Queensland Supreme and District Courts Criminal Directions Benchbook (2026 Edition)",https://jade.io/article/94036/section/433,jade,NA: JADE
3254,515,[49],"The Court of Appeal in R v SDI [2019]QCA 135, [49] considered that in the particular circumstances of that case it",https://jade.io/article/650421/section/1625,jade,NA: JADE
3266,521,[2013],"s 216(4)(b), in R v Little(2013)231 A Crim R 145; [2013] QCA 223, [26] it was observed that the phrase takes",https://www.queenslandjudgments.com.au/caselaw/qca/2013/223,queenslandjudgments,NA: QR
3268,521,[26],"R v Little(2013)231 A Crim R 145; [2013] QCA 223, [26] it was observed that the phrase takes its ordinary English",https://jade.io/article/300535/section/140175,jade,NA: JADE
3269,521,"[2006]QCA 242,","utilisation’ was referred to with approval. In R v Libke [2006]QCA 242, [100] a direction that sexual exploitation means taking advantage of",https://www.queenslandjudgments.com.au/caselaw/qca/2006/242,queenslandjudgments,NA: QR
3270,521,[100],"referred to with approval. In R v Libke [2006]QCA 242, [100] a direction that sexual exploitation means taking advantage of the",https://jade.io/article/169359/section/1179,jade,NA: JADE
3273,525,Health and other Legislation Amendment Act 2016,definition of ‘carnal knowledge’ at section 216(5)as effected by the Health and other Legislation Amendment Act 2016 (Qld). See s 216(4)for defences available to a person charged,https://jade.io/article/496480,jade,NA: JADE
3277,530,[1996]1 Qd R 559.,"with’ is capable of wide application, see R v S [1996]1 Qd R 559. The suggested direction as to the meaning of the term",https://archive.sclqld.org.au/qjudgment/1995/QCA95-328.pdf,sclqld,Authorised Report
3283,531,"[1984] 2 Qd R 545,","of the Court of Criminal Appeal in R v Bryant [1984] 2 Qd R 545, are not essential to the meaning of ‘indecency’: see R",https://www.queenslandjudgments.com.au/case/id/506721,queenslandjudgments,NA: QR
3284,531,[2007]QCA 210.,"essential to the meaning of ‘indecency’: see R v Schneiders [2007]QCA 210. The first suggested directions concerning ‘indecency’ will often be sufficient,",http://archive.sclqld.org.au/qjudgment/2007/QCA07-210.pdf,sclqld,https://jade.io/article/14805
3285,531,(2011)209 A Crim R 379;,"‘indecency’ will often be sufficient, however in R v Jones (2011)209 A Crim R 379; [2011]QCA 19, [32] it was held that The quality of‘indecency’is",https://advance-lexis-com.ezproxy-az.sclqld.org.au/api/permalink/35421119-b0cc-43c7-bd2c-85a44bc240ee/?context=1201008&identityprofileid=98NNDT55483,sclqld,Authorised Report
3286,531,"[2011]QCA 19,","however in R v Jones (2011)209 A Crim R 379; [2011]QCA 19, [32] it was held that The quality of‘indecency’is pre-eminently a",https://www.queenslandjudgments.com.au/caselaw/qca/2011/19/pdf-view,queenslandjudgments,NA: QR
3288,531,"[1981]Qd R 209,","taken from the ruling in R v Lockwood; ex-parte Attorney-General [1981]Qd R 209, which was concerned with the meaning of the term for",https://www.queenslandjudgments.com.au/case/id/511983,queenslandjudgments,NA: QR
3290,531,630,"of deliberation. In R v T [1997]1 Qd R 623, 630 it was confirmed that for the purposes of the recklessness",https://jade.io/article/165603/section/140591,jade,NA: JADE
3294,531,[2018]QCA 125)suggests,"Qd R 540, esp at [13]-[14](followed in R v Addley [2018]QCA 125)suggests that in such a case the prosecution would have to",https://www.queenslandjudgments.com.au/caselaw/qca/2018/125,queenslandjudgments,NA: QR
3295,532,[2013],"216(4)(b), in R v Little (2013)231 A Crim R 145; [2013] QCA 223, [26] it was observed that the phrase takes",https://archive.sclqld.org.au/qjudgment/2013/QCA13-223.pdf,sclqld,https://jade.io/article/300535
3298,532,"[2006]QCA 242, complainant in a sexual","utilisation’ was referred to with approval. In R v Libke [2006]QCA 242, [100] a direction that sexual exploitation means taking advantage of the complainant in a",https://archive.sclqld.org.au/qjudgment/2006/QCA06-242.pdf,sclqld,https://jade.io/article/169359
3304,545,R v,some way contributed to the removal of the child: compare R v Johnson [1957] St R 594. The term ‘detain’ should be,https://www.queenslandjudgments.com.au/case/id/510813,queenslandjudgments,NA: QR
3306,545,"[2004]2 Qd R 672,","in confinement’ and ‘hold back, delay, stop’: (R v Awang [2004]2 Qd R 672, 677 [21](Williams JA)). Proscribed act A proscribed act is an",https://www.queenslandjudgments.com.au/case/id/502399,queenslandjudgments,NA: QR
3307,545,677,"back, delay, stop’: (R v Awang [2004]2 Qd R 672, 677 [21](Williams JA)). Proscribed act A proscribed act is an act",https://jade.io/article/168416/section/140771,jade,NA: JADE
3320,547,(2021)7 QR 140;,"of a trial, see the observations in R v Bartkowski (2021)7 QR 140; [2021]QCA 1, [23]-[26], [42], [44]-[47], [59] which considered an identical",https://www.queenslandjudgments.com.au/case/id/512983,queenslandjudgments,NA: QR
3321,547,"[2021]QCA 1,","see the observations in R v Bartkowski (2021)7 QR 140; [2021]QCA 1, [23]-[26], [42], [44]-[47], [59] which considered an identical definition of",https://www.queenslandjudgments.com.au/caselaw/qca/2021/1,queenslandjudgments,NA: QR
3322,547,"[23]-[26],","observations in R v Bartkowski (2021)7 QR 140; [2021]QCA 1, [23]-[26], [42], [44]-[47], [59] which considered an identical definition of the",https://jade.io/article/782603/section/4945,jade,NA: JADE
3323,547,"[42],","in R v Bartkowski (2021)7 QR 140; [2021]QCA 1, [23]-[26], [42], [44]-[47], [59] which considered an identical definition of the term",https://jade.io/article/782603/section/140755,jade,NA: JADE
3324,547,"[44]-[47],","R v Bartkowski (2021)7 QR 140; [2021]QCA 1, [23]-[26], [42], [44]-[47], [59] which considered an identical definition of the term found",https://jade.io/article/782603/section/528,jade,NA: JADE
3325,547,[59],"v Bartkowski (2021)7 QR 140; [2021]QCA 1, [23]-[26], [42], [44]-[47], [59] which considered an identical definition of the term found in",https://jade.io/article/782603/section/140578,jade,NA: JADE
3326,547,[2004]1 Qd R 162,Cullinane J in R v F; ex parte Attorney-General (Qld) [2004]1 Qd R 162 concerning the meaning of the word in the context of,https://www.queenslandjudgments.com.au/case/id/501169,queenslandjudgments,NA: QR
3327,548,(1990)170 CLR,"was explained by the High Court in George v Rockett (1990)170 CLR 104, 116. See s 218B(10)and(11)for defences available to a person",https://jade.io/article/67566,jade,NA: JADE
3329,548,116,"the High Court in George v Rockett (1990)170 CLR 104, 116. See s 218B(10)and(11)for defences available to a person charged with",https://jade.io/article/67566/section/140874,jade,NA: JADE
3342,557,[1996]1,term ‘deals with’ has been taken from R v S [1996]1 Qd R 559. The first sample directions concerning ‘indecency’ will,https://www.queenslandjudgments.com.au/case/id/500604,queenslandjudgments,NA: QR
3344,557,(2011)209 A Crim R 379;,"‘indecency’ will often be sufficient, however in R v Jones (2011)209 A Crim R 379; [2011]QCA 19, [32] it was held that: ‘The quality of“indecency”is",https://plus.lexis.com/apac/search/?pdmfid=1539278&crid=43fd4be1-b141-4e28-94df-e4a004681401&pdsearchterms=209%20A%20CRIM%20R%20379&pdtypeofsearch=searchboxclick&pdsearchtype=SearchBox&pdstartin=hlct:1:0&pdpsf=&pdqttype=and&pdquerytemplateid=&ecomp=c5cck&earg=pdsf&prid=ab083301-00fd-41ee-a8a5-42648b05a346,lexis,Authorised Report
3345,557,"[2011]QCA 19,","however in R v Jones (2011)209 A Crim R 379; [2011]QCA 19, [32] it was held that: ‘The quality of“indecency”is pre-eminently a",https://www.queenslandjudgments.com.au/caselaw/qca/2011/19,queenslandjudgments,NA: QR
3347,558,(2016)263 A Crim R,concerning ‘under care’ has been drawn from R v FAK (2016)263 A Crim R 322; [2016]QCA 306 esp at [71]-[78]. The sample direction concerning,https://plus.lexis.com/apac/search/?pdmfid=1539278&crid=2b8b07cd-9701-4fb4-96f5-56a21883533e&pdsearchterms=r%20v%20fak%20—%20(2016)%20263%20a%20crim%20r%20322;%20%5B2016%5D%20qca%20306;%20bc201609988&pdtypeofsearch=searchboxclick&pdsearchtype=SearchBox&pdstartin=hlct:1:0&pdpsf=&pdqttype=and&pdquerytemplateid=&ecomp=c5cck&earg=pdsf&prid=b237bd10-73d3-4638-8709-cecbd8ce4ccb,lexis,Authorised Report
3351,558,"(1997)91 A Crim R 590,[599].","sample direction concerning guardianship is drawn from R v G (1997)91 A Crim R 590,[599]. See ss 210(5)&(5A)for defences available to a person charged with",https://plus.lexis.com/apac/search/?pdmfid=1539278&crid=c0ea3d16-8e79-44f2-92a7-0db28d319b75&pdsearchterms=91%20a%20crim%20r%20590&pdtypeofsearch=searchboxclick&pdsearchtype=SearchBox&pdstartin=hlct:1:0&pdpsf=&pdqttype=and&pdquerytemplateid=&ecomp=c5cck&earg=pdsf&prid=40f14aeb-0df2-4a6b-84ac-6dbf99081639,lexis,Authorised Report
3366,563,"(1997)91 A Crim R 590,","sample direction concerning guardianship is drawn from R v G (1997)91 A Crim R 590, [599]. Pursuant to s 210(4B), a circumstance of aggravation under",https://anzlaw.thomsonreuters.com/Document/Ia3279cd0896311e8aca5bab3c9b3f468/View/FullText.html?originationContext=typeAhead&transitionType=Default&contextData=(sc.Default)&comp=wlau,thomsonreuters,NA: thomsonreuters
3367,563,[599].,"drawn from R v G (1997)91 A Crim R 590, [599]. Pursuant to s 210(4B), a circumstance of aggravation under s",https://jade.io/citation/2694939/section/20560,jade,NA: JADE
3380,567,(2011)209 A Crim R 379;,"be sufficient for this offence, however in R v Jones (2011)209 A Crim R 379; [2011]QCA 19, [32], a Sexual Assault case, it was held",https://plus.lexis.com/apac/search/?pdmfid=1539278&crid=33c7bd1f-be5d-4a04-9b18-6bd607925648&pdsearchterms=r%20v%20jones%20—%20(2011)%20209%20a%20crim%20r%20379;%20%5B2011%5D%20qca%20019;%20bc201100527&pdtypeofsearch=searchboxclick&pdsearchtype=SearchBox&pdstartin=hlct:1:0&pdpsf=&pdqttype=and&pdquerytemplateid=&ecomp=c5cck&earg=pdsf&prid=01af001a-7fe1-4086-ba75-59b9279eb7f5,lexis,Authorised Report
3383,568,"[2020]QCA 192,","sample direction may be appropriate. Note, however, R v McGrady [2020]QCA 192, [46]-[47], where Fraser JA observed that whether or not touching",https://www.queenslandjudgments.com.au/caselaw/qca/2020/192,queenslandjudgments,NA: QR
3384,568,"[46]-[47],","may be appropriate. Note, however, R v McGrady [2020]QCA 192, [46]-[47], where Fraser JA observed that whether or not touching was",https://jade.io/article/764406/section/3061,jade,NA: JADE
3399,572,"[1997]1 Qd R 623,","the usual allegation is of deliberation. In R v T [1997]1 Qd R 623, [630] it was confirmed that for the purposes of the",https://archive.sclqld.org.au/qjudgment/1996/QCA96-258.pdf,sclqld,https://jade.io/article/165603
3400,572,[630],"of deliberation. In R v T [1997]1 Qd R 623, [630] it was confirmed that for the purposes of the recklessness",https://jade.io/article/165603/section/61334,jade,NA: JADE
3401,573,(2016)263 A Crim R,"concerning ‘under care’ has been drawn from R v FAK (2016)263 A Crim R 322; [2016]QCA 306, [71]-[78]. The sample direction concerning guardianship is",https://jade.io/article/505840,jade,NA: JADE
3465,588,Sexual Offences (Protection of Children) Amendment Act,"as the form in which it was inserted by the Sexual Offences (Protection of Children) Amendment Act 2003(Qld). By amendments in 2020, the application of the offence",https://jade.io/article/423226,jade,NA: JADE
3470,589,[2012]QCA,"any of the three occasions necessary. In R v Bradfield [2012]QCA 337, the conviction was quashed because the directions did not",http://archive.sclqld.org.au/qjudgment/2012/QCA12-337.pdf,sclqld,https://jade.io/article/287225
3472,589,(2008)235 CLR 334;,decision of the High Court in HML v The Queen (2008)235 CLR 334; [2008]HCA 16 and the directions concerning evidence of other sexual(or,https://anzlaw.thomsonreuters.com/Link/Document/FullText?findType=Y&serNum=2015865511&pubNum=3586&originatingDoc=I13d91fe087bf11e8aca5bab3c9b3f468&refType=TG&originationContext=document&transitionType=DocumentItem&ppcid=d2d77604a6da430ea4dd84dd56d7780d&contextData=(sc.Default)&comp=wlau,thomsonreuters,NA: thomsonreuters
3474,589,Chapter 5.5 Evidence of Other Sexual or Discreditable Conduct of the Defendant.,evidence of other sexual(or violent)acts or other discreditable conduct at Chapter 5.5 Evidence of Other Sexual or Discreditable Conduct of the Defendant. Queensland Supreme and District Courts Criminal Directions Benchbook (2026 Edition),rosetta://link/ch_other_sexual_discreditable_conduct/direction,link,Not Required
3475,590,Chapter 4.21 Separate Consideration of Charges,Reliance on Offences Charged Additional to s 229B Refer to Chapter 4.21 Separate Consideration of Charges for suggested directions where there are offences charged additionally to,rosetta://link/ch_separate_consideration_charges/direction,link,Not Required
3476,590,"(2022)10 QR 477,","Respect of the Unlawful Sexual Acts? In R v BDF (2022)10 QR 477, the Court of Appeal considered whether an unlawful sexual relationship",https://www.queenslandjudgments.com.au/case/id/513082,queenslandjudgments,NA: QR
3482,592,Criminal Code (Child,knowingly possess a child abuse object was inserted by the Criminal Code (Child Sexual Offences Reform) and Other Legislation Amendment Act 2020(Qld) and,https://jade.io/article/766598,jade,NA: JADE
3498,597,[51],"8.1– Intention. In R v Addley [2019]2 Qd R 46, [51] and R v Webb [2018]QCA 102, the Court of Appeal",https://jade.io/article/592896/section/140879,jade,NA: JADE
3499,597,"[2018]QCA 102,","Addley [2019]2 Qd R 46, [51] and R v Webb [2018]QCA 102, the Court of Appeal considered that s 218A(1)creates two offences:",https://www.queenslandjudgments.com.au/caselaw/qca/2018/102,queenslandjudgments,NA: QR
3516,602,"Adoption Act 2009,","Section 222 was amended to refer to orders under the Adoption Act 2009, Surrogacy Act 2010 and Meriba Omasker Kaziw Kazipa (Torres Strait",https://jade.io/article/422487,jade,NA: JADE
3521,602,Criminal Law (Child,"are entitled to be married. Section 222(8)was amended by the Criminal Law (Child Exploitation and Dangerous Drugs) Amendment Act 2013, assent 29 April",https://jade.io/article/344632,jade,NA: JADE
3524,602,Marriage Act 1961 (Cth).,"be lawfully married, see ss 11 - 23B of the Marriage Act 1961 (Cth). See also R v Rose [2010]1 Qd R 87 for",https://jade.io/article/218772,jade,NA: JADE
3526,602,[2010]1 Qd R 87 for,the Marriage Act 1961 (Cth). See also R v Rose [2010]1 Qd R 87 for the meaning of the phrase ‘entitled to be lawfully married’.,https://www.queenslandjudgments.com.au/case/id/511122,queenslandjudgments,NA: QR
3527,605,32DA,"if necessary, to the definition of “de facto partner”at s 32DA of the Acts Interpre- tation Act 1954]. In this trial",https://jade.io/article/529695/section/5503,jade,NA: JADE
3659,636,Criminal Code (Non-consensual Sharing of Intimate Images) Amendment,[Last reviewed: January 2025] Section 229A was inserted by the Criminal Code (Non-consensual Sharing of Intimate Images) Amendment Act 2019(Qld) and commenced on 21 February 2019. Section 229A,https://jade.io/article/635541,jade,NA: JADE
3701,642,[2018]3 Qd R 50.,the conduct of the trial–see for example R v PAZ [2018]3 Qd R 50. Other authorities dealing with the operation of s 11 and,https://www.queenslandjudgments.com.au/citation/2018-3-Qd-R-50,queenslandjudgments,NA: QR
3703,642,"[2017]QSC 108,","albeit in respect of different legislation, include R v HXY [2017]QSC 108, R v HBT [2018]QCA 227 and R v JAA [2019]3",https://archive.sclqld.org.au/qjudgment/2017/QSC17-108.pdf,sclqld,https://jade.io/article/532687
3704,642,[2018]QCA 227,"legislation, include R v HXY [2017]QSC 108, R v HBT [2018]QCA 227 and R v JAA [2019]3 Qd R 242; [2018]QCA 365.",https://archive.sclqld.org.au/qjudgment/2018/QCA18-227.pdf,sclqld,https://jade.io/article/612044
3705,642,[2019]3 Qd R 242;,"108, R v HBT [2018]QCA 227 and R v JAA [2019]3 Qd R 242; [2018]QCA 365. Notably, s 11 requires a comparison between the",https://www.queenslandjudgments.com.au/citation/2019-3-Qd-R-242,queenslandjudgments,NA: QR
3706,642,[2018]QCA,"[2018]QCA 227 and R v JAA [2019]3 Qd R 242; [2018]QCA 365. Notably, s 11 requires a comparison between the state",https://archive.sclqld.org.au/qjudgment/2018/QCA18-365.pdf,sclqld,https://jade.io/article/634357
3708,642,Chapters 11.11,at s 216 of the Criminal Code—for suggested directions see Chapters 11.11 or 11.12 depending on the date of the alleged offending.,rosetta://link/ch_abuse_impairment_penile_intercourse/direction,link,Not Required
3709,642,11.12,of the Criminal Code—for suggested directions see Chapters 11.11 or 11.12 depending on the date of the alleged offending. Unlike many,rosetta://link/ch_carnal_knowledge_impairment_pre_2023/direction,link,Not Required
3710,642,[1947]VLR 389.,the anus of the victim with his penis—R v Wardle [1947]VLR 389. The ordinary meaning of the term “sodomy”is sexual intercourse per,https://jade.io/article/554716,jade,NA: JADE
3711,642,735,the anal orifice - Russell on Crime 12th Ed at 735. The word “sodomy”in s 6 was replaced by the term,https://jade.io/article/554716/section/3295,jade,NA: JADE
3712,643,[2013],"s 216(4)(b), in R v Little(2013)231 A Crim R 145; [2013] QCA 233, [26] it was observed that the phrase takes",https://www.queenslandjudgments.com.au/caselaw/qca/2013/233/pdf-view,queenslandjudgments,NA: QR
3714,643,[26],"R v Little(2013)231 A Crim R 145; [2013] QCA 233, [26] it was observed that the phrase takes its ordinary English",https://jade.io/article/300700/section/140175,jade,NA: JADE
3715,643,"[2006]QCA 242,","“selfish utilisation”was referred to with approval. In R v Libke [2006]QCA 242, [100] a direction that sexual exploitation means taking advantage of",https://www.queenslandjudgments.com.au/caselaw/qca/2006/242/pdf-view,queenslandjudgments,NA: QR
3717,643,[2019]2 Qd R 46;,"the balance of probabilities. The discussion in R v Addley [2019]2 Qd R 46; [2018]QCA 125, although dealing with a different offence provision, illustrates",https://www.queenslandjudgments.com.au/citation/2019-2-Qd-R-46,queenslandjudgments,NA: QR
3718,643,"[2018]QCA 125,","The discussion in R v Addley [2019]2 Qd R 46; [2018]QCA 125, although dealing with a different offence provision, illustrates the point.",https://archive.sclqld.org.au/qjudgment/2018/QCA18-125.pdf,sclqld,https://jade.io/article/592896
3751,665,"(1954)Tas SR 26,","may be sufficient to amount to a taking(R v Mejac (1954)Tas SR 26, 28-29). It is immaterial that the child was taken with",https://jade.io/citation/3309342,jade,NA: JADE
3752,665,28-29).,"to amount to a taking(R v Mejac (1954)Tas SR 26, 28-29). It is immaterial that the child was taken with the",https://jade.io/citation/3309342/section/2220,jade,NA: JADE
3753,666,[1860]Bell 276.,may be temporary(R v Baille(1859)8 Cox 238; R v Timmins [1860]Bell 276. It is no defence that the defendant believed the child,https://jade.io/citation/23022304,jade,NA: JADE
3755,666,"597,","than ‘possession’. In R v Johnson [1957]St R Qd 594, 597, it was said that‘custody’ means ‘safe-keeping; protection’ such that ‘custody",https://jade.io/citation/11100290/section/1111,jade,NA: JADE
3756,666,"[1979]Qd R 278,","immediate proximity to and control of the child(R v Beble [1979]Qd R 278, 281-282). 12.1.3 Suggested direction [Last reviewed: October 2025] To prove",https://www.queenslandjudgments.com.au/citation/1979-Qd-R-278,queenslandjudgments,NA: QR
3757,666,281-282).,"and control of the child(R v Beble [1979]Qd R 278, 281-282). 12.1.3 Suggested direction [Last reviewed: October 2025] To prove the",https://jade.io/citation/2697869/section/4613,jade,NA: JADE
3760,669,(1981)3 A Crim R 294).,"Defendant and the departure of the child: (R v Stanton (1981)3 A Crim R 294). In R v Johnson [1957]St R Qd 594, [595]; Philp",https://anzlaw.thomsonreuters.com/Document/I74b5c530896211e8aca5bab3c9b3f468/View/FullText.html?transitionType=Default&contextData=(sc.Default)&VR=3.0&RS=cblt1.0,thomsonreuters,NA: thomsonreuters
3762,669,[595];,"R 294). In R v Johnson [1957]St R Qd 594, [595]; Philp J held that supplying taxi and railway tickets to",https://jade.io/citation/11100290/section/31955,jade,NA: JADE
3765,669,[2008]SASC 76(in,"of many older authorities, White J in Moore v Police [2008]SASC 76(in a case concerning the similar offence of child abduction under",https://jade.io/article/60831,jade,NA: JADE
3766,669,80,case concerning the similar offence of child abduction under s 80 of the Criminal Law Consolidation Act 1935(SA))stated at[38]that: ‘the prosecution,https://jade.io/article/511278/section/1199,jade,NA: JADE
3767,669,Criminal Law Consolidation,similar offence of child abduction under s 80 of the Criminal Law Consolidation Act 1935(SA))stated at[38]that: ‘the prosecution must prove that the accused,https://jade.io/article/511278,jade,NA: JADE
3770,669,[2004]QCA 152;,"parent or guardian and the child.’ In R v Awang [2004]QCA 152; [2004]2 Qd R 672, a case concerning s 355 of",https://www.queenslandjudgments.com.au/caselaw/qca/2004/152,queenslandjudgments,NA: QR
3773,670,[1995]QCA 389).,the defence on the balance of probabilities: (R v Seery [1995]QCA 389). It is suggested that the authorities on the interpretation of,https://www.queenslandjudgments.com.au/caselaw/qca/1995/389,queenslandjudgments,NA: QR
3774,670,[2009]QDC 61(McGill,applicable to the interpretation of s 363(2): (R v Campbell [2009]QDC 61(McGill DCJ)). 12.2.3 Suggested Direction [Last reviewed: April 2025] A. Offence,http://archive.sclqld.org.au/qjudgment/2009/QDC09-061.pdf,sclqld,
3777,672,[25](Williams,"ordinary and natural meaning(R v Awang [2004]2 Qd R 672, [25](Williams JA); see also R v East [2008]QCA 325, [24]-[25]). ‘Deprive’",https://jade.io/article/168416/section/140706,jade,NA: JADE
3778,672,"[2008]QCA 325,","Qd R 672, [25](Williams JA); see also R v East [2008]QCA 325, [24]-[25]). ‘Deprive’ includes the denial of enjoyment of something. Deprivation",https://archive.sclqld.org.au/qjudgment/2008/QCA08-325.pdf,sclqld,https://jade.io/article/84747
3779,672,[24]-[25]).,"672, [25](Williams JA); see also R v East [2008]QCA 325, [24]-[25]). ‘Deprive’ includes the denial of enjoyment of something. Deprivation includes",https://jade.io/article/84747/section/3031,jade,NA: JADE
3803,679,"[2016]1 Qd R 562,","act in isolation would not have that effect(R v Conde [2016]1 Qd R 562, 574-575 [43]-[46]). Section 359C lists matters that are immaterial for",https://www.queenslandjudgments.com.au/citation/2016-1-Qd-R-562,queenslandjudgments,NA: QR
3804,679,574-575,"not have that effect(R v Conde [2016]1 Qd R 562, 574-575 [43]-[46]). Section 359C lists matters that are immaterial for an",https://jade.io/article/390206/section/8430,jade,NA: JADE
3807,679,"578,","as alleged. In R v Conde [2016]1 Qd R 562, 578, P Lyons J(McMurdo P and Morrison JA agreeing) held that",https://jade.io/article/390206/section/139927,jade,NA: JADE
3808,679,[1999]1 Qd R 314).,"about the same two acts. (See also R v Hubbuck [1999]1 Qd R 314). In R v Glover (2022)10 QR 825, 835 [35] it",https://www.queenslandjudgments.com.au/citation/1999-1-Qd-R-314,queenslandjudgments,NA: QR
3809,679,"(2022)10 QR 825,","v Hubbuck [1999]1 Qd R 314). In R v Glover (2022)10 QR 825, 835 [35] it was held to be a misdirection where",https://www.queenslandjudgments.com.au/citation/2022-10-QR-825,queenslandjudgments,NA: QR
3810,679,835,"Qd R 314). In R v Glover (2022)10 QR 825, 835 [35] it was held to be a misdirection where the",https://jade.io/article/912446/section/140690,jade,NA: JADE
3839,689,[1992]2 Qd R 634.,"safe, or under the offender’s control: see R v McDonald [1992]2 Qd R 634. Conversion is not defined in the Criminal Code and is",https://anzlaw.thomsonreuters.com/Document/I20ed04f088c111e8aca5bab3c9b3f468/View/FullText.html?transitionType=Default&contextData=(sc.Default)&VR=3.0&RS=cblt1.0,thomsonreuters,NA: thomsonreuters
3841,689,228).,"its common law meaning(see R v Hally [1962]Qd R 214, 228). It entails dealing with property in a way inconsistent with",https://jade.io/citation/2421318/section/140897,jade,NA: JADE
