link_id,page_no,link_text,surrounding_text,link_destination,link_domain
3964,725,[1984]2 Qd R 75)A,definition of ‘possession’ in s 1(see also R v Solway [1984]2 Qd R 75)A person in lawful possession of a vehicle can give consent,https://www.queenslandjudgments.com.au/case/id/506152,queenslandjudgments
3965,725,[1979]Qd R 527;,"those conditions, it may constitute an offence(see R v Judkins [1979]Qd R 527; Hollingsworth v Bean [1970]VR 819; R v Wibberley [1966]2 QB",https://www.queenslandjudgments.com.au/case/id/508000,queenslandjudgments
3987,731,[2003]QCA 356;,"which was in fact a dangerous drug: R v Tabe [2003]QCA 356; (2003)139 A Crim R 417, [8]; upheld by the majority",https://www.queenslandjudgments.com.au/caselaw/qca/2003/356,queenslandjudgments
3992,731,[1994]2 Qd R 619.,which is in fact a dangerous drug: R v Clare [1994]2 Qd R 619. A person charged as an accessory will also be guilty,https://www.queenslandjudgments.com.au/case/id/501625,queenslandjudgments
3998,731,"[1997]1 Qd R 199,","dangerous drug(see s 129(1)(d) Drugs Misuse Act; R v Myles [1997]1 Qd R 199, 200, 210). Meaning of ‘concerned in the management or control",https://www.queenslandjudgments.com.au/case/id/511449,queenslandjudgments
4001,731,"[1997]2 Qd R 223,","of a place must be shown (see R v Smythe [1997]2 Qd R 223, 226) 14.1.3 Suggested Direction [Last reviewed: December 2024] It is",https://www.queenslandjudgments.com.au/case/id/504270,queenslandjudgments
4023,734,"[1988]2 Qd R 442,","drugs from source to ultimate user’ (see R v Elhusseini [1988]2 Qd R 442, [450]). To establish trafficking it is necessary to show a",https://www.queenslandjudgments.com.au/case/id/504316,queenslandjudgments
4052,740,"[1993]1 Qd R 271,","‘agreement or understanding’ and ‘true testimony’ In R v Danahay [1993]1 Qd R 271, [283] it was held an agreement or understanding that a",https://www.queenslandjudgments.com.au/case/id/509432,queenslandjudgments
4053,740,[1993]1 Qd R 271,been withheld. It was also held in R v Danahay [1993]1 Qd R 271 that an offence against s 127(1)could be made out without,https://www.queenslandjudgments.com.au/case/id/509432,queenslandjudgments
4060,740,"[1997]2 Qd R 481,","the later case of R v Gatti ex parte Attorney-General [1997]2 Qd R 481, the majority(Lee J dissenting)held that s 127(1)(a)did not require the",https://www.queenslandjudgments.com.au/case/id/505695,queenslandjudgments
4064,740,"[1993]1 Qd R 271,","person ‘to be called as a witness’ (R v Danahay [1993]1 Qd R 271, [279]). Meaning of ‘judicial proceeding’ ‘Judicial proceeding’ includes any proceeding",https://www.queenslandjudgments.com.au/case/id/509432,queenslandjudgments
4074,742,"[2005]1 Qd R 159,","a proceeding on foot at the time (R v Ensbey [2005]1 Qd R 159, [15], [16] (Davies JA), [48] (Jerrard JA)). Meaning of ‘damage’",https://www.queenslandjudgments.com.au/case/id/504349,queenslandjudgments
4080,742,"[1983]1 Qd R 240,","s 1 of the Criminal Code. In R v Zischke [1983]1 Qd R 240, a case concerning s 469 of the Criminal Code, it",https://www.queenslandjudgments.com.au/case/id/504782,queenslandjudgments
4105,750,[1964]Qd R,"require actual movement by the defendant. See R v Hildebrandt [1964]Qd R 43, where it was held that where the accused sat",https://www.queenslandjudgments.com.au/case/id/501853,queenslandjudgments
4106,750,"43,","movement by the defendant. See R v Hildebrandt [1964]Qd R 43, where it was held that where the accused sat in",https://www.queenslandjudgments.com.au/case/id/501853,queenslandjudgments
4109,750,[2000]2 Qd R 174;,armed in public: per McPherson J in R v Bennett [2000]2 Qd R 174; [1998]QCA 393. A useful concept from the Macquarie Directory is,https://www.queenslandjudgments.com.au/case/id/510878,queenslandjudgments
4112,751,[2000]2 Qd R 174;,"application depending on the circumstances of the case(R v Bennett [2000]2 Qd R 174; [1998]QCA 393, [25] (McPherson J)). It means there was no",https://www.queenslandjudgments.com.au/case/id/510878,queenslandjudgments
4118,754,[1998]2 Qd R 56).,than ‘public officer’ defined in s 1 (R v McCann [1998]2 Qd R 56). Meaning of ‘corruptly’ Corruption is not to be equated with,https://www.queenslandjudgments.com.au/case/id/503902,queenslandjudgments
4140,757,[2010]2 Qd R 70).,s 119 of the Criminal Code and R v Deemal [2010]2 Qd R 70). 15.8.3 Suggested Direction [Last reviewed: March 2025] The prosecution must,https://www.queenslandjudgments.com.au/case/id/502789,queenslandjudgments
4142,759,"[2020]QCA 6,","of ‘judicial officer’. In the case of R v Enright [2020]QCA 6, Boddice J stated that the jury should be directed that",https://www.queenslandjudgments.com.au/caselaw/qca/2020/6,queenslandjudgments
4145,760,[2020]QCA 6.,based in part on the decision in R v Enright [2020]QCA 6. Section 119B was considered by the High Court in Fingleton,https://www.queenslandjudgments.com.au/caselaw/qca/2020/6,queenslandjudgments
4162,767,"[2011]1 Qd R 270,","any tendency to influence falls to the defendant(R v Nuttall [2011]1 Qd R 270, 286 [31]). Meaning of ‘agent’ The definition of ‘agent’ encompasses",https://www.queenslandjudgments.com.au/case/id/501055,queenslandjudgments
4166,768,[2011]1 Qd R 270,of Justice by the trial judge in R v Nuttall [2011]1 Qd R 270 and referred to without criticism on appeal at 287 [36].,https://www.queenslandjudgments.com.au/case/id/501055,queenslandjudgments
4170,773,"[2001]2 Qd R 35,","for the purpose of extracting reproductive material. In Re Gray [2001]2 Qd R 35, Chesterman J observed that: ‘on an indictment prosecuting [a s",https://www.queenslandjudgments.com.au/case/id/504123,queenslandjudgments
4171,774,"[2004]2 Qd R 595,","16 Other Offences However, in Re Denham [2004]2 Qd R 595, 597 Atkinson J observed that it is strongly arguable that",https://www.queenslandjudgments.com.au/case/id/511033,queenslandjudgments
4173,774,"[2019]1 Qd R 403,","and others like it, were later considered in Re Cresswell [2019]1 Qd R 403, where Brown J held that s 236 ‘does not suggest",https://www.queenslandjudgments.com.au/case/id/512733,queenslandjudgments
4178,776,[1995]1 Qd R,"engaging in prostitution was not itself unlawful(see Kelsey v Hill [1995]1 Qd R 182). However, it was unlawful to procure another person to",https://www.queenslandjudgments.com.au/case/id/512124,queenslandjudgments
4179,776,182).,"was not itself unlawful(see Kelsey v Hill [1995]1 Qd R 182). However, it was unlawful to procure another person to engage",https://www.queenslandjudgments.com.au/case/id/512124,queenslandjudgments
4195,779,"[2016]QCA 82,","pre-requisite of assigning criminal responsibility. Thus, in R v LAH [2016]QCA 82, a failure to direct the jury in terms of s",https://www.queenslandjudgments.com.au/caselaw/qca/2016/82,queenslandjudgments
4196,779,[1996]1 Qd R 183.,"the close of the prosecution case, see R v CDR [1996]1 Qd R 183. Queensland Supreme and District Courts Criminal Directions Benchbook (2026 Edition)",https://www.queenslandjudgments.com.au/case/id/507709,queenslandjudgments
4197,780,[1997]QCA 486.,as was emphasised by Pincus JA in R v B [1997]QCA 486. Evidence that a defendant was close to age 14 cannot,https://www.queenslandjudgments.com.au/caselaw/qca/1997/486,queenslandjudgments
4198,780,"[1999]2 Qd R 157,","of the offence (R v F; Ex parte Attorney-General (Qld) [1999]2 Qd R 157, 162). Any relevant evidence necessary to prove capacity can be",https://www.queenslandjudgments.com.au/case/id/510527,queenslandjudgments
4201,780,"[1999]2 Qd R 157,","App R 362; R v F; Ex parte Attorney-General (Qld) [1999]2 Qd R 157, 163-165) In R v F; Ex parte Attorney-General (Qld) [1999]2",https://www.queenslandjudgments.com.au/case/id/510527,queenslandjudgments
4203,780,"[1999]2 Qd R 157,","157, 163-165) In R v F; Ex parte Attorney-General (Qld) [1999]2 Qd R 157, cited with approval in BDO v The Queen (2023)277 CLR",https://www.queenslandjudgments.com.au/case/id/510527,queenslandjudgments
4210,780,[2021]QCA 220,"R v M (1977)16 SASR 589. In R v BDO [2021]QCA 220 where the trial judge redirected, in response to a jury",https://www.queenslandjudgments.com.au/caselaw/qca/2021/220,queenslandjudgments
4219,783,"[1949]St R Qd 126,","liquor or by any other means’. In R v Smith [1949]St R Qd 126, Macrossan CJ held at 130 that: ‘The first paragraph of",https://www.queenslandjudgments.com.au/case/id/504540,queenslandjudgments
4221,783,[1960]Qd,"the defendant, on the balance of probabilities(see R v Foy [1960]Qd R 225, 240). In circumstances where unintentional intoxication did not",https://www.queenslandjudgments.com.au/case/id/507257,queenslandjudgments
4222,783,"R 225,","defendant, on the balance of probabilities(see R v Foy [1960]Qd R 225, 240). In circumstances where unintentional intoxication did not deprive the",https://www.queenslandjudgments.com.au/case/id/507257,queenslandjudgments
4225,786,"[1981]Qd R 136,","extent intentionally become intoxicated or stupefied(see also R v Kusu [1981]Qd R 136, 141-142). Intentional intoxication may only relieve a defendant of criminal",https://www.queenslandjudgments.com.au/case/id/505506,queenslandjudgments
4227,786,"[1947]St R Qd 51,","defendant formed the requisite intent (see Dearnley v The King [1947]St R Qd 51, 61-64). In such cases, the jury should be directed that",https://www.queenslandjudgments.com.au/case/id/512260,queenslandjudgments
4253,789,"[1997]1 Qd R 333,","limb deals’. In R v Taiters; Ex parte Attoney-General (Qld) [1997]1 Qd R 333, 335, the Court of Appeal said that: ‘… it should",https://www.queenslandjudgments.com.au/case/id/508542,queenslandjudgments
4257,790,"[2022]QCA 77,","identify precisely the ‘act’ in question. In R v Beauchamp [2022]QCA 77, for example, the trial judge did not adequately distinguish for",https://www.queenslandjudgments.com.au/caselaw/qca/2022/77,queenslandjudgments
4270,790,"[1970]Qd R 292,","55, [5]; see also Breene v Boyd; Ex parte Boyd [1970]Qd R 292, 297). As to the circumstances in which a direction is",https://www.queenslandjudgments.com.au/case/id/508133,queenslandjudgments
4309,792,"[2001]2 Qd R 678,","of not guilty on the ground of insanity(R v Maloney [2001]2 Qd R 678, 683-684). If the jury is to be told, a short",https://www.queenslandjudgments.com.au/case/id/503296,queenslandjudgments
4337,794,"[2016]QCA 287,","was confirmed in LAI v Director of Public Prosecutions (Qld) [2016]QCA 287, where McMurdo P stated that the correct approach was that",https://www.queenslandjudgments.com.au/caselaw/qca/2016/287,queenslandjudgments
4340,794,"[1984]1 Qd R 74,","in question(R v Holmes [1953]1 WLR 686; R v Barry [1984]1 Qd R 74, 89). The court may act on other than expert evidence",https://www.queenslandjudgments.com.au/case/id/510430,queenslandjudgments
4347,794,"[1966]Qd R 301,","testimony so as to throw doubt on it(R v Dick [1966]Qd R 301, 305-306; Taylor v The Queen (1978)45 FLR 343. Expert medical",https://www.queenslandjudgments.com.au/case/id/508823,queenslandjudgments
4357,797,[2018]2,"the burden of disproving s 22(2)beyond reasonable doubt(R v Perrin [2018]2 Qd R 174, 187). The offences created by ss 488(forgery/uttering)or",https://www.queenslandjudgments.com.au/case/id/512671,queenslandjudgments
4358,797,"Qd R 174,","burden of disproving s 22(2)beyond reasonable doubt(R v Perrin [2018]2 Qd R 174, 187). The offences created by ss 488(forgery/uttering)or 408C(fraud)of the Code",https://www.queenslandjudgments.com.au/case/id/512671,queenslandjudgments
4360,797,[2018]2 Qd R 174;,"standards of ordinary, decent people—an objective test(see R v Perrin [2018]2 Qd R 174; see also Peters v The Queen (1998)192 CLR 493; [1998]HCA",https://www.queenslandjudgments.com.au/case/id/512671,queenslandjudgments
4364,797,"[1962]QWN 13,","are doing in relation to that property(see R v Pollard [1962]QWN 13, 29; R v Waine [2006]1 Qd R 458, 462-463 [27]).",https://www.queenslandjudgments.com.au/case/id/504876,queenslandjudgments
4366,797,"[2006]1 Qd R 458,","property(see R v Pollard [1962]QWN 13, 29; R v Waine [2006]1 Qd R 458, 462-463 [27]). An honest claim of right may stem from",https://www.queenslandjudgments.com.au/case/id/503812,queenslandjudgments
4369,797,"[1988]1 Qd R 289,","in a right the law does not recognise(R v Williams [1988]1 Qd R 289, 295). In R v Mill [2007]QCA 150, the Court noted",https://www.queenslandjudgments.com.au/case/id/508804,queenslandjudgments
4374,799,"[1997]1 Qd R 333,","on the prosecution (R v Taiters; Ex parte Attorney-General (Qld) [1997]1 Qd R 333, 336). In R v Trieu [2008]QCA 28, de Jersey CJ",https://www.queenslandjudgments.com.au/case/id/508542,queenslandjudgments
4378,799,[2010]QCA 6,no direction was called for. See also R v Coomer [2010]QCA 6 where a direction on accident was not required. The suggested,https://www.queenslandjudgments.com.au/caselaw/qca/2010/6,queenslandjudgments
4383,800,"[1997]1 Qd R 333,","17 Defences In R v Taiters; Ex parte Attorney-General (Qld) [1997]1 Qd R 333, the Court of Appeal explained that the reference to ‘act’",https://www.queenslandjudgments.com.au/case/id/508542,queenslandjudgments
4384,800,[1999]QCA 101;,bone fractured by a blow. See also R v Camm [1999]QCA 101; R v Francisco [1999]QCA 212; R v Grimley [2000]QCA 64;,https://www.queenslandjudgments.com.au/caselaw/qca/1999/101,queenslandjudgments
4385,800,[1999]QCA 212;,See also R v Camm [1999]QCA 101; R v Francisco [1999]QCA 212; R v Grimley [2000]QCA 64; R v Coomer [2010]QCA 6.,https://www.queenslandjudgments.com.au/caselaw/qca/1999/212,queenslandjudgments
4386,800,[2000]QCA 64;,[1999]QCA 101; R v Francisco [1999]QCA 212; R v Grimley [2000]QCA 64; R v Coomer [2010]QCA 6. In R v Condon [2010]QCA,https://www.queenslandjudgments.com.au/caselaw/qca/2000/64,queenslandjudgments
4387,800,[2010]QCA 6.,"[1999]QCA 212; R v Grimley [2000]QCA 64; R v Coomer [2010]QCA 6. In R v Condon [2010]QCA 117, the Court of Appeal",https://www.queenslandjudgments.com.au/caselaw/qca/2010/6,queenslandjudgments
4405,800,[1999]QCA 109,12 and R v Fitzgerald (1999)106 A Crim R 215; [1999]QCA 109 that ‘accident’ is not relevant to an offence under s,https://www.queenslandjudgments.com.au/caselaw/qca/1999/109,queenslandjudgments
4414,801,[1962]Qd R 398,"par (b)’. Section 23(1A) Section 23(1A)effectively reinstates R v Martyr [1962]Qd R 398 as regards cases falling within its scope. In Martyr, the",https://www.queenslandjudgments.com.au/case/id/500054,queenslandjudgments
4433,805,"[2005]1 Qd R 308,","119; (1998)100 A Crim R 430, 434; R v Mrzljak [2005]1 Qd R 308, 321, 326; R v Wilson [2009]1 Qd R 476, 482",https://www.queenslandjudgments.com.au/case/id/502988,queenslandjudgments
4436,805,"[2009]1 Qd R 476,","Mrzljak [2005]1 Qd R 308, 321, 326; R v Wilson [2009]1 Qd R 476, 482 [20]; see also extensive discussion of the authorities in",https://www.queenslandjudgments.com.au/case/id/502013,queenslandjudgments
4440,805,"[2005]1 Qd R 308,","in considering whether a belief was reasonably held(R v Mrzljak [2005]1 Qd R 308, 321, 329-330). Queensland Supreme and District Courts Criminal Directions Benchbook",https://www.queenslandjudgments.com.au/case/id/502988,queenslandjudgments
4455,808,[2019]2 Qd R,"sexual offences were considered in detail in R v Makary [2019]2 Qd R 528(see also R v FAV [2019]QCA 299, [5]-[6](Fraser JA), [45]-[48](Mullins",https://www.queenslandjudgments.com.au/case/id/512766,queenslandjudgments
4456,808,528(see,"considered in detail in R v Makary [2019]2 Qd R 528(see also R v FAV [2019]QCA 299, [5]-[6](Fraser JA), [45]-[48](Mullins JA)(Henry",https://www.queenslandjudgments.com.au/case/id/512766,queenslandjudgments
4467,809,"[2005]QCA 306,","cited with approval by McMurdo P in R v Cutts [2005]QCA 306, [14], with her Honour quoting: ‘“… there is, on the",https://www.queenslandjudgments.com.au/caselaw/qca/2005/306,queenslandjudgments
4469,809,"[2000]1 Qd R 437,","prefer the formulation by McPherson JA in R v Millar [2000]1 Qd R 437, 439 [7], which is that there must be evidence on",https://www.queenslandjudgments.com.au/case/id/506735,queenslandjudgments
4472,809,[2024]QCA 198,"JA, all members of the Court in R v Kalisa [2024]QCA 198 at [6], [9] and [94] preferred the formulation by McMurdo",https://www.queenslandjudgments.com.au/caselaw/qca/2024/198,queenslandjudgments
4476,809,"[2010]QCA 194,","deciding whether the Crown has negatived the defence(R v Rope [2010]QCA 194, [53]-[56]). Matters Relevant to a Defendant’s Belief The defendant’s intoxication",https://www.queenslandjudgments.com.au/caselaw/qca/2010/194,queenslandjudgments
4483,810,"[2005]1 Qd R 308,","119; (1998)100 A Crim R 430, 434; R v Mrzljak [2005]1 Qd R 308, 321, 326; R v Wilson [2009]1 Qd R 476, [20]).",https://www.queenslandjudgments.com.au/case/id/502988,queenslandjudgments
4486,810,"[2009]1 Qd R 476,","Mrzljak [2005]1 Qd R 308, 321, 326; R v Wilson [2009]1 Qd R 476, [20]). Since the focus is on the defendant’s belief, rather",https://www.queenslandjudgments.com.au/case/id/502013,queenslandjudgments
4488,810,"[2005]1 Qd R 308,","in considering whether a belief was reasonably held(R v Mrzljak [2005]1 Qd R 308, 321, 329-330). In R v Mrzljak [2005]1 Qd R 308,",https://www.queenslandjudgments.com.au/case/id/502988,queenslandjudgments
4491,810,"[2005]1 Qd R 308,","[2005]1 Qd R 308, 321, 329-330). In R v Mrzljak [2005]1 Qd R 308, Williams JA said: ‘[53] The critical fact for a defence",https://www.queenslandjudgments.com.au/case/id/502988,queenslandjudgments
4566,814,[2020]QCA 199,"at [45]-[48], Henry J dissenting at [108]-[111]); R v Kellett [2020]QCA 199 (Morrison JA at [18]-[23], Mullins JA at [128]-[129])). In Makary,",https://www.queenslandjudgments.com.au/caselaw/qca/2020/199,queenslandjudgments
4567,814,(Morrison,"Henry J dissenting at [108]-[111]); R v Kellett [2020]QCA 199 (Morrison JA at [18]-[23], Mullins JA at [128]-[129])). In Makary, the",https://www.queenslandjudgments.com.au/caselaw/qca/2020/199,queenslandjudgments
4577,815,"Millar[[2000]1 Qd R 437,","I prefer the formulation by McPherson JA in R v Millar[[2000]1 Qd R 437, 439 [7]], which is that there must be evidence on",https://www.queenslandjudgments.com.au/case/id/506735,queenslandjudgments
4584,815,"[2010]QCA 194,","whether the Crown has negatived the defence (R v Rope [2010]QCA 194, [53]-[56]; R v Dunrobin [2013]QCA 175, [119]). Queensland Supreme and",https://www.queenslandjudgments.com.au/caselaw/qca/2010/194,queenslandjudgments
4586,815,"[2013]QCA 175,","defence (R v Rope [2010]QCA 194, [53]-[56]; R v Dunrobin [2013]QCA 175, [119]). Queensland Supreme and District Courts Criminal Directions Benchbook (2026",https://www.queenslandjudgments.com.au/caselaw/qca/2013/175,queenslandjudgments
4594,816,"[2009]1 Qd R 476,","Mrzljak [2005]1 Qd R 308, 321, 326; R v Wilson [2009]1 Qd R 476, 482-483 [20]). Since the focus is on the defendant’s belief,",https://www.queenslandjudgments.com.au/case/id/502013,queenslandjudgments
4597,816,"[2005]1 Qd R 308,","considering whether a belief was reasonably held (R v Mrzljak [2005]1 Qd R 308, 321, 329-330). In Mrzljak, Williams JA said: ‘[53] The critical",https://www.queenslandjudgments.com.au/case/id/502988,queenslandjudgments
4604,821,"[2009]QCA 274,","provocation or self-defence’ (R v Lacey; Ex parte Attorney-General (Qld) [2009]QCA 274, [39]). If the evidence of the act grounding s 25’s",https://www.queenslandjudgments.com.au/caselaw/qca/2009/274/pdf-view,queenslandjudgments
4606,821,"[2009]QCA 274,","25 exclude its operation(R v Lacey; Ex parte Attorney-General (Qld) [2009]QCA 274, [36]; following R v Smith [2005]2 Qd R 69, 74).",https://www.queenslandjudgments.com.au/caselaw/qca/2009/274/pdf-view,queenslandjudgments
4608,821,"[2005]2 Qd R 69,","parte Attorney-General (Qld) [2009]QCA 274, [36]; following R v Smith [2005]2 Qd R 69, 74). In R v Dimitropoulos [2020]QCA 75 and Lynch v",https://www.queenslandjudgments.com.au/case/id/511341,queenslandjudgments
4610,821,[2020]QCA 75,"Smith [2005]2 Qd R 69, 74). In R v Dimitropoulos [2020]QCA 75 and Lynch v Commissioner of Police (2022)11 QR 609, defendants",https://www.queenslandjudgments.com.au/caselaw/qca/2020/75,queenslandjudgments
4611,821,"(2022)11 QR 609,","v Dimitropoulos [2020]QCA 75 and Lynch v Commissioner of Police (2022)11 QR 609, defendants unsuccessfully laid claim to s 25 to excuse production",https://www.queenslandjudgments.com.au/case/id/513117,queenslandjudgments
4616,821,"[2014]QCA 328,","a defence to a dangerous driving charge(see R v Sheldon [2014]QCA 328, [36]). Queensland Supreme and District Courts Criminal Directions Benchbook (2026",https://www.queenslandjudgments.com.au/caselaw/qca/2014/328/pdf-view,queenslandjudgments
4618,822,[1980]Qd R 207).,be left to the jury(see for example R v Warner [1980]Qd R 207). 17.11.3 Suggested Direction [Last reviewed: April 2026] Ourlawprovidesthatapersonisnotcriminallyresponsibleforanactoromission done or,https://www.queenslandjudgments.com.au/case/id/503384,queenslandjudgments
4624,826,[1995]1 Qd R 667;,contained in s 31(2)apply to s 31(1)(c)(see R v Fietkau [1995]1 Qd R 667; R v Pickering [2016]QCA 124). The exceptions will be construed,https://www.queenslandjudgments.com.au/case/id/508944,queenslandjudgments
4625,826,[2016]QCA 124).,R v Fietkau [1995]1 Qd R 667; R v Pickering [2016]QCA 124). The exceptions will be construed strictly. In Pickering v The,https://www.queenslandjudgments.com.au/caselaw/qca/2016/124,queenslandjudgments
4628,827,"(2022)12 QR 417,","liable to have such threats made’. In R v Pain (2022)12 QR 417, a member of one outlaw motorcycle gang was charged with",https://www.queenslandjudgments.com.au/case/id/513144,queenslandjudgments
4634,830,[1995]1 Qd R 667;,exceptions contained in s 31(2)apply to s 31(1)(d)(R v Fietkau [1995]1 Qd R 667; R v Pickering [2016]QCA 124). The exceptions will be construed,https://www.queenslandjudgments.com.au/case/id/508944,queenslandjudgments
4635,830,[2016]QCA 124).,31(1)(d)(R v Fietkau [1995]1 Qd R 667; R v Pickering [2016]QCA 124). The exceptions will be construed strictly. In Pickering v The,https://www.queenslandjudgments.com.au/caselaw/qca/2016/124,queenslandjudgments
4638,831,"(2022)12 QR 417,","liable to have such threats made’. In R v Pain (2022)12 QR 417, a member of one outlaw motorcycle gang was charged with",https://www.queenslandjudgments.com.au/case/id/513144,queenslandjudgments
4641,835,"(2023)13 QR 276,","of the relevant residential “building”or “structure”’. In R v Richards (2023)13 QR 276, the Court of Appeal upheld the trial judge’s ruling that",https://www.queenslandjudgments.com.au/case/id/513158,queenslandjudgments
4644,835,"[2013]QCA 339,","of the definition of a dwelling’. In R v McMartin [2013]QCA 339, the jury were incorrectly instructed that the defence was excluded",https://www.queenslandjudgments.com.au/caselaw/qca/2013/339,queenslandjudgments
4651,839,[2006]1 Qd R 458.,"for discussion of s 22. See also R v Waine [2006]1 Qd R 458. For a useful examination of the authorities on ‘peaceable possession’,",https://www.queenslandjudgments.com.au/case/id/503812,queenslandjudgments
4655,841,"[1995]2 Qd R 490,","force to ensure the orderly movement of children(Horan v Ferguson [1995]2 Qd R 490, 500). The prosecution may also negative the defence by proving",https://www.queenslandjudgments.com.au/case/id/503482,queenslandjudgments
4657,841,"[2013]QCA 370,","reasonableness of the [defendant’s]conduct was to be adjudged’(R v DBG [2013]QCA 370, [31]). The defendant’s own views as to the appropriateness of",https://www.queenslandjudgments.com.au/caselaw/qca/2013/370,queenslandjudgments
4659,841,"[2019]QCA 9,","the force used was objectively reasonable(ACP v Queensland Police Service [2019]QCA 9, [26]). 17.16.3 Suggested Direction [Last reviewed: April 2026] Queensland Supreme",https://www.queenslandjudgments.com.au/caselaw/qca/2019/9,queenslandjudgments
4684,850,"[2015]2 Qd R 307,","270 is available on a charge of manslaughter(R v Major [2015]2 Qd R 307, 308 [3], 312 [33]). Applying the same reasoning it would",https://www.queenslandjudgments.com.au/case/id/512469,queenslandjudgments
4690,851,"[1966]Qd R 47),","Major (and that of Hart J in R v Sleep [1966]Qd R 47), however it is consistent with and follows the High Court",https://www.queenslandjudgments.com.au/case/id/510188,queenslandjudgments
4694,851,"[2015]2 Qd R 307,","the use of force to prevent its repetition(R v Major [2015]2 Qd R 307, 312 [37]). It is not necessary for the defendant to",https://www.queenslandjudgments.com.au/case/id/512469,queenslandjudgments
4697,851,"[2015]2 Qd R 307,","of the provocative act or insult being repeated’(R v Major [2015]2 Qd R 307, 309 [5]). There will often be overlap between the issues",https://www.queenslandjudgments.com.au/case/id/512469,queenslandjudgments
4702,856,[2000],the following cases may be of assistance: R v Bojovic [2000] 2 Qd R 183; R v Gray (1998)98 A Crim,https://www.queenslandjudgments.com.au/case/id/509302,queenslandjudgments
4703,856,2 Qd R 183;,following cases may be of assistance: R v Bojovic [2000] 2 Qd R 183; R v Gray (1998)98 A Crim R 589; [1998]QCA 41;,https://www.queenslandjudgments.com.au/case/id/509302,queenslandjudgments
4705,856,[1998]QCA 41;,R 183; R v Gray (1998)98 A Crim R 589; [1998]QCA 41; R v Prow [1990]1 Qd R 64; R v Muratovic,https://www.queenslandjudgments.com.au/caselaw/qca/1998/41,queenslandjudgments
4706,856,[1990]1 Qd R 64;,(1998)98 A Crim R 589; [1998]QCA 41; R v Prow [1990]1 Qd R 64; R v Muratovic [1967]Qd R 15; Marwey v The Queen,https://www.queenslandjudgments.com.au/case/id/511458,queenslandjudgments
4707,856,[1967]Qd R 15;,R v Prow [1990]1 Qd R 64; R v Muratovic [1967]Qd R 15; Marwey v The Queen (1977)138 CLR 630; [1977]HCA 68; Zecevic,https://www.queenslandjudgments.com.au/case/id/503098,queenslandjudgments
